Unnamed: 0,user_key,tweet_text_only
65037,_nickluna_,Great! Someone start a  request on State Dept visitor logs Let's see if Clinton camp is telling the truth
65038,jeannemccarthy0,Obama Quietly Reveals SINISTER Plan! – BB4SP
65039,lazykstafford,HOT DISH POLITICS
65040,jeannemccarthy0,Hmm so this is the loser that thought he could sabotage Trump's Electoral College vote? 😂😂
65041,traceyhappymom,Although you are as interested as ever in getting ahead in you More for Capricorn
65042,evagreen69,Bill Belichick
65043,march_for_trump,Put that tape back in your ass You have a rapist in your team We have a real man who recognizes his mistakes in o…
65044,houstontopnews,Rep Louie Gohmert: Islamic preacher Anwar al-Awlaki killed to cover Obama administrati
65045,_nickluna_, that's gonna be a total mess
65046,michellearry,thinking before speaking
65047,blacktolive,"Damn, that's the funniest thing I have seen so far 😅😅😅"
65048,dorothiebell,MUST READ: Trump and the American Divide | City Journal        https…
65049,baobaeham,A New  campaign! 'D2K Plus - Affordable DLP 3D Printer'
65050,evagreen69,"Thank you for admitting ""Hope and Change"" was utter bullshit"
65051,datwisenigga,Damn who knew removal of all the hateration and holleration was so good for your skin?
65052,hyddrox,"Bluebonnets on Mopac, spring break traffic, and  make this gal's commute a-👌🏻"
65053,c__wells, Happy  !
65054,paolakinck,I am watching the Values Voters Summit  GREAT SPEACHES! Must Watch!      c…
65055,laurabaeley,New post: BOOM! HOLLYWOOD CONSERVATIVE Calls Out OSCAR Crowd For Double Standard On Refugees
65056,baobaeham,"Jul 29, 1968Pope Paul VI issues encyclical Humanae Vitae, prohibiting all unnatural forms of birth control"
65057,leroylovesusa,MT  Mexi Pres has strong immigration laws  stop taking US welfare &amp; take care of your own ppl https…
65058,gloed_up,"black kids already being victimised in school, gay couple threatenedwhat's next? 
things are getting too dangero…"
65059,jacquelinisbest,Iraqi Kurdish Forces Advance on IS-Held Town East of Mosul - ABC News -  via 
65060,tpartynews,Imagine that these young girls  were your sisters or daughters And some dirty animals beat them
65061,giselleevns,"blaming third party voters I have to blame someone, right?"
65062,imissobama,A criticism of the institutional left is the tendency to seek middle ground We're seeing that already The GOP expects th…
65063,jacquelinisbest,IS A  LOBBYIST! ESTABLISHMENT-INSIDER! Clinton Reid Pelosi Rahm Schumer DONOR!
65064,jeffreykahunas,"DON'T WAIT‼️ARREST THE THREE,  Paul Ryan and Mitch McConnell Meet Obama to Plan Fall Agenda - https:/…"
65065,leroylovesusa,  I voted third party for the first time ever today and I'm not ashamed of it either
65066,nojonathonno,Darling of the Drug War: Hillary Clinton Campaign Funded by Private Prison Lobby  via 
65067,kathiemrr,I Wont Miss You
65068,pamela_moore13,"Attack at Penn Station
Unlike traitors Obama &amp; Hillary, Trump always taking time out to thank our police officers!"
65069,emileewaren,"Pick a side, conservative media Stand or sit like cowards Your choice"
65070,worldofhashtags,"For people not to call it the Obama ""Liberry"""
65071,melvinsroberts,"CK hates when people steal her tweets, but in this caseepic fail"
65072,hiimkhloe,The evil bastard killed even pastor That’s intolerable
65073,patriotblake,Sure will miss President Obama at the National Prayer Breakfast Always did like his updates on the Crusades
65074,dorothiebell,Haha  I love it Keep it trending
65075,jasper_fly,cockfight
65076,newarkvoice,READ: Excerpts of Hillary Clinton's upcoming acceptance speech at DNC 2016
65077,j0hnlarsen, If not him it sure as hell was you
65078,johnbranchh,We're streaming  &amp;  in approx 45 mins They'll be talking hip hop &amp; the canon Tune in! https:…
65079,finley1589,Obama is giving away our internet in 20 days The Clock Is Ticking And Most Don't Even Know Or Care!
65080,cookncooks,"Ted Cruz vows to do ""everything humanly possible to defeat Hillary Clinton"""
65081,laurabaeley,I'm sure Melania Trump will be reaching out to Chuck Jones very shortly since she cares about  and such
65082,kathiemrr,play with my imaginary friend
65083,brianaregland,Random thought/lesson learned:
65084,ramonasnails,▶ Donald Trump's Very Weird Russia Thing  
65085,hyddrox,Suspect in House Democrat IT Scandal ALSO Had Access to Leaked DNC Emails
65086,jeannemccarthy0,Trey Gowdy Obama I'M LOCKING YOU UP ON INAUGURATION DAY !!!
65087,kansasdailynews,Post-convention poll: Clinton retakes lead over Trump
65088,datwisenigga,At all
65089,mrclydepratt,This is why people drop out
65090,richmondvoice,Trump dismisses GOP calls to quit race: 'Never'
65091,melvinsroberts,"about friendzone ""privileges"" a guy holds"
65092,michellearry,There’s Only One GOP Candidate Who Wouldn’t Lose to Hillary Clinton in New National Poll
65093,kathiemrr,it only and only meant going places I can't even pronounce
65094,cassieweltch,"What is ""Pay for Play""?"
65095,ameliebaldwin,Chip in and help build the WALL
65096,kathiemrr,"The Lion, the Witch, and the Bathrobe  "
65097,lazykstafford,      😊🎓
65098,gvardeykalena,emails:  strategy diversion for
65099,patriotraphael,Someone Tell the  Media=&gt; Trump Appoints Most Female Members to Cabinet in History
65100,thefoundingson,George Soros loses lots of money betting against the markets after Trump won
65101,ten_gop,"""I want to close the Dutch borders My constituents don't want more refugees"" ~ Geert Wilders"
65102,evewebster373,"Charles Krauthammer: Iraq, Syria - admit the old borders are gone"
65103,c__wells,"Find someone that's worth your time, your smiles, and your laughter"
65104,notritahart,Job? What job?
65105,giselleevns,The Big Chill
65106,melanymelanin,Black history IS US history And the struggle hasn’t been pretty This picture is only 75 years old
65107,politweecs,GTA (Grand Trump's Apologies
65108,emileewaren,"This is such a Connecticut afternoon Two hundred year old family farm, fresh egg nog, hot cider"
65109,brianaregland, looks like we've got a consensus here
65110,mrclydepratt,90 Magazine Interview with talented Model/Artist Lance aka  in issue 16
65111,jacquelinisbest,GOP won’t address IRS scandal because    election season
65112,drmichaelgarcia,"the gop died let it rest in peace Bring back the Congress to the Democrats and stop gop obstructionism, vote blue…"
65113,queenofthewo,Chick dies He cries
65114,garrettsimpson_,
65115,giselleevns,"'No offense, but' - grants an instant forgiveness for any nasty shit you're about to say Some think it works this way"
65116,atlanta_online,Why President Obama will be in Atlanta on Monday  |
65117,onemightyfish,Donald Trump!!!! The Community Is In A Uproar
65118,ameliebaldwin,This will never end
65119,traceyhappymom,
65120,_nickluna_,Christmas bloat
65121,kathiemrr,if you're cooking for people you hate remember you have all the power 😈
65122,emileewaren,   This started as a hastily put together Facebook event a few hours after the election Unrea…
65123,heyits_toby,Pre-Game warm up hype: MVP Stephen Curry's most ridiculous cross-overs:
65124,jacquelinisbest,Fake news:
65125,anthonywoodboy,🇺🇸
65126,nataturn,Tigers Last Stand: Woods Shoots 6-Under 64 In First Round Of Wyndham Championship
65127,_nickluna_,TORONTO MUSLIMS: SHARIA Allows Death To Nonbelievers And It's OK To Rape A 9-Year Old [VIDEO]  v…
65128,ameliebaldwin,💥💥 PROVEN LEADERSHIP
65129,bruciedublin,why you would vote for  knowing she lies and put our national security at risk?
65130,giselleevns,Thanks for the game! You're awesome! ❤️
65131,daileyjadon,Money's on the Dresser
65132,jacquelinisbest,"Profits are down at ExxonMobil, but don’t cry for CEO Rex Tillerson"
65133,paulinett,▶ How the Government Blackballed Wesley Snipes
65134,judelambertusa,Dershowitz: Hate Speech Laws a 'Dangerous Trend'
65135,judelambertusa,Check it out here are the top 6 natural  :
65136,anthonywoodboy,Stock up for your next vacay &amp; we’ll set you up w/ exclusive Lilly travel accessories &gt;
65137,brianaregland,Rogue one a Star Wars cash grab? Find out what the fuss is about here  or here
65138,ten_gop,"This is what Dems really think of Hispanics and Latinos! 
Pls RT to make it viral!"
65139,screamymonkey,"US says 'words matter' after Obama, Duterte meeting canceled"
65140,klara_sauber,These people are for real?? I always thought  was some internet meme 
65141,melanymelanin,Evil: She whispered she was married
65142,westernwindwes,1ST RALLY TODAY!
65143,queenofthewo,Ham and cookies overload
65144,datwisenigga,Make Dat Ho Bounce ft DK (Prod by by John Vuitton  Get app👉
65145,newspeakdaily,Trump Said to Use Charity Money to Settle Legal Problems:
65146,c__wells,So if they raise the minimum wage to 15 for unskilled jobs will my pay be raised as a skilled electrician? Or do cashiers de…
65147,patriotblake,Shut up u fool!!
65148,hyddrox,Moreso
65149,sternandreas404,Ich setze meine Hoffnung auf
65150,thefoundingson,is another entitled Hollywood star who's peddling anti-Trump hysteria Stop misguiding young Americ…
65151,donnabrivera,"I'm in line, its a mile long! Has to be 10k people  so far and it don't start until 1…"
65152,puredavie,"If she's crying, don't say anything Just hug her"
65153,paolakinck,"Bannon and Conway have really gotten Trump on his game since taking over Amazing job, I have to say"
65154,ameliebaldwin,Donald Trump Picks Jeff Sessions for Attorney General Clinton Foundation Ind…
65155,traceyhappymom,Sesame Streetfighter
65156,ameliebaldwin,HRC couldn't even tell the whole truth about who received Comey's letter Friday Dems received the letter! Truth is…
65157,whitehousecards,Хиллари Клинтон связала предвыборную кампанию Трампа и взлом серверов Демократов
65158,kenzdonovan,Trump is increasing his lead in today's LA Times poll He's now ahead of  with 45%!
65159,rh0lbr00k,"Because of Trump  fueled by patriotism, while Hillary seems to be allergic to it"
65160,heyits_toby,There Is A Secret Room On Top Of The Eiffel Tower And This Is What’s Inside | World
65161,malloryjared,Minority lawyer thought leadership needs to integrate digital and print media for greatest reach
65162,jenn_abrams,Socialism is so great that thousands of people in Venezuela go to the streets to protest against it
65163,daileyjadon,The extent of Theresa May's control over the nation's simpleton is absolute She's even made him have the same hairdo https:…
65164,tpartynews," ""I'll always have your back"""
65165,judelambertusa,Danger 4 most of us lies not in setting our aim too high
65166,michellearry,throws  at his roommate—
65167,finley1589,"Trump wins these four, he's literally a single state away from WH"
65168,daileyjadon,think if it never existed I would probably be on facebook the most thanks  for taking me a…
65169,patriotraphael,Double tap if that man got hops!
65170,baobaeham, The GOP snake is eating his own tail It's fascinating to watch! Can't wait til the whole Trump team go…
65171,giselleevns,
65172,micparrish,as soon as government gets interested in lying to us information gets biased ASAP
65173,carriethornthon, 
65174,judelambertusa,Vital problems are now blinded by these gay marriages!
65175,rh0lbr00k,Look at how her hands are clinched into claws behind her back  She's stiff like a board
65176,rh0lbr00k,🇺🇸Gov Mike Pence Rally TODAY
65177,ameliebaldwin,What a Sane Person Would Call Common Sense Vetting Sends Libs Into a Conniption You Have to Wonder - Are They Dumb as…
65178,jenn_abrams,Who will win the presidency?
65179,traceyhappymom,
65180,kenzdonovan, 
65181,hiimkhloe, Just shut up and go away
65182,kathiemrr,"Lost Bowie, kept Kardashians 😡"
65183,giselleevns,
65184,jenn_abrams,Soros machine!
65185,emileewaren,Remember ppl hated to have the outsider Ronald Reagan!  will also be a GREAT president and …
65186,garrettsimpson_,  Eight years of telling us to pay no attention to the man behind the curtain Good riddance…
65187,jeanuttella,‘He is a flat-out racist’: Ana Navarro rains down hell on eye-rolling Trump surrogate
65188,queenofthewo,
65189,malloryjared,"Real rappers is hard to find, like a remote  – Common"
65190,lagonehoe,"Arizonans want leadership, not an obstructionist Vote tomorrow and make your voice heard!   https:…"
65191,datwisenigga,djs Get 1 million  plays $3599 click here for more details  we do
65192,imissobama,Devastating new ad
65193,cassieweltch,"We walked in want somethin’ bottles pop like we won something, raise a glass for err’ybody that’s done something from nothin’  – Fabolous"
65194,newarkvoice,Hillary Clinton hits Christie on Bridgegate after his fiery RNC 2016 speech
65195,lazykstafford,Sarah Palin Sounds Off Guns Control &amp; Self-Defense… ‘We Have Enough Gun Laws On The Books’ – BB4SP
65196,paulinett,"You know how we could find out, right?"
65197,mil0blake,"Christians soldiers can no longer express their religious beliefs in uniform Muslims do this at the Pentagon! Right church,…"
65198,westernwindwes,   Bernie is better I guess
65199,garrettsimpson_,"MT  To save America, we must turn to God through His Son, Jesus Christ"
65200,hyddrox,Weird I thought it wasn’t a ban
65201,evagreen69,enough broken hearts
65202,puredavie,"Mom And Dad, I Have Something To Tell You I Can't Live A Lie Any Longer I Am Coming Out As A Rep…"
65203,melanymelanin,"UPDATE 3-S Africa cenbank gov says shocks to inflation, growth cause uncertainty: * S&amp;P due   vi…"
65204,thefoundingson,"If you think that  is too rough with illegal immigrants, take a look, it's your future…"
65205,mil0blake," BOLD, FEARLESS, DETERMINED LEADER! FIGHTS for FREEDOM!"
65206,priceforpierce,MT   has very often done things alone Now millions stand by his side
65207,hyddrox,"Obama Credits US Olympic Success to Immigrants 'Coming over the Rio Grande,' Freedom to 'Love as We Please'"
65208,jeannemccarthy0,Nice job with your endorsement JEB!
65209,mr_clampin,  Ms Schneider stated this several years ago I used to get eye-rolls when I brought it up to…
65210,jacquelinisbest,
65211,puredavie,Hot sauna and snow
65212,judelambertusa,"""Our leaders are dummies They don't know what's going on It's true, they're incompetent"" ⚊ "
65213,hyddrox,Rock is to metal as country is to bluegrass Is that an accurate assessment?
65214,willisbonnerr,Video) MLB: The Hunt Is On For Anti Orioles Beer Can Throwing Fan
65215,c__wells,Frosty Meadows
65216,laurabaeley,"Draghi on Trump administration: ""radically new"""
65217,ten_gop,Today Donald Trump opened another beautiful property &amp; created more jobs in 1 day than Hillary in her entire life…
65218,baobaeham,Wow
65219,micparrish,Can you exercise with your partner?
65220,garrettsimpson_,"The world will not be destroyed by those who do evil, but by those who watch them without doing anything ― Albert Ein…"
65221,micparrish,No words can explain the way I’m missing you
65222,ryanmaxwell_1,US Soldiers Used ‘Restraint’ in Kabul Confrontation
65223,mr_clampin,Clint EasterBunnyWood
65224,patriototus,"Seeing a smiling old man who has spent his best years serving our country is like a blessing
God bless veterans!"
65225,paulinett,▶ Ex-prisoner gets $400G after brutal attack by correction officers -- who remain active
65226,patriotblake,Illegal Alien Beheads His Mother In North Carolina…    NORTH CAROLINA!!
65227,c__wells,Hey  teach these rats a lesson and skip the debate These Commies will lose millions  because …
65228,emileewaren,"  stating and sharing all the cheating and unfair treatment your voters, volunteers and delegates w…"
65229,ten_gop,Donald Trump had 100 times more people in Scranton just two weeks ago than Hillary today
65230,jenn_abrams,Journalism is dead Trump is president-elect  
65231,jeannemccarthy0,Iran can't be trusted!
65232,tpartynews,"Mayor Rudy Giuliani: ""Mrs Clinton has violated easily 20 or 30 federal laws"""
65233,malloryjared,elections hack 'leaks voter data' hack by  Philippines
65234,daileyjadon,=    I WANT IT ALL MARCH
65235,ameliebaldwin,BREAKING: Hillary Clinton shuts down plane Conference when asked about DNC Operatives corruption
65236,giselleevns,This tastes like shit and I know what shit tastes like
65237,mil0blake,Prayers are with those in  It is so tragic that so many hateful acts of violence occur so frequently
65238,tpartynews,"Hard-working, tax-paying, legal Americans stand w/ Donald Trump!"
65239,hiimkhloe,Angelic Sequin Tassel Dress
65240,_billy_moyer_,I love the guys
65241,queenofthewo,A Leap of Faith
65242,traceyhappymom,in the back garden whilst steve is cutting the hedge
65243,kathiemrr,"The milk you used for the sauce, was actually from the breast pump!"
65244,washingtonline,Martin O’Malley becomes potential third candidate for DNC chairman
65245,klara_sauber,""" eine Auseinandersetzung mit der Schoa nicht mehr notwendig oder selbstverständlich scheint"""
65246,michellearry,Says a supporter of Bill Clinton
65247,leroylovesusa,Boys U gotta QUOTA!!! Lee Daniels on 'whiny'  controversy: 'Stop complaining'
65248,paolakinck, Hillary took Millions from mass murdering dictators who imprison rape victims in her corrupt slush fun…
65249,cassieweltch,I really wish my cat did not get into my Viagra
65250,carriethornthon,"ISIS must need more weapons or pressure cookers,,,WHAT A POS"
65251,ameliebaldwin,Read  Hillary Lies At Debates
65252,jeffreykahunas,"""A man's character is his fate"" - Heraclitus"
65253,patriotraphael,Sen Pat Toomey says next president  - not Obama - should pick Justice Antonin Scalia's successor
65254,baobaeham,"- RT &amp; call  and demand he votes NO on   edu pick,"
65255,giselleevns,take crack selfies
65256,kathiemrr,
65257,austinlovesbeer,Punk vs Metal
65258,judelambertusa,Ben Carson  probably  wants boots on the ground to fight terror
65259,traceyhappymom,I'm an introvert
65260,politweecs,"caught on tape making extremely ride, sexually aggressive comments about women"
65261,hollandpatrickk,MSM finds it perfectly acceptable to talk about murderous fantasies Live On Air
65262,emileewaren,"Somebody inside the  better step up/come clean with who on the inside, is covering for"
65263,lazykstafford,You won't believe what's in your food You probably ate one of these today Check these now!
65264,baobaeham,AKROBATIK BY ASKEM 
65265,willisbonnerr,"Fast Company: 7 Ways Streaming Music Will Change in 2017, After Another Crazy Year"
65266,ameliebaldwin,House Committee Subpoenas Three Clinton Tech Specialists
65267,cassieweltch,I don't know   I'm always the one that brings the handcuffs
65268,dorothiebell,
65269,evagreen69,BREAKING: US Lawmakers Make Stunning Move To Investigate Obama For Helping ISIS
65270,ryanmaxwell_1,The gay couple who harassed Ivanka don't represent me or the LGBTQ community
65271,baobaeham,Populist Geert Wilders fails to live up to hype in Dutch elections
65272,hiimkhloe,This is why I only eat spinach I've cleaned personally SMH Restaurants never put in the effort to clean spinach well
65273,jacquelinisbest,RT  Utah AG says he’ll sue Obama over national monument  …
65274,wonderhann,What do you need in your life in Calcutta Cup week? The Ruck podcast of course Listen in here
65275,datwisenigga,Listen to Good Pussy by PReZ rap  on
65276,mrclydepratt,See  Unplugged  powered  in a city near you get ready ladies!  https:…
65277,cassieweltch,Do Me (Until Matlock comes on
65278,ameliebaldwin,"CNN  this birther issue ridicules while 50 million people on food stamps, 25M more since Obama POTUS https…"
65279,hiimkhloe,6 shots in the chest
65280,hyddrox,I would so go to Pamplona for that
65281,tpartynews,"BREAKING: FBI Agents to Examine 650,000 Emails on Anthony Weiner’s Computer"
65282,jeffreykahunas,    most Americans pay high premiums &amp; high deduct-r self in…
65283,batonrougevoice,John Bel Edwards: Now is not the best time for President Obama to visit
65284,_nickluna_,يتوجه إلى  بـ15 لاعبا
65285,jani_s_jac,Ivanka Trump Vacations with Putin's girlfriend!   Clinton 47
65286,jasper_fly,TRUMPERS THREATENED ELLIOTT'S LIFE  HE LEFT US THE NARRATIVE  THE TRUTH THIS IS THE STRATEGY TWEET AND RETWEET TRU…
65287,leroylovesusa,2007 Cavs Is The Worst Supporting Cast In NBA History &amp; LeBron Led Them To The Finals
65288,michellearry,"""Culture fit"" is usually a BS concept, but it doesn't have to be:"
65289,southlonestar,"True that
GOP will be changed or it will be destroyed"
65290,jamie_mccarthy_,Could Trump Actually Win the 2016 US Presidential Election? An Analysis of Social Media Data  //
65291,laurabaeley,World War 3 Has ‘OFFICIALLY’ Started
65292,mil0blake,Do wacha ya do!
65293,paulinett,★ Alabama NAACP to Protest Jeff Sessions Nomination Today (01-03-17
65294,ameliebaldwin,79  The existence of Jeffrey Epstein and his connections to the Clinton Foundation and Bill Clinton
65295,giselleevns,An anti bullying course that includes teaching the power of kindness  Lessons that many people have yet to learn
65296,melvinsroberts, 
65297,kansasdailynews,WikiLeaks walks back Assange claim on hacking Trump tax returns
65298,donnabrivera,"New Hampshire  All aboard!  Choo Choo, all the way to the White House! "
65299,patriotraphael,CHELSEA  Clinton CONFUSION: 'President Sanders'  via 
65300,evewebster373,Navratilova ends coaching role with Radwanska
65301,hyddrox,HILLARY COMES OUT BASHING TRUMP BUT NEVER REALLY TALKS ABOUT THE REAL ISSUES 2BE A PRESIDENT &amp; WHAT T DO
65302,lazykstafford,Ever wonder why Tapper is so cozy w/ the Clintons?
65303,fishalexanderr," Sehr geehrte Frau Künast
wir glauben,  sie ist es würdig! Was meinen Sie?"
65304,michellearry,Sir Alex Ferguson has won 5 Premier League titles &amp; been retired for 2yrs since Arsene Wenger last won the PL
65305,giselleevns,my TV would stop telling me what to do
65306,cookncooks,Everyone get out
65307,paulinett,"don't let people twist this, adding BLM to the # is slick and misleading 4 people are responsible, not a…"
65308,jasper_fly,Leave early
65309,thefoundingson,Instead of refuting everything he published with solid evidence they just try to silence him It in itself is telli…
65310,ameliebaldwin,Remarks In
65311,ten_gop,"""Anyone who votes for Hillary Clinton is aiding and abetting a felon"" ~ 

RT if you agree!"
65312,patriotblake,"""Everybody loves classical music, they just haven't found out about it yet"""
65313,kansasdailynews,Judge in Texas temporarily blocks Obama’s transgender rules
65314,jacquelinisbest,The New Right vs the Alt-Right
65315,ryanmaxwell_1,"New post: ""Inauguration highlights Trump's infrastructure opportunities"""
65316,ameliebaldwin,actually promotes fundamental Islam and misogyny
65317,giselleevns, two words for you Bacon
65318,melvinsroberts,"Still lovely Even with just a night light and you make me laugh What's not to love, you and  make my day…"
65319,westernwindwes,take care!
65320,kansasdailynews,Trump suggests US accept Russia’s annexation of Crimea
65321,leroylovesusa,Chicago Way? Yet another alderman is accused of corruption -
65322,paulinett, is releasing a new performance hijab for Muslim female athletes
65323,evagreen69,Where's Coverage of Clinton rape victim Juanita Broaddrick?:  American Thinker   htt…
65324,queenofthewo,Crtl - Alt - Del
65325,jeannemccarthy0,"""Over 100 refugees, mostly South Asians, go on hunger strike over Thanksgiving"""
65326,puredavie,90  1) 1 day 1e of you boys may end up here as president 2) ooh I'm so gonna change the colorz firzt
65327,micparrish, O's admin works!  is a hoax based on
65328,brianaregland,I can't believe you all have told me I look like the Pokemon Dratini and a young Princess Anne
65329,laurabaeley,"""Journalist Eva Bartlett DESTROYS Mainstream Journalist Over Syria, Aleppo"
65330,tpartynews,"I believe we, Americans, are smart enough to make a right choice"
65331,karenparker93,i was a democrat for so long I'm switching to republican now Obama and Hillary show no intent to protect us…
65332,hollydler,"And he wants to foist another scam artist on us, Hillary Clinton!"
65333,_nickluna_,Trump now has access to nation's most valuable intelligence |
65334,westernwindwes,       
65335,kathiemrr,Winter is coming
65336,hyddrox,"Develop this mindset &amp; it will change your world &amp; bless you!   SHORT READ: ""The Blessing and Power of Unity!"""
65337,garrettsimpson_,Family stranded near Grand Canyon rescued amid winter storm in 'Christmas miracle'
65338,willisbonnerr,"Don't just throw a party, Design Your Own Party!  Let  help you design the perfect customized party!"
65339,prettylaraplace,Where is the Media Outrage!?
65340,brianaregland,You really don't need to be spending that much in products anyway It's about regimen and finding what works
65341,garrettsimpson_,"“and He said to me, “Arise, go out into the plain, and there I shall talk with you””"
65342,patriotblake,
65343,thefoundingson,Liberal Logic 101
65344,baobaeham,"Trump yesterday: ""I don't know about that I haven't seen it What report is that?I haven't seen that I'll look into th…"
65345,lazykstafford,"Sorry, Trump train is Hillary light, she will own you  Good luck Trump doesn't want us "
65346,leroylovesusa,MT  'Every time we run to the middle we lose It happens over
65347,jacquelinisbest,Watch: Bill Clinton Fall Asleep During Hillary’s Speech
65348,datwisenigga,In these  parties with  
65349,_nickluna_,Psychiatric Industry Corruption: 6 Year Old Boy Committed To a Psych Ward For Throwing a Temper Tantrum at School https:/…
