Unnamed: 0,user_key,tweet_text_only
67270,todaycincinnati,Donald Trump Calls Obama ‘Founder of ISIS’ and Says It Hono  |
67271,patriotraphael,Teen milks $28K from teacher in ‘sextortion’ plot
67272,evagreen69,for going on vacation while the country was falling down
67273,mil0blake, appoggia  in cambio del figlio n Parlamento? Se vero urgono manette
67274,evewebster373,ain’t got no time for haters! Hear what she has to say to her critics HERE!
67275,c__wells,
67276,dailysanfran,"Clinton says, ‘I’m feeling great’; had left 9/11 event early"
67277,emileewaren,"Clinton advisers point fingers at Huma Abedin, inner circle for loss via the  App  WITH hilLIARy"
67278,ameliebaldwin,"Bill ""Make Adultery Great Again"" Clinton says Donald Trump is not presidential 😂😂😂😂😂😂"
67279,brianaregland,!!!
67280,michellearry,Saudi Arabia has granted full rights to women!
67281,evagreen69,i never smoked me no cigarettes
67282,queenofthewo,How Happy The Whos down in Whoville Are
67283,stanleyparris,New York City students walk out of class to protest Donald Trump |
67284,cynthiamhunter,While  issued a  tweet at 12:24am- Crooked's team was busy strategizing ad buys on t…
67285,cassishere,"Right from Obama's mouth,  ""can't be trusted and is not qualified to be President"""
67286,evagreen69,Rejoice with your family - it's the best what exists in the world
67287,ten_gop," has smth to say about Hillary's constant lies!
Please spread it!"
67288,cookncooks,Canoe Basics: The J-Stroke Paddle | The Art Of Manliness
67289,datwisenigga,I'll Be Back by  on app at
67290,cassieweltch,Feel my name dripping along your thighs
67291,michellearry,Obama is staying in DC to do the one thing he does well - f*ck things up
67292,brianaregland,Hahaha nice!
67293,queenofthewo,Cheech and Chong's Van Nuys Dreams  
67294,heyits_toby,Bowe Bergdahl Court Martial also Indicts Barack Hussein Obama -  -  … -
67295,judelambertusa,"Ya look so cute sitting in your boat, I want to suck out your eyeballs"
67296,patriotraphael,
67297,cookncooks,Watching  drive the  insane is priceless: like putting a halogen light on a basement full of scurrying…
67298,queenofthewo,How much money you figure is in there?
67299,hollydler,Hillary Clinton will NEVER Convince Me That This Is Normal To See In America I say NO to her 550% increase in refu…
67300,ameliebaldwin,
67301,ameliebaldwin,Minister van buitenlandse HANDEL spendeert ontwikkelingshulp-geld om grootste economie ter wereld aan te vallen
67302,queenofthewo,Forced to watch  is the ultimate  Torture!
67303,judelambertusa,is proud to be on the list of 19 websites named
67304,jacquelinisbest,
67305,micparrish,EPIC: How These Hard-Core Americans Responded When ISIS Threatened “Draw Muhammad”…   http:…
67306,pamblmdaniels,You had $100 sitting around &amp; you gave it to a Trump campaign office instead of like an organization that supports undocumen…
67307,mr_clampin,if you aren't good at math you're nothing
67308,melvinsroberts,"To instagram filter my dick pics so that they evoke a more gentle, cool Wes Anderson vibe"
67309,chrixmorgan,Knowing that this US presidential election came down to Trump and Clinton
67310,cookncooks,UPDATE: 32 US governors now oppose or refuse unvetted Syria refugees into their states
67311,paulinett,"  I was surprised to find in CLE that multiple DUIs does NOT = ""criminal record"""
67312,patriotblake,is the most vile corrupt woman on the planet - people are right to cal her Jezebel - if you do not know wh…
67313,_nickluna_,The PoliticusUSA Daily is out!
67314,jasper_fly,Rage Against the Breathalyzer Machine 
67315,giselleevns,Abbra Crappus when you realize that your one nighter has not left yet and it's 9am
67316,worldofhashtags,or Trump it will officially be the darkness before the Dawn
67317,datwisenigga,"North Dakota: Police Raid Pipeline Resistance Camps, Arresting 33"
67318,ryanmaxwell_1,Obama vs Brexit
67319,heyits_toby,Stop the CIA Coup - The Deep State versus Donald Trump -
67320,kateritterrrr,Control the food control the media Arm the police like the military and take their guns away It's  plan
67321,antonhayhay,"The Trump Effect TX AG, ME Governor, D Duke, etc    "
67322,lazykstafford,"The failing  finally gets it - ""In places where no insurance company offers plans, there will be no way for Ob…"
67323,jaydaastonishin,Erica Garner rips Clinton camp over emails on her father's death
67324,mil0blake,What Does Your Hair Say About Your Health?
67325,mrclydepratt,"""Its Time"" Phenom  - "
67326,_nickluna_,NOAA Sued for Climate Data Scandal Docs
67327,hollandpatrickk,Wrong The German people pose the greatest threat to Merkel's plan of submerging Germany with third world people
67328,chadsloyer,KEEP MESSING WITH TRUMP AH NYT! New York Times profit slumps; print advertising sales down 19%  via…
67329,datwisenigga,mood:
67330,cookncooks,Have a great day   sign up now I won't let you down 😊💯💪
67331,melanymelanin,◆ Beautiful illustrations done using flowers
67332,garrettsimpson_,Are you on Instagram? Follow Judicial Watch to get a behind the scenes view of JW and see our Instagram Stories! https:/…
67333,thefoundingson,homeless veterans
67334,priceforpierce,WAR IS PEACE
67335,cookncooks,
67336,anthonywoodboy,"The last of the ""Angola Three"" inmates is ordered released from Louisiana prison farm:"
67337,paulinett,"Aja Brown is 34 years old and the mayor of Compton, California Aja made history as the City's youngest elected Mayor…"
67338,todaycincinnati,Donald Trump Criticizes Muslim Family of Slain US Soldier  |
67339,willisbonnerr,Hold Cops Accountable - Sign the Petition!  via 
67340,rh0lbr00k,CIA chief expects more data leaks before election
67341,staywoke88,Is it me or do most ppl who try to defend/explain Trump's behavior sound like they're just talking in circles?
67342,cassishere,Just 57 Percent Of Clinton Foundation Budget Actually Went To Charitable Grants
67343,baobaeham,Educate Enhance All Products Ebook Package
67344,garrettsimpson_,"In the Ordovician Period, a day lasted 21 hours, there were 417 days in a year, &amp; nautiloids grew to the size of giraffes"
67345,jasper_fly,I am ahead of schedule
67346,baobaeham,We love this art by  A little  some  Check this guy out! Awesome stuff 
67347,jeffreykahunas,Truly Helpful Read! Open Up and Say Ah: At-Home Dental Care for Pets
67348,willisbonnerr,Add your Alexandria EVENT Here:   FREE!
67349,datwisenigga,Day 11
67350,queenofthewo,I just started watching series  It's my first episode
67351,ameliebaldwin,Happy to be apart of History! The energy was incredible for      🇺🇸 htt…
67352,thefoundingson,Socialism at its best
67353,hyddrox,"Putin's first target was the free press, after he was criticized over Kursk submarine disaster Called press traitors, pers…"
67354,screamymonkey,US Senator Warren urges Obama to replace head of SEC
67355,dorothiebell, Trump isn't helping any american dream don't be stupid
67356,laurabaeley,European Governments Had All Info To Prevent Berlin Terror Attack – Derrick Broze Analysis
67357,cookncooks,"I know he's getting pantsed on the world stage, but don't let him get away with his 'clean coal' horseshit either https:/…"
67358,cookncooks,Transcript Released: Trump-New York Times Sit-Down Heavy on Bannon Talk via The Geller Report - 
67359,chrixmorgan,I have some crosswords issues
67360,traceyhappymom,Bands breaking up
67361,cookncooks,"Not a single vote was cast for President Bannon And yet, he is your president now"
67362,patriotblake, Trump doesn't scare me as much as those who support Clinton and her monarchy of court jesters
67363,garrettsimpson_,Why We Are In So Much Debt? ReTweet
67364,paulinett,It's a Blackman thing  
67365,cookncooks,NoTrumpeounus! To make all of your Trump supporting relatives not mention his name at  &amp;
67366,willisbonnerr,Why your  is bigger than your body
67367,jeannemccarthy0,"Priebus Goes to War, says will not let media 'delegitimize' "
67368,daileyjadon,
67369,mil0blake, praises  in new  film:
67370,heyits_toby,Happy 70th Bill!
67371,worldofhashtags, discovered emoji
67372,priceforpierce,"I have dreamt of an open world, Borderless and wide, Where the people move from place to place, And nobody's taking sides -Yusuf Islam"
67373,ameliebaldwin,VIDEO: Funeral for  Det  - WATCH
67374,evagreen69,Gorka: Left Cares About Alinsky Tactics and Political ‘Triangulation’ More Than Safety of Americans - Breitbart
67375,jeannemccarthy0,Another bit of testimony to  belief in amicable disagreement!
67376,mr_clampin,Dave Parker Lewis Can't Lose
67377,baobaeham,This weeks   are 2 artists from   wit  &amp;
67378,westernwindwes,I never want my children or I represented by an empty seat That's why I carry   
67379,mil0blake,FreeRepublic: Why a top food poisoning expert wonât ever eat these foods
67380,cookncooks,climate change is directly related to global terrorism  https:/…
67381,ameliebaldwin, guest says nobody likes Collapsing Hillary Clinton NOT even the guy tht use 2sleep with Her!  ht…
67382,jeffreykahunas,SKIN-ON-SKIN FOR UNDER $40? WHAT A BARGAIN! 👍🇺🇸
67383,patriotblake,"MILLIONS MOVEMENT ALL Americans who love America: 8 days until January 20, 2017 Inauguration of President Donald J Trum…"
67384,_nickluna_,Տ╠╣∅∪╬∅∪╬
67385,blmsoldier,Right Folks really rushing to donate to help the GOP just so they can sit on some moral high ground Nah Couldn't…
67386,dorothiebell,Remember EVERYTHING you tell your doctor not could but WILL be reported to the federal gov and some people WILL lose rights!…
67387,willisbonnerr,Apollo was the dude!
67388,southlonestar,"Attention all Hillary supporters! Don't vote for this lying satanic bitch! 

Learn about that spirit 'cooking thing…"
67389,paulinett,▶  Zapruder Frame 343: New Proof of Blowout at Back of JFK’s Head (VIdeo)
67390,jacquelinisbest,
67391,ameliebaldwin,"Black Pastor Praises End Of Obama Era, Calls For New Age Of Opportunity With Trump"
67392,ten_gop,Lifelong Democrats who voted for Obama are now voting for Donald Trump: 'Our country is going in the wrong directio…
67393,queenofthewo,my foot
67394,thefoundingson,"I can't hear you, woman!
You're almost naked!"
67395,thefoundingson," Enlighten me, will you?"
67396,brianaregland,"Ahh, that special moment when you realise 17 hours after pinning your new Ep tweet that you mistyped Ep as ""Eo"" 😕"
67397,lazykstafford,Life is a series of arrivals and departures
67398,prettylaraplace,Statement On Second Clinton Email Specialist Granted Immunity
67399,westernwindwes,There is ONLY one sane choice Vote for Trump if you want cronyism
67400,michellearry,Hillary and Trump They're both disgusting
67401,wadeharriot,Stfu clown  
67402,traceyhappymom,
67403,ameliebaldwin,My 6-year-old had an entire conversation with me using nothing but exasperated sighs
67404,hyddrox,Latest from team Trump re: NY/ NJ bombings
67405,melanymelanin,Historians boycotting North Carolina over bathroom bill move conference to Baltimore
67406,whitehousecards,TODAY WE MAKE AMERICA GREAT AGAIN!
67407,laurabaeley,Clash of Priorities Defines Debate as '16 Campaign Takes Off
67408,ryanmaxwell_1,              Cruz will be the nominee
67409,traceyhappymom,Buffy the Vampire Slaying It!
67410,patriotraphael,Yoga Poses That Will Improve Your Sex Life -
67411,hyddrox,QUOTATION OF THE DAY!
67412,lazykstafford,==&gt;
67413,cookncooks, 
67414,usa_gunslinger,Hiliary Clinton tickets!
67415,patriotblake,The  demands the  repel invasions Oh well! Enlist ----&gt;  March with us
67416,brianaregland,One of my top 5 fave movies
67417,jeffreykahunas,Secrecy is the beginning of tyranny - Robert Heinlein
67418,malloryjared,anything Kristen Stewart
67419,ameliebaldwin,Gen Flynn: Trump is ready to serve as commander in chief   
67420,melvinsroberts,
67421,jenn_abrams,Preview to Trump's presidency
67422,notritahart,"No, it's not in yet! (it is"
67423,phoenixdailynew,Clinton's best speech may have been her last as a politician
67424,specialaffair,Clinton and Trump prepare to face off
67425,thefoundingson,And he deleted his tweet
67426,ameliebaldwin,Democrats dream the unthinkable: Speaker Pelosi Republicans need to get off their butts and elect Donald Trump  https:/…
67427,evewebster373,Feel like a boss!
67428,hyddrox,Live video of protests in Minsk  via 
67429,dorothiebell,Saudi Arabia And The OPEC Hardball Strategy
67430,klara_sauber,"Place  above San Francisco, London, Berlin or Cuba Nice one by team "
67431,melanymelanin,I just don't understand why they are keeping her She didn't do anything but witness a cop murder her boyfriend
67432,sternandreas404,"Sie hat nach den alten Regeln lange genug gespielt, um Reformen zu erzwingen"
67433,emileewaren,The complaints about voter fraud would be erased if people just used paper ballots
67434,paulinett,[WATCH] Cheerleader Gets Hit On The Head That Turns Into A HUGE Brawl!
67435,brianaregland,Raiders now with 8 straight possessions that have ended with a punt
67436,ten_gop,"BREAKING🚨 

Hillary shuts down press conference when asked about DNC Operatives corruption &amp;"
67437,lazykstafford,You led strong in Polls and said you would win   Instead you are a LOSER   and a Whiny B*tch   Not a Man
67438,jacquelinisbest,New Obama Regs To Push Private Retirement Savings Into Govt Accounts
67439,leroylovesusa,I am focused
67440,jeannemccarthy0,The Fix: What it looks like when a politician falls off a cliff (metaphorically) (Washington Post
67441,laurabaeley,GOLDMAN'S GARY COHN SAID TO ACCEPT NEC DIRECTOR JOB: CNBC
67442,giselleevns,flirt to get what you want
67443,cassieweltch,not driving over 55 to conserve gas and furious about it
67444,cascaseyp,Would a literal feces-throwing chimp earn 30% of the vote if the GOP nominated it to run against Hillary Clinton
67445,thefoundingson,and Devil is their second father
67446,specialaffair,"Obama on Trump: ""The guy's not qualified"""
67447,datwisenigga,LOFT PARTY
67448,_billy_moyer_,The walrus is becoming the biggest obstacle to Arctic drilling plans:
67449,melvinsroberts,If good coffee was free
67450,jacquelinisbest,Trump shld call on Congress to grant immunity to whistlebower agents: FBI in open revolt against deceitful director https:/…
67451,notritahart, John Wicker Cane
67452,lazykstafford,"Well, half the time I sit back and prefer hanging out at my apt tonight was worth it"
67453,garrettsimpson_,I liked a  video  Creedence Clearwater Revival - Fortunate Son
67454,_nickluna_,Raiders of the lost Torah Ark
67455,cookncooks,Let's make it  huh?
67456,emileewaren,Dear
67457,ameliebaldwin,"Pal, Convicted Pedophile JeffreyEpstein Sued AGAIN 4  girls as young as 13!"
67458,hyddrox,"Thanks for Censoring This Story Since Monday, Twitter You Helped It Go Viral &amp; Get Into Halls Of Congress RT https:/…"
67459,jeffreykahunas,"Texas Man Killed by Fake Cops in Home Invasion, Robbery     via "
67460,melanymelanin,★ White on White Crime  George Weschler Murders Girlfriends' 3 Children for Dumping Him
67461,bleepthepolice,"BE ANGRY
SPREAD THIS LIKE WILD FIRE"
67462,ameliebaldwin,Trump warned of Clinton-Abedin-Weiner security risks - American Thinker    999 - http…
67463,crystal1johnson,"It's not photoshopped
San Francisco:"
67464,c__wells,Wow Some common sense logic coming out of at least a small segment of the once great state of New York
67465,nataturn,One Direction spokesman wont confirm hiatus report
67466,traceyhappymom,
67467,pamela_moore13,"walked ONE block in a parade &amp; this is how she looked
She is dying before our eyes"
67468,emileewaren,"30yrs of NeoLiberalism Brought:Income Inequality &gt; Gilded Age, NonStop War, Decimation of Unions, militarization of police…"
67469,ten_gop,Retweet if you also think that Democratic  needs to be a TOP issue discussed tonight!
67470,mil0blake,"If you want to end racism, end those who promote and depend on it: Democratic Party, Jesse Jackson, BLM"
67471,aiden7757,
67472,judelambertusa,"BREAKING VIDEO: CONGRESSIONAL BLACK CAUCUS MEMBERS Rehang ""Cops as Pigs"" Painting In Capitol BuildingShameful! https:/…"
67473,ryanmaxwell_1,"I`ve lost my phone, my wallet and got slapped in the face! Great party, guys!"
67474,hyddrox,The most damage from a hurricane is usually caused by the Clinton family when they come to steal anything that people h…
67475,jeannemccarthy0,Stand up!
67476,j0hnlarsen,New video released shows how the Clinton Campaign and the DNC incited violence at Trump rallies  h…
67477,paolakinck,Trump wants to debate Clinton w/out a moderator bc he thinks they won't be fair to him But Trump's campaign already negot…
67478,evagreen69,Obama's immigration policy is the End of the Beginning
67479,finley1589,"Yo  , maybe instead of lying who started it, report truth Cnn LIARS LIKE"
67480,cassieweltch,
67481,evagreen69,"News post: ""DISCO TO BEAT DEMENTIA Flashing lights could STOP Alzheimers disease in its tracks"""
67482,hyddrox,So menacing
67483,leroylovesusa,Wikileaks exposes POTUS again for the liar he is Not the first time he told Americans a bold faced lie !  about H…
67484,hiimkhloe,It's a cult They sold their souls to her
67485,evagreen69,"Limited run! AZWS ""Weapons Kit"" Decal Set $7 Shipped   via  | ΜΟΛΩΝ ΛΑΒΕ  RT"
67486,jeffreykahunas,Clinton team avoided ER to conceal details of her medical treatment
67487,patriotblake,Best holiday picture of all - American troops flying home after a tour in Afghanistan
67488,jani_s_jac,"BET founder on meeting with Donald Trump: He's ""committed to reaching out to African-Americans""…"
67489,mr_clampin,she bites too hard during
67490,patriotblake,"Im telling U, the thin veil of deceit has been lifted, Megyn kelly should move to  she'll fit right in with t…"
67491,malloryjared,MYRA HOTTAZZ - NO COMPETITION  DIR  
67492,giselleevns,
67493,eliasbrick,Oh the mental gymnastics required by people who say they’re feminist and yet still support Trump Doesn’t sexual assault matter…
67494,jasper_fly,"Good morning, I'm having bacon for breakfast lunch tea n supper, &amp; snack lmfao 👍👍👍"
67495,baobaeham,Proud to be a little Irish today  to all!
67496,screamymonkey,Clinton slams Trump for comments on offensive against Islamic State
67497,paulinett,No traffic light for site of deadly Delray Beach crash
67498,kathiemrr,"Hulu, Netflix, Amazon We ignore them all year round with electronics, Thanksgiving is no execption!"
67499,judelambertusa,"Even as far back as Roman times, white people have been appropriating Black hairstyles"
67500,evagreen69,"""All truth is simple""Is that not a double lie?"
67501,brianaregland,Don't worry  makes mistakes Hidden Fences does sound like an intriguing movie though Just saying…
67502,ten_gop,RT if you also love sisters Diamond and Silk!
67503,willisbonnerr,Being broke is childish and i'm quite grown
67504,cookncooks,"ProgressiveArmy: SPLASH! Recap of January 4, 2017"
67505,jmscoxxx,Im 26 years old and I'm voting for
67506,jeannemccarthy0,"News post: ""Debunking the claim that Palestinians are the indigenous people of Israel"""
67507,mr_clampin,
67508,patriotraphael,“Everything in life is luck” 🍪🍯😇
67509,dailysanfran,Obama opens Museum of African American History and Culture
67510,garrettsimpson_,"ICYMI: Why the ""alt-right"" has almost nothing to do with the American ""right"""
67511,_billy_moyer_,"I guess they call him ""Flip"" for a reason!"
67512,patriotraphael,I guess Trump thought his  interview would be like the ones he gets from  It wasn't
67513,prettylaraplace,Obama's brought in hordes of Muslims &amp; Hillary wants 550% MORE!😡 talks 'refugees' after👇yesterday's ATTACKS https:/…
67514,laurabaeley,List of Banks owned by the Rothschild Family  via 
67515,datwisenigga,"More nonsense from McCain, Rand Paul ‘Is Working for Putin’"
67516,nojonathonno,I want you all to remember this exchange:
67517,westernwindwes,Our fingers are crossed that the Coastal Florida Police &amp; Fire Pipes &amp; Drums brings ☀️ with them to the inaugural parad…
67518,priceforpierce,I won the chaffer and my friend bought me a keg of beer
67519,brianaregland,"  Practices Self-Love On ""Buddies"""
67520,ameliebaldwin, has the courage to talk about this Lib Dems think it's OK for blacks to live in ghetto conditions htt…
67521,mr_clampin,Charlie Sheen's dick
67522,cassieweltch,Eating pie for breakfast
67523,emileewaren,I LITERALLY cant stop watching this!! 😩😩😂😂😂 absolute GOLD!  NAILS this impression!!   
67524,laurabaeley,I guess the MSM decided who the POTUS will be without WE PEOPLE taking a single Vote!!  h…
67525,garrettsimpson_,Don't forget to vote today in the
67526,patriotraphael,  c deve essere certezza della pena basta sconti x buona condotta/indulti alle vittime ki ci pen…
67527,michellearry,State Dept Violates Judge’s Order To Turn Over Clinton Emails
67528,kathiemrr,A special place in hell
67529,mil0blake,"If Democrats are down to ""Eye of newt, wing of bat,"" to stop Trump, it's pretty much over for them"
67530,melvinsroberts,"if Hillary Clinton, is actually one of those Lizard people Who lives underground"
67531,specialaffair,Clinton jokes her dyed hair won't turn white as president
67532,tpartynews,"We need to protect Personal Freedom, Economic Freedom and create a Debt Free Future"
67533,rh0lbr00k,Congress defund IANA transition so it's illegal also violate antitrust law making a monopoly
67534,micparrish,"OBSESSED!!! A new  ""The Interview"" teaser is released! He's concerned about"
67535,cassieweltch,There Will Be Cum   
67536,judelambertusa,Sometimes the questions are complicated and the answers are simple
67537,jani_s_jac,‘I will tattoo a swastika on your head’: Seattle councilwoman threatened after calling for Trump protests…
67538,willisbonnerr,THIS WEEKEND is for
67539,micparrish,I'll prove that rum is mightier than the sward
67540,blacktolive,This woman is crazy AF Just look at the dude in orange t-shirt on the background 😂
67541,warfareww,state TV showed the deployment of the new S-300PMU2 SAM system around nuclear facilities in Fordow
67542,johnbranchh,Our world had 65m refugees last year The UK barely took any Stop the prejudice We can be better
67543,baobaeham,"Chris Brown's  Coming to  on May 20 w/ 50 Cent, Fabolous and More Stars! Tix on sale NOW:"
67544,laurabaeley,Only in 1 month of Trump's presidency hmmm
67545,kansasdailynews,Pneumonia brings Hillary Clinton’s health back as hot issue
67546,nojonathonno,▶ The Top 5 Most Urgent Climate Change Election Stories the Mainstream Media Suppressed
67547,lazykstafford,The senior cuts the nets first
67548,michellearry,Day 2  blog by   release KR Josh Cribbs
67549,specialaffair,Obama to meet Britain's May during G20 in China: official
67550,kathiemrr,Can't Download Food From Internet
67551,emileewaren,"Lol, that flies in face of multiple other polls predicting huge ED margins for Trump  Sorry, just no"
67552,melvinsroberts, the 1st mention of  appears on your TL Now is Trending Topic in United States!
67553,hiimkhloe,Enter for your chance to win a ps4
67554,melanymelanin,"25) That’s similar to Schaffner’s results – adjusted for beliefs on race/gender, most of the education gap in Trump support…"
67555,baobaeham,Top 10 Online Business Opportunities:  Please Retweet it  1a
67556,_nickluna_,Love to vets and law enforcement These words are for you
67557,pamela_moore13,Michelle Obama what are you doing?😂😂
67558,realten_gop,"Reminder: Donald Trump created 60,000+ jobs"
67559,tpartynews,Notice Hillary Clinton changed her hair style to cover her ears for tonight's
67560,ameliebaldwin,"block or unfollow me, you WON'T hurt my feelings AT ALL! I'm    htt…"
67561,daileyjadon,then dating would be less awkward cause I'm tired of takin myself to dinner and talking to myself
67562,hiimkhloe,"RZA dropped by Shade 45 for an interview on Sway In The Morning While there, RZA speaks on being arrested, New http…"
67563,_nickluna_,La Iniciativa del Minist de Defensa de España ( que se ha hecho  en  http…
67564,finley1589,Bill Clinton Alleged Rape Scene Witness Shock: ‘Her Mouth Was All Swollen Up… Pantyhose Ripped’
67565,phoenixdailynew,Can liberals praise Trump?:
67566,malloryjared,"Steps to help reduce your childs risk of exposure Use these tips to clean your windows, doors, floors, porches, stairs …"
67567,mr_clampin,If ur boyfriend isn't on the Computer Programming Team then you are not being part of our group Jocks are SO 20th century 😒
67568,evewebster373,SO MANY TERRORISTS right under the nose of the CIA?!
67569,rh0lbr00k,"Nancy Pelosi, walking botox bag: Donald Trump Hasn't Said Anything That Republican Members Of Congress Haven't Said ""Over…"
67570,emileewaren,Debate commission: Trump did have microphone problems
67571,gloed_up,"Would you ever pose with your daughter like this? 

There is something very wrong with this man"
67572,cassieweltch,"I suppose it's down to me again, isn't it  ;|"
67573,brianaregland,Everybody
67574,thefoundingson,I have no idea
67575,willisbonnerr,UmI saw ONE leech on the fence in my mom's backyard once and had a panic attack
67576,garrettsimpson_,So now we know who is getting freed &amp; who is not Enlist in our patriot army at  Stand up
67577,jenn_abrams,Plot twist: In  it will be revealed that Trump and Hillary are one person
67578,oaklandonline,"Trump Praises Khan, Defends Criticism of His Father"
67579,ameliebaldwin,  still not a word from the libtarded anti-Trump media to discuss the Democrat  scandal
67580,dailysanfran,The Latest: Biden to argue Trump is least prepared nominee
67581,jani_s_jac,ALL OF 'EM
