Unnamed: 0,user_key,tweet_text_only
20001,jeffreykahunas,It's absurd our national government is still considering letting them come to America
20002,paulinett,WE CAN’T AFFORD TO LOSE FOCUS IN THIS ELECTION  
20003,patriotblake,Trump Is Number One at Creating Enemies​  via 
20004,jasper_fly,Facetune more
20005,mr_clampin,Roasting of the Lambs  
20006,westernwindwes,Good luck   you are insane to accepting  from the
20007,daileyjadon,If I were Michaels I would NOT ask him back to host again
20008,_nickluna_,"21"", 16 armed Beautiful Balinese Dancing Ganesha Statue, Indonesia!!"
20009,thefoundingson,  Why don't you focus on Clinton real crimes? Just curious
20010,ameliebaldwin,"Have another shot of vodka, shut your piehole, dry up and fade away"
20011,patriotblake, President-elect Trump is forming a tremendously conservative &amp; sharp cabinet in record time –TCT
20012,baobaeham,No Why should I have to tolerate a broken promise with consequence?
20013,priceforpierce,China Threatens Severing US Cooperation if Trump Interferes With Taiwan
20014,willisbonnerr,NEW! GAME OF MICROPHONES A2 PRINT! BY  THE 1ST EDITION AVAILABLE HERE &gt;&gt;  &lt;&lt;
20015,wadeharriot,💥Breaking: This oughta wake you up
20016,peterkistner,"Merkel tut alles richtig Feinde nah halten, ihre Freunde sind ihr immer bekannt!"
20017,prettylaraplace,Understatement of the election
20018,daileyjadon,Drugs do not make people stupid  They are merely catalysts  You were already stupid
20019,bleepthepolice,Shocking video captures Arizona police officer punching woman in the face
20020,johnbranchh,I own this shirt and my coworkers have no idea what it means
20021,kathiemrr,Perfect Neighbors Xcpt that terrorist u sent here
20022,mrclydepratt,Kyrie Irving To The Warriors??
20023,jeffreykahunas,is my favorite  song What's yours? The Ultimate Collection is at  1111
20024,mrclydepratt,by   prod by 
20025,mrclydepratt,Haitian All-StarZ Music Mix Series =&gt;  Podcast /  subscribe and we will keep your mp3 pl…
20026,heyits_toby,
20027,jasper_fly,"don't go  Redundancy, yo!"
20028,heyits_toby,? Don't watch it then
20029,michellearry,Seattle School Super makes $300K -sends letter to parents saying cutting teachers/programs- but he gave self raise!
20030,mrclydepratt,avec  humaniste au grand coeur BEL EXEMPLE pour toutes et tous !    
20031,melvinsroberts,Never watched it
20032,johnbranchh,When you're black AND Muslim and u Gotta remind them
20033,westernwindwes,Jeb Bush SuperPAC To Spend $24 Million On Ads
20034,garrettsimpson_,Michael Moore calls for protesters to 'disrupt' Trump's inauguration
20035,patriotblake,Will wew in my friends?  I only know this next debate may be the most important 90 minutes of Donald Trump's life 
20036,mr_clampin,Night night sweet tweeps Hope you get some rest Sweet dreams 💗💗😘😘😴😴💤💤
20037,jeffreykahunas,"Midnight prayers 4 our nation,  and  my family, and u shortly Will be praying, but won't po…"
20038,warfareww,Navy guided missile destroyer was targeted in a failed missile attack from territory in  controlled by…
20039,garrettsimpson_,Hey big cities - keep voting for Democrats &amp; keep regressing Enlist in the  at  Stand up for f…
20040,notritahart,Donald Trump: defining deplorable for the poorly educated
20041,emileewaren,Lol 👍🏼
20042,garrettsimpson_,Fear: Thoughts of a Black Trump Voter
20043,notritahart,The last step at the top of the stairs
20044,cassieweltch,La La Land of the Rising Sun  
20045,dorothiebell,Interesting this email exchange happened just four days before Scalia was found dead
20046,usa_gunslinger,MSNBC knows what's up
20047,emileewaren,Muhammad beat his wives &amp; took pleasure in watching his men beat theirs too The Hadith says it made him laugh'
20048,evagreen69,Assange Suggests “Powerful Actors” Taking “Revenge” by Targeting His Family
20049,dorothiebell,Why does the American Left side with the enemy?
20050,giselleevns,not pro-life Death to everyone!!!
20051,hollandpatrickk,Such a huge leakage of phosphorus in The American Falls and no one cares!
20052,patriotblake,Block americans ~
20053,garrettsimpson_,"Clemson 35, Alabama 31: Clemson Upsets Alabama to Win the College Football Championship"
20054,ameliebaldwin,
20055,garrettsimpson_,Nazism breaking out in America??
20056,melvinsroberts,
20057,ameliebaldwin,Hillary's
20058,giselleevns,I prefer to boil my toast
20059,rh0lbr00k,"In this new PA Poll with Hillary +9, she ties Trump with white voters and men  PREPOSTEROUS  I'm sorry, we can just thro…"
20060,chrixmorgan,how could I ate the whole pie by myself?
20061,randolphburrr,Nope He is going to wear the stain of endorsing this piece of garbage for the rest of his career
20062,ten_gop,"Hillary rally in Coconut Creek is just pathetic 

Her supporters have no energy, zero!"
20063,laurabaeley,Why Female Muslim Professor Says It's OK To Rape Non-Muslim Women [Video]
20064,baobaeham,Science Asks: Is Your Dog Just Playing You?  via
20065,paulinett,Breaking: Avowed Racist Steve Bannon Is A White Man Whose Racism &amp; Bigotry Will Continue to Be Normalized By The Media
20066,priceforpierce,"RT  ""THE MOST UNDER-REPORTED STORY THIS YEAR  """
20067,siccerthanyou,"""Donald Trump is the best organizer for the Democratic Party this cycle"""
20068,mrclydepratt,Wottice? The new Donald Trump 7s?
20069,itstimetosecede,Promoting Texas suggests that every our victory is TX made and it's Obama's Administration that stands on the way
20070,traceyhappymom,we have the same interest
20071,worldnewspoli,BREAKING : Desperate Iraqi Christians PRAY for a TRUMP VICTORY
20072,daileyjadon,The Rock obama
20073,patriotblake,The  Has Been Unable To Separate  From His Supporters
20074,usa_gunslinger,A look inside new Hillary's plane!
20075,hyddrox,SO DID 
20076,mil0blake," should not make statements behind closed doors to his bosses, he should bring them out into the open - more …"
20077,worldnewspoli,BREAKING : Clinton Foundation Tied to Convicted Child Trafficker Laura Silsby – MEDIA SILENT
20078,jacquelinisbest," And if you don't like a free, fearless press you can head off to the Russia that your PEOTUS loves so much"
20079,patriotblake,"""Donald Trump is the steadfast leader our nation needs"" - "
20080,heyits_toby,Morale and attitude are the fundamental ingredients to success Bud Wilkinson
20081,melanymelanin,"I don't wanna hear that crossed over, transcended race, broke racial barriers bullshit The greats were Black af"
20082,notritahart,
20083,trayneshacole,Obama visits family of  and slain police officers
20084,ameliebaldwin, DNC is behind the write in Bernie BS Laws regarding write-ins are not intuitive Many w-i votes will be counted as…
20085,leroylovesusa,
20086,ten_gop, We love you! And can't wait to c you in the WH!!!!
20087,ameliebaldwin,"Shh, I'm hiding!"
20088,kansasdailynews,"Day after debate, Trump, Clinton square off again at roast"
20089,kansasdailynews,Queen: Trump wasn’t authorized to use ‘We Are the Champions’
20090,mrclydepratt,"R Kelly ""approached one of my friends at a mall when she was 11 or 12 and two others at 12""  via…"
20091,_nickluna_,"70 Nations Gathered, One Item On The Table And An Epic Turn Of Events Played Out…"
20092,leroylovesusa,"George W Bush &amp; Brother Jeb Bush, Caught on Videotape “PICKING UP KILIOS OF COCAINE” In 1985"
20093,patriotblake,🇺🇸 🏙
20094,mrclydepratt,WANNA COLLAB FOR THE LOW? I GOT WORK
20095,leroylovesusa,Our Daily Bread
20096,notritahart,Suck it up Buttercup
20097,johnbranchh, Jeeees so sorry 4 them 4
20098,jacquelinisbest,"Kellyanne Conway, ""No Mr Trump, you cannot have ""mood music"" playing while we tape - cut the Barry White!""  Take 21"
20099,mrclydepratt,The ANR Project Instrumentals The Latest Project By  stream at the link
20100,cookncooks,"Like I've said before, these people are oblivious"
20101,traceyhappymom,"my kids report cards, art projects etc"
20102,jeannemccarthy0,Ex-Department of Homeland Security head says US doesn't have capability to vet Syrian refugees
20103,danageezus,Even  Trump is immature
20104,southlonestar,"State Department laughs at transparency and democracy
I hope Im not the only one who is sick of corrupt politicians"
20105,pamela_moore13,WIKILEAKS: Hillary Clinton Sent THOUSANDS of Classified Cables Marked “(C)” for Confidential
20106,puredavie,both precooked AND prechewed stew!
20107,jeannemccarthy0,G'night Tweeps!!
20108,cassishere,NEW  Insults Americans on   - vs  Memo 2007!!
20109,emileewaren,26000 bombe per asciugare le lacrime di
20110,acejinev,Literally the first sentence of  apology was a lie
20111,hyddrox,Such a surreal moment descending the steps of Air Force One for the first time with my family
20112,queenofthewo,and only if I was still allowed to live in my pillow fort instead of the White House
20113,gloed_up,"Fuck it, they invited to the cookout
WHITE SILENCE = VIOLENCE"
20114,ameliebaldwin,"Sean Spicer announces new ""Skype seats"" in the White House press briefing room"
20115,wadeharriot,"Clinton aide in leaked email: ""Bust in that house and get Huma the hell out of there"""
20116,klara_sauber,wählen
20117,evewebster373,MT   Wants You To SURRENDER YOUR LIBERTY To Another  LIE
20118,carriethornthon,10 Charts Show How Racist America Really Is
20119,traceyhappymom, sold me to the neighboring tribe
20120,thefoundingson,Your face when you realize your approval rating is lower than Bush's or Nixon's
20121,melvinsroberts,What's the deal with  Do you love me? Am I an into? Am I an actual infection? Just what am I?
20122,tpartynews,"Rand Paul: ""Hillary Clinton Should Be in Prison"""
20123,_nickluna_,MT  Call me anything but a liberal Right as Rain
20124,donnabrivera," "" is the risky choice that Americans need to be concerned with"""
20125,cassieweltch,
20126,hyddrox,Looks like a bunch of people are going to have to get some real jobs
20127,_nickluna_,  county not country 🙄
20128,willisbonnerr,"Louisville’s office market continues to strengthen in Q4, CBRE expects continu…  htt…"
20129,kathiemrr,Slaughterhouse Hunters 
20130,wadeharriot,Lou Dobbs is right The DOJ is purposely trying to prevent  from doing their jobs This is why it's so importan…
20131,realten_gop,WATCH: During  protests black teen plays national anthem for police to show support for their service!
20132,_nickluna_,Iraqi Troops Are Making Plans To Retake Western Mosul: VICE News Tonight on HBO
20133,emileewaren,This baby fake sleeping is the cutest thing ever
20134,judelambertusa,"One income for all: far-fetched, or future fact?"
20135,stlouisonline,"Trump, family and friends mourn a St Louis icon"
20136,jeffreykahunas,Feds Want to Lower Legal Driving Limit to One Drink
20137,baobaeham,"""How do you decide who's a Nazi?"""
20138,anthonywoodboy,🇺🇸
20139,specialaffair,"Gabon residents, troops take to streets of capital after post-election riots"
20140,jeannemccarthy0,
20141,errivvvvers,Will Obama pardon some of the world's longest-serving political prisoners?  
20142,melanymelanin,😭😭😭😭😭😭😭😭😭 RT   start so early
20143,evewebster373,F YOU OBAMA!
20144,garrettsimpson_,URGENT! Sheriff Joe Arpaio Fights For His Freedom!
20145,prettylaraplace,We Deplorables number in the millions &amp; we're not gonna take it anymore 😁
20146,brianaregland,The American Black Film Festival (ABFF) Announces Regina Hall as 2017 Celebrity Ambassador  via…
20147,priceforpierce,"News post: ""Book: Michelle Obama ´invisible´ because she´s black"""
20148,cynthiamhunter,Obama Administration Covered Up 90% of Illegal Alien Crimes  via 
20149,ameliebaldwin,💥💥💥
20150,ameliebaldwin,Old School New Yorker Smacks Down Leftists In Epic Rant  via 
20151,hollandpatrickk,White House Press Secretary Sean Spicer Lies Blatantly About Inauguration Crowd During First Day In Office [Opinion] http…
20152,melanymelanin,The game rigged The commentator said that Manning is 15mins away from his 200th win
20153,patriotblake,Unbelievable!!  steals $6B donated 2  4 earthquake now they're trying AGAIN!
20154,sternandreas404,"Hamburg, Samstag 830 Eine Frage hätte ich: Sieht die Schanze jetzt so aus, weil das SEK im Stau stand?  https…"
20155,stanleyparris,And Trump is a virulent racist who is empowered by white supremacist KKK lovers like u 
20156,phoenixdailynew,Trump taps DeWit for national campaign  |
20157,laurabaeley,He fought for our freedom! Thank you!
20158,queenofthewo,
20159,cookncooks,everyone is strangly silent about the murder of  in
20160,notritahart, 
20161,malloryjared,The future belongs to those who prepare for it today - MalcolmX
20162,cassieweltch,Try not to murder your family
20163,heyits_toby,The GOP may regret its lasting battle against gay marriage:
20164,emileewaren,ARE WE DOOMED TO LET MARXISTS WRITE  The Real McCarthy Record HE WASN'T WHAT YOU WERE TOLD!
20165,evagreen69,We Are All Sinners But We Are Not All Evil!!
20166,giselleevns,Can we order take-away instead?
20167,thefoundingson, You guess wrong
20168,melvinsroberts,Solange
20169,bleepthepolice,Fascist pigs arresting peaceful women at anti trump rally in NYC
20170,hyddrox,I'm not sure who CREEPS me out more😳
20171,judelambertusa,thank you for keeping us safe and free!  Thank you for your families sacrifice!   You guys rock - may we never…
20172,happkendrahappy,Saying  equals
20173,wonderhann,What does  mean for you? Sign up to get  special email briefing tonight
20174,daileyjadon,gnawed on bones
20175,kadirovrussia,
20176,malloryjared,Teenie Fotzen is following me now on Twitter! Thanks !  Ready for your  too
20177,giselleevns,I could still wear my pajamas
20178,daileyjadon,Fellacity
20179,emileewaren,This is a people-powered campaign That's why I am opening it up to you What do you want me to talk about?
20180,puredavie,Sitting on the dock of the sleigh
20181,ravenicholson,"This Is A Political Debate In Da Streez ""Bro Larry Rocks With Killary Clinton"""
20182,brianaregland,A bit of opportunistic advertising!! Spread the word!!
20183,leroylovesusa, bye Obama
20184,hyddrox, ABSOLUTELY
20185,giselleevns,use a GIF to express your feelings
20186,queenofthewo,ADHD - All Dudes Have Dicks
20187,giselleevns,I Know What You Did Last December
20188,thefoundingson, your consideration on your ass is too much
20189,cassieweltch,When someone tells me I'm gorgeous I just giggle and then ask them do they wear glasses
20190,hiimkhloe,damn situation scares me
20191,baobaeham,Make money &amp; shut the f 🆙
20192,hollandpatrickk,"This is a court of law young man, not a court of justice -Oliver Wendell Holmes"
20193,traceyhappymom,Hey Hey  Were The Monkies
20194,melvinsroberts,Not having to talk to other employees
20195,hyddrox,via 
20196,donnabrivera,guns don't kill and people do
20197,thefoundingson,This snowflake's brains are cracked 😂😂😂
20198,cookncooks,Faso puts political party before country by backing Trump Why  reader will be voting 4  http…
20199,ameliebaldwin, Crooked Hillary Rats Can’t Hide
20200,ameliebaldwin,the other controversial speaker taking selfies with fans &amp; talking to media  
20201,screamymonkey,"NASCAR cools on Confederate flag, but fans still fly it"
20202,micparrish,"Clinton Ambassador ""Taliban Infiltration Worse Than Estimated""     http…"
20203,usa_gunslinger,This sums up everything Hillary will say today
20204,eliasbrick, How bad (or how complicit) does the GOP look when 16 other campaigns couldn't even find one of these stores?
20205,patriotraphael,         
20206,crystal1johnson,"NYPD's black police chief 'stopped frisked' by two white cops
If a 60yo can be “racially profiled” then what about…"
20207,cassieweltch,if I could brag about not paying taxes and still win
20208,cassishere,"This must be one of those people I just want to silence because I can't win the argument Right,  http…"
20209,leroylovesusa,Remember THIS?!? --&gt; McCaul Border Bill a Trojan Horse for Amnesty -- Thats Trumps guy  --
20210,lazykstafford,Mean Meme's
20211,queenofthewo, made me laugh 😉
20212,giselleevns,I said what I did  1)     Obama out !!
20213,dorothiebell,يعني لا جو زي الناس وزحمه ومسافه تخلي الفيل يصير صعلوك وعلى هذا القولف يمر من جنبي فيه اداريه بس ؟ رجعو عشرتي
20214,traceyhappymom,  I thought so too
20215,kathiemrr,Looked Different In Brochures
20216,evagreen69,"RIP another day, another shooting"
20217,jacquelinisbest,Yeah why would anyone get all upset about hundreds of angry idiots constantly threatening their family
20218,kansasdailynews,"Shifting tone, Trump entertains the notion he could lose"
20219,notritahart,A Spraytan Orange  
20220,hyddrox," ""[Moderators'] goal is not to let [Trump] finish a thought, their goal is to help him retire or go back t…"
20221,ameliebaldwin,Hillary Clinton's troubles with transparency could cost major votes
20222,laurabaeley,Fate of ObamaCare co-ops uncertain after half collapse via the  App‼️
20223,notritahart,Rose 
20224,drmichaelgarcia,White terrorist scum
20225,hiimkhloe,"Trump camp: ""No concerns"" over historically low fundraising numbers"
20226,hollandpatrickk,US No Longer Considered A “Full Democracy” — And It’s Not Trump’s Fault
20227,willisbonnerr,I'm going ham on miami waves right now 🌊🌊🌊🌊🌊
20228,datwisenigga,"Mt Fuji seen through the Cherry Blossoms at Arakura Sengen Shrine, Japan | Photo by CapKaieda"
20229,cookncooks,Could Trump-style border tax replace UK corporation tax? Former chancellor Lord Lawson says it should
20230,priceforpierce,MT  Jesus is everything to me! He is my all in all!
20231,emileewaren,President Obama's brother calls for  to pardon Assange
20232,ameliebaldwin,Secret police file: Trump sure of presidential win _ in 1996 (from 
20233,emileewaren,The beautiful minister Ayelet Shaked 👇
20234,melanymelanin,▶ ‘Thanks to Trump’: CNN’s irresponsible Trump coverage earns it $100 million over election forecasts
20235,_billy_moyer_,"If I am not good to myself, how can I expect anyone else to be good to me?"
20236,jeannemccarthy0, I get that he's greedy but Hillary and her  concept of politics is even more dangerous than T…
20237,specialaffair,Obama presses China's Xi on South China Sea ahead of G20
20238,notritahart,  alert the perimeter defense system
20239,patriotblake,So basically  is epitome of your brain on
20240,gloed_up,She would be exellent POTUS
20241,cookncooks,"Legge elettorale, le nomination agli Oscar per la peggiore  via "
20242,c__wells,Disciplinary history of NYPD chokehold cop is public record
20243,westernwindwes,"  keep focus on illegal immigration at debate and rallies there Like Cali, Texans are suffering bad be…"
20244,dominicvalent,Meal or No Meal?
20245,carriethornthon,Clinton’s Health Is Not a ‘Real Issue’ Because No Sane Person Would Vote on It  via 
20246,dorothiebell,VIDEO) 2017 Mercedes-Benz E-Class Revealed | Detroit Auto Show
20247,leroylovesusa,Your  triple-shot and chaser of the day
20248,patriotblake,DENIAL
20249,redlanews,"Another DNC worker dead We must stop these murders Media is  absolutely silent, but we won't be!"
20250,hyddrox,The sousaphone will be playing that frumpy sounding classic piece as Michael Moore walks in protest around Detroit
20251,melanymelanin,college in 4 pictures:
20252,cassieweltch,
20253,puredavie,   leave  alone in your house especially for your couch!
20254,judelambertusa,Iran Claims US Paid $17 Billion Ransom For American Hostages
20255,kansasdailynews,Donald Trump's immigration policy: Then and now
20256,thefoundingson,"AHEM! Just so you remember,"
20257,cynthiamhunter,Mess with the Bull You get the Horns!
20258,willisbonnerr, - Aaron J - Run It  -
20259,ten_gop,"  No it's not, but the fact that Gennifer Flowers agreed to join Trump at the  worth RTing :"
20260,mr_clampin,"Vladimir Putin: I am writing this biography of my own freewill I wasn't forced in any way, I think Putin is great!"
20261,baobaeham,"""""""Many more will have to suffer, many more will have to die, don't ask me why"""" - Bob Marley"""
20262,melvinsroberts,Tuna
20263,melvinsroberts,Pets
20264,cookncooks,Looks like Trump exploded to a 6 point lead in Reuters Final Poll of 2016  Wow:
20265,denn_nikitin,Thanks to   and  for interesting jogging session
20266,onlinecleveland,"Hillary Clinton, Donald Trump pledge to pause campaign for 9/11: Politics Extra"
20267,evagreen69,"News post: ""Barack Obamas Shaky Legacy on Human Rights"""
20268,kathiemrr,"""How to delete an IT guy who uses Reddit and make it look like an accident"""
20269,melanymelanin,Tamar Braxton And Husband Vince Squash Breakup Rumors  
20270,paulinett,The principles which allow the country to prosper are always ROOTED in diversity even though often SPUN into WS
20271,notritahart,Even  Trump is immature
20272,priceforpierce,Dallas police in armoured-van chase after shootings - rolling coverage
20273,anthonywoodboy,"“There are always going to be some bad police Overwhelmingly, they’re honorable and courageous,” says "
20274,ameliebaldwin,"""Have her beat the sh*t out of a staffer"" as prep to make Clinton less ""unpleasent"" during interviews…"
20275,imaswerve," You LOVE, LOVE the media You always have time for us Well, at least SOME of us When do you talk to…"
20276,mil0blake,TED CRUZ SAYSWE CAN'T BE FOOLED BY PT BARNUM ?  TAKE A LOOK IN THE MIRRORDUDE !
20277,giselleevns,Call Arianna Huffington and impersonate Trump as long as you can
20278,blacktolive,is Happy to Be Compared to Pepe the Frog
20279,notritahart,"Yes, my father wrote that letter with sincerity, passion and from experience He knew what he was talking about"
20280,ameliebaldwin,"Lets count the felony counts on  there are many more, but Meme does good job illustrating SOME OF THEM "
20281,thefoundingson,"Its funny how Muslims shouldn’t be blamed for the radical 10%, but white people are all personally responsible for the 16% who owned slaves"
20282,wadeharriot,"Move along, nothing to see here  "
20283,margarethkurz,Erhobene Arme bei rechtem Rockkonzert -  ermittelt Man muss gegen beleibigen  kämpfen!
20284,priceforpierce,The Nigerian Prince who's offering me 50% of his wealth if I wire the taxes upfront
20285,ameliebaldwin,"If you ask people to follow the money,  they just might take you up on it"
20286,datwisenigga,Don't let these women use u fo' ya sexual energies that's all they really want
20287,baobaeham,"Teenagers get drunk in Lahore, too: One of Pakistan’s best novelists explains how to tear down walls"
20288,cynthiamhunter, 
20289,crystal1johnson,Newark police killed two black teenagers this past Saturday
20290,screamymonkey,Child labor on the rise among Syrian children as crisis spirals: agencies
20291,_nickluna_,"Trump Just Took His First Action In The Oval Office, And Taxpayers Will Be PISSED (IMAGES"
20292,politweecs,Julian Assange says  leaks might come as early as next week
20293,evewebster373,State Dept: 9 pm Hillary Clinton email release no cover-up
20294,cynthiamhunter,"It's outrageous They can keep dumping b/c  &amp;  have a Menage a Trois, so Hillary is safeguarded…"
20295,evagreen69,NYPD officer shot in the head this weekend pronounced dead
20296,priceforpierce,If you're a jihadist and reading this you are not people of God You will never make us worship your bloody death cult!!!
20297,malloryjared,SPY AGENCIES ARE PUSHED TO REVEAL EXTENT OF DOMESTIC SURVEILLANCE
20298,queenofthewo,Let us Pray
20299,hiimkhloe,  That nigga Nate Parker is married to a white woman Fuck him ! I'm not financing his white womens lifes…
20300,laurabaeley,"ICYMI: Former Clinton staffers FINALLY slam 'if you like your plan, you can keep your plan' lie, but there's a catch https…"
20301,cookncooks,This is one of the reasons why the B'stards don't want us out of the EU!
20302,kathiemrr,
20303,c__wells,You don't steal meat from the pot
20304,michellearry,"Hackers Get Lazy, Build Trojan On Top of Android Rooting Utility"
20305,jacquelinisbest,Yes ma'am! He's a clown show!
20306,johnbranchh,Today while documenting in Sandtown with some of my youth from the neighborhood Some Older guys…
20307,melanymelanin,"Below the surface, a vexing problem for Towson Row"
20308,ameliebaldwin,More retired US generals and admirals line up for Trump
20309,ten_gop,Hmm🤔 Can you imagine mobs of Christians blocking streets in Muslim countries?
20310,hyddrox,"Watch: Trump Supporter Tricks Elizabeth Warren Into Taking A Selfie, Hilarity Ensues  via "
20311,judelambertusa,"Kelly Osbourne Says Ozzy Intentionally Overdosed When He Learned Sharon Had Cancer, Credits Robin Williams With https:…"
20312,ameliebaldwin,REPORT: More than half of anti-Trump protesters arrested in Portland did not vote | 
20313,jasper_fly,I should duck and cover?
20314,melanymelanin,★ Uganda: Acholi Paramount Chief Promises to Kill Stray Elephants
20315,baobaeham,Bad Things by Machine Gun Kelly X Camila Cabello on app at
20316,ryanmaxwell_1,"I maybe made some mistakes, but I'm only human"
20317,politweecs,Lie-detection expert says  is ‘trying to hide’ major secrets
20318,travisrespek,"My students (who are 50% black and 50% latino) also want to know why trump thinks they only live in the ""inner city"""
20319,queenofthewo,Finding kids playing outside extremely loud and annoying
20320,malloryjared,"Incline Enterprising Inc Tallahassee, Florida"
20321,mil0blake,Woman Found Dead on CTA Brown Line Platform
20322,tpartynews,
20323,patriotblake,"At times we talk about how ""Black people need to stick together"" there's a percentage who can care less need to concent…"
