Unnamed: 0,user_key,tweet_text_only
10000,traceyhappymom,I weren't British 🇬🇧
10001,mrclydepratt,
10002,mil0blake,March 18 is National
10003,jeffreykahunas,The latest   DISINFO DAILY!
10004,_nickluna_,Two young children saw their mothers die in Australia theme park ride crash
10005,brianaregland,OMG IT FINALLY HAPPENED! THE QUICK BROWN FOX JUMPS OVER THE LAZY DOG
10006,evewebster373,Kim akrdashian's implants  Kim akrdashian's implants
10007,evagreen69,The police actually abiding by the rules and not using excessive force
10008,dorothiebell,WTF?
10009,whitehousecards,Майк Пенс одержал победу в вице-президентских дебатах
10010,laurabaeley,Did IRS Leak Trump Returns 2 Help Hillary?  American Thinker
10011,heyits_toby,MT  Liberty never came from Government
10012,dorothiebell,I'd love to see a Country artist perform for President Trump on Inauguration Day! Who would you like to see? Use
10013,notritahart,America is vulnerable with Trump
10014,dorothiebell,When you're turning to fitness model Paul Ryan to assure people that there won't be any voter fraud
10015,gloed_up,"Amerikkka is literally killing people in our face and all y'all talking about is Hillary, Trump and Isis"
10016,daileyjadon,"Oh, fuck off"
10017,garrettsimpson_,2700  Rouhani's record in his 3-year of presidency
10018,rh0lbr00k,This is an insult to Holocaust victims Disgraceful
10019,datwisenigga,Enter for your chance to win a ps4!!
10020,kateritterrrr,"Howard Dean’s Unhinged, Unfounded Accusation of Cocaine Abuse Only Helps Donald Trump"
10021,westernwindwes,"News post: ""JUSTICE:  Lawyers: New court software is so awful it’s getting people wrongly arrested; Problemati…"" https:…"
10022,johnbranchh,so in response we're getting  Not mad at it
10023,donnabrivera,BOMBSHELL  Debate Cheat UPDATED  USA Today
10024,claudia42kern,wow this really takes away all the drama of guessing which party they were gonna endorse
10025,kathiemrr,Agent Orange chicken
10026,micparrish,"Hillary asked to borrow a book on emails with a section titled, ‘How To Delete Something So It Stays Deleted’ [ph…"
10027,garrettsimpson_,Constitution's 22nd Amendment: Term Limits for the President
10028,traceyhappymom,This place in SoCal serves ice cream in spaghetti form
10029,_billy_moyer_,"It isn't about who is real to your face, it's about who is real behind your back"
10030,todaycincinnati,Paul Manafort Quits Donald Trump’s Campaign After a Tumultu  |
10031,logan_whatsup,To climb steep hills requires slow pace at first
10032,evewebster373,The latest on NY Legislature: Pregnancy coverage backed
10033,darknally,Foke Richard Branson recounts a vindictive Trump at 'bizarre' lunch meeting in Manhattan
10034,rh0lbr00k,How much do you know about  record on women?
10035,giselleevns,to stop keeping up with the Kardashians
10036,willisbonnerr,The latest Prophecy Entertainment Music Media !  Thanks to   
10037,ameliebaldwin,VIDEO : Former Bernie Supporters Gather in Philadelphia For Trump
10038,giselleevns,To finally get proof that my reflection blinks an instant before I do
10039,judelambertusa,The Scooper Salutes Our Heroes:   at 57
10040,usa_gunslinger,"A bit of truth about Willy ""Dickin' Bimbos"" Clinton"
10041,evagreen69,"Hey  ,should we take away everyone's car since motor vehicle deaths outpace gun deaths"
10042,garrettsimpson_,"these companies are able to move between all 50 states, with no tax or tariff being charged Please be forewarned prio…"
10043,datwisenigga,Shaggy – “That Love (Tropixx Remix)”
10044,daileyjadon,????????????
10045,hollandpatrickk,Dogon Legend of the Nommos Fish People -
10046,thefoundingson, After 8 years they manage to find change
10047,heyits_toby,"Waitress Makes $3,600 in Donations After Receiving 'Racist Note' Now Her Story's Falling Apart"
10048,melvinsroberts,heeft zojuist online eten besteld bij Fenix via  
10049,willisbonnerr,Capitalism is a system that is rooted in anti-Black racism Capitalism only exists because of global anti-Black racism
10050,melvinsroberts,Receiving a soapy enema
10051,giselleevns,New merch by Trump is not made in China
10052,rh0lbr00k,CNN BANNED: Haitian Americans beg Trump to LOCK UP  WATCH!
10053,datwisenigga,"I'm all grown up If you can't give me the love, respect, loyalty, and peace I give you gots to go 😁"
10054,westernwindwes," During my time on tweeter, I've witness your kind words &amp; support of others that are blessed 2 follow yo…"
10055,evagreen69,Senate Repubs shld reread Article 2 Sect 2 of  Call Senate
10056,puredavie,Our Life Is What Our Thoughts Make It marcus Aurelius
10057,ameliebaldwin,"Trump, one of the richest, most famous men in the world and for 3 decades we hear nothing  Then with 3 weeks before the e…"
10058,jasper_fly,Point Breakin'
10059,brianaregland,Women of Color &amp; Horror/Sci-Fi Cosplay
10060,jaydaastonishin,Can't pronounce the state's name Not familiar with Yucca Winning strategy in Nevada
10061,kathiemrr,eating an entire roll of aluminum foil
10062,hiimkhloe,WHERE ARE YOU
10063,cookncooks,     I will never get tired of winning!! Can't wait for more!!!
10064,jeffreykahunas,cuz it only blocks content that goes against the will of the leaders
10065,queenofthewo,Red Dwarf Loach  
10066,jeffreykahunas,All these SWAMP people should be drained &amp; arrested along with Hillary &amp; charged with accessory to MURDER ! 
10067,gloed_up,This is the day little Ebony decided that God had already forsaken her
10068,j0hnlarsen,"If Hillary wins ""America will be over as we know it🔴""Hillary is most corrupt person to run in US HISTORY‼️…"
10069,nehemiahx,Fact
10070,ten_gop,"Hillary Clinton took $100,000 from a Company with ISIS ties!
RETWEET to make sure everybody knows it!"
10071,jacquelinisbest,Prayers for their people :(       
10072,donnabrivera,"When 'Trump protestor' is the highest paying job you're qualified to do, it's the liberal media/education complex you should b…"
10073,melanymelanin,Let's get  trending again to fund Michigan! Vamos a obtener # Recount2016 tendencia nuevamente para financiar M…
10074,paolakinck,Hillary Clinton has Progressive Supranuclear Palsy
10075,notritahart,
10076,cookncooks,"""You Gave 9,500 Visas To Terrorists"" Jason Chaffetz Delivers The Best Ro  via "
10077,kateritterrrr,Congress Investigating Obama Admin-Funded Campaign to Oust Israeli PM Netanyahu
10078,patriotblake,"Opinion | Robert Redford: 45 years after Watergate, the truth is again in danger"
10079,screamymonkey,Obama presses China's Xi on South China Sea ahead of G20
10080,brianaregland,Privacy is sacred Protect ya neck
10081,michellearry,  if you're tuning in to tonight's CBS  at 9 pm ET!
10082,johnbranchh,"The more I see, the less I know for sure"
10083,jeannemccarthy0,"Individually, we are one drop Together, we are an ocean"
10084,michellearry,The Pinch
10085,batonrougevoice,Hillary Clinton and Donald Trump kick off fall campaigns in Ohio: 6 takeaways
10086,_nickluna_,Trump to IMMEDIATELY Reverse One of Obama's Most Shameful Acts
10087,cassieweltch,Size 17 shoes
10088,dorothiebell,Defeat likely spells the end of Clinton Dynasty
10089,neworleanson,Obama administration stalls North Dakota oil pipeline minutes after judge approves it
10090,ameliebaldwin,"Hillary Clinton can't win if she looses FL, OH, NC, &amp; either PA or VA Trump will carry all those Mark my words The mome…"
10091,giselleevns,"these past two years have, in fact, been a dream"
10092,ten_gop,"activist says 'I HOPE I KILL ALL WHITE BABES!' 

But of course you won't see this on nightly new…"
10093,mr_clampin,that will be like a good movie
10094,edmundrjr,"Join me on  Facebook live at Noon from  discussing black Republicans, Cleveland, and"
10095,hyddrox,DON'T DISAPPOINT  HE MANIPULATES
10096,melanymelanin,"  If you implemented immigration ban decade ago, you'd prevented exactly 0 acts of Islamic terror…"
10097,lagonehoe,"Trump has given about $140,000 to a dozen people who were state AG's or running for the post from 2001 to 2014"
10098,dailysanfran,Debate stunner: Trump won’t say he’ll accept election result
10099,ten_gop,"💥💥💥
Female protestor interrupts Bill Clinton rally in Canton, OH holds up ""Bill Clinton A Rapist"" shirt!"
10100,jacquelinisbest,I think  has something to say on that
10101,jeffreykahunas,"Says She's BLACKED OUT a ""Few Times"" But You Can Hear Her Fumbling the Truth Not Fit  RT h…"
10102,leroylovesusa,terrorist-supporter
10103,kathiemrr,Orange Is The New Roughy    
10104,giselleevns,The right answer to the question: Do you think you're smarter than me?!
10105,drmichaelgarcia,'I will not accept the election results I'll keep you in suspense' - IL Douchey
10106,brianaregland,They fucking
10107,jeannemccarthy0,
10108,evagreen69,Pentagon Announces Elite Force To Combat ISIS: United States Redneck Special Forces
10109,leroylovesusa, good job guys! we're safe now
10110,hollandpatrickk,"DUDLEY: ASKED RE BREXIT, BIGGEST SURPRISE UK HOLDING UP WELL"
10111,marianeuberg1,"Peer Steinbrück ist weg, es bleibt uns nur Merkel"
10112,leroylovesusa,I couldn't say it any better
10113,johnbranchh,"Tune In - ""Keepin' It Real w/ Al Sharpton"" 1pm-4pm ET Check for listings &amp; dial 18775325797 to call in  htt…"
10114,melanymelanin,Bernie type candidates are AWFUL
10115,daileyjadon,
10116,jasper_fly,The Big Shorts  
10117,tpartynews,BEAT THE RUSH!  GO TO CANADA NOW!  Reports of US Raids Have Immigrants Bracing for Enforcement Surge -
10118,regieblackmon,How what Trump is doing is also destabilizing for the world
10119,internalmemer,me: i hate shonda rhimes she always kills off my favorite characters and ruins my ships
10120,ameliebaldwin,  Another Fucking Fake Patriot! Keep telling yourself how special U R Madam President Clinton will f…
10121,dominicvalent,Human skin theme
10122,heyits_toby,A serious look at what fireworks might do to veterans suffering from PTSD:
10123,melanymelanin,The Genocide That Is Being Ignored by The World  via 
10124,finley1589,FRAIL LOOKING HILLARY HITS TRUMP FOR CALLING NYC ATTACK 'BOMBINGS' -- AFTER DOING THE SAME
10125,priceforpierce,Lo schifo è stato raggiunto con l''avanzare del politically correct
10126,evagreen69,Good morning! ☀️
10127,patriotblake,BREAKING: New documents have leaked
10128,phoenixdailynew,Trump declares war on establishment Republicans
10129,kathiemrr,Red Shirt moment of silence
10130,jasper_fly,They got big butts that I like to fry
10131,cassieweltch,Welcome to your tape
10132,peterkistner,Frau Merkel spielt eine große Rolle für den Erfolg der CDU
10133,tpartynews,"'I prefer Donald Trump's platform for our community He can put America back to work, back to church, back to schoo…"
10134,happkendrahappy,"Only one skit WE Update was a hate fest Grew up on SNL, but have had enough!"
10135,tpartynews," “I believe we ended up picking the ONLY candidate who could actually beat the Clinton, Obama, and…"
10136,malloryjared,Now Playing: Dino ( - KIG feat Lil Flip -&gt;
10137,_nickluna_,"⚠️ But you still have to take up your cross daily, and follow Him ✨📖💪🏼👣❤️"
10138,paulinett,Rachel Maddow Shows You How to Spot Trump’s Big Fat Intelligence Briefing Lie
10139,realten_gop,Old School For Trump!
10140,micparrish,Dozens of Clinton emails censored for security reasons  via 
10141,usa_gunslinger,"​“ is right that foreign donations to the  ‘raise serious questions’""…"
10142,dorothiebell,"Iraqi refugee who had ""sexual emergency""&amp; raped 10 yr old boyhad 7yr sentence overturned they said maybe 10 yr old b…"
10143,cynthiamhunter, I have a BA And an MBA and I'm voting for   Mostly everyone I know is too!
10144,mr_clampin,The relationship I want vs the relationship I end up in
10145,michellearry,"RT "" ""RT"" ""Welcome home,""  to Scott Skiles ""It's good to be home,""…  ""…"
10146,thefoundingson,I don't remember Trump being kissed by Klansmen
10147,giselleevns,
10148,finley1589,"Mr Clinton,  how often did u cheat on Hillary? Frequently,  I mean rarelyover many years"
10149,taraformation,"Kellyanne Conway says Kaine was boorish for interrupting female moderator, forgets Trump interrupted female candida…"
10150,johnbranchh,The Trip by   on
10151,antonhayhay,Hillary Clinton's White House Bid Just Got A Huge Boost From The New Jobs Report
10152,garrettsimpson_,"Um, I'll come along to carry your bags"
10153,leroylovesusa," ""Calling illegal aliens undocumented immigrants -- is like calling heroin dealers undocumented pharmacists"" --James W…"
10154,emileewaren,The weekend  is just as pathetic as the weekday show Spin everything for currupt   and against  All…
10155,westernwindwes,"oh, can't we just love one another?"
10156,hyddrox,"From what I gather, Trump was taking about heroin @ border"
10157,heyits_toby,Nail Biting Is A Sign of This Personality Trait  via 
10158,ameliebaldwin,YES! Bill introduced to remove US from United Nations!
10159,melvinsroberts,
10160,lazykstafford,"Trump 46, Cruz 31, Rubio 12, Kasich 10 with 33% of precincts reporting"
10161,cassieweltch,In the way
10162,mr_clampin,Because I can now marry 
10163,pamela_moore13,Not shocked by Hillary claiming no lives lost in  American Lives mean nothing to her
10164,_nickluna_,"Gotta Love This!! Globalist Soros Puppet Merkel, Wants To DEPORT 100,000 FAILED Muslim Migrants    https:/…"
10165,cascaseyp,wow this really takes away all the drama of guessing which party they were gonna endorse
10166,melvinsroberts,
10167,melanymelanin,She legit dont do shit to no one Wanda Sykes was more reckless than Leslie and aint get this flack
10168,ameliebaldwin, You realize you support aborting 'the voiceless and vulnerable in our society' -correct?
10169,thefoundingson, Shush! You're hurting people's feelings! No free speech is allowed anymore!
10170,judelambertusa,Jefferson: Let them take arms tree of liberty
10171,c__wells,"Er, no Obama is unwilling to do anything about the radicals That doesn't make every Muslim bad"
10172,loragreeen,"""Mrs Clinton, if you're so clever, can YOU craft a compelling reason to vote for Trump?"""
10173,brightandglory,Trump promises segregation--
10174,daileyjadon,"But in the eyes of the world, you're just another crazy girl who loves a married man"
10175,ameliebaldwin,Feelin it!          https:…
10176,evagreen69,"via  Chris Christie calls Marco Rubio ""boy in the bubble”  |"
10177,_nickluna_,A true  moment with  tonight at Marquette University
10178,ryanmaxwell_1,"News post: ""Trump Organization executive appointed to 'international negotiations' post"""
10179,traceyhappymom,
10180,finley1589,Conservative Latinos launch campaign against Univision reporter for biased Trump coverage
10181,lazykstafford,"That lady has been deported six times before so I don't know if it's really fair to describe her latest ICE detainment as ""u…"
10182,melvinsroberts,LL Cool J will play a cop
10183,ameliebaldwin,KaydeeKing
10184,westernwindwes,'Emily' followed her heart
10185,giselleevns,people are misogynistic
10186,hollydler,Amen to that  👍👍
10187,cassieweltch,"Good Dye, Mr Chips"
10188,cassieweltch,I love cats And that's the way it is!
10189,jacquelinisbest,
10190,malloryjared,You wearing less and going out more RT  Sup 💨
10191,mrclydepratt,Maajid Nawaz is listed as an islamophobe on SPLC website Shame on you for supporting your husbands bigotry 
10192,mr_clampin,the alarm goes off on a Monday morning
10193,_nickluna_,White House: Castro Was A ‘Towering Figure’ In History | Weasel Zippers
10194,cassieweltch,"He never calls back, guess im annoying"
10195,paolakinck,"Awwwwwwwow,I LOVE THIS PIC ❤❤ It captures everything about Trump"
10196,hollandpatrickk,Mass Medias Cacophonous!
10197,jacquelinisbest,These people need to stay out of America They are animals Disgusting animals
10198,tpartynews,A cop who mistakenly shot a black man represents all cops but Muslim blowing up 30 people doesn't represent Islam! Hmm🤔
10199,sternandreas404,Das sind  und ein Feuerlöscher Fatoni ist auf dem Album Der Feuerlöscher nicht
10200,margarethkurz,"Gute Nacht, ihr Lieben! Schlaft gut!"
10201,onemightyfish,Anti-Semitism has taken on a new dimension in the US with the emergence of the Trump campaign…
10202,mrmoraan,Trump denied use of Civil Rights Museum for photo op Guess what happened next:
10203,finley1589,The  demands the  repel invasions Oh well! Enlist ----&gt;  March with us
10204,judelambertusa,"  promote Islam, run down British values, make us out the bad guys, all votes for Labour, T…"
10205,hyddrox,🚨🚨🚨🚨🚨BREAKING🚨🚨🚨🚨🚨🚨
10206,thefoundingson,Universities produce  generation who need grief counseling after their candidate loses the election
10207,patriotblake,"25 A rationality that often views any other forms of meaning, as irrational and worthless"
10208,patriotblake,Hey Women4️⃣Trump thanks for the follow! You can find out how to join the revolution here:
10209,melanymelanin,15 women have accused Trump of sexual assault
10210,hyddrox,Both these idiots should fess up and admit they are DemORATS and get out of my Party
10211,leroylovesusa,Independence Day Call to ACTION:      1
10212,micparrish,I have never seen this before!
10213,ameliebaldwin,Scott Baio: I like Trump because he talks like a guy  via   *TRUE* MY VOTE ST…
10214,garrettsimpson_,Video of Gov Cuomo's State of the State Address at 1 World Trade Center on Monday morning
10215,garrettsimpson_,"Had the Oregon protests happened 30 years ago, democrats and liberals would've hailed the protesters as heroes"
10216,gloed_up,"“Colored” and “whites only” signs placed above water fountains at Florida high school
 is growing all over t…"
10217,daileyjadon,
10218,ryanmaxwell_1,"I can`t be confident in  there are over 800,000  members accounts! 😰"
10219,daileyjadon,"Beavers and Butt-Head"""
10220,evagreen69,  at this rate we will fall before the election Something will happen
10221,_nickluna_,Will double-OT classic help Ohio State's playoff hopes? Michigan turnovers lost game
10222,patriotraphael,"MT  It is okay to say God bless America  Say it loud, say it free!"
10223,priceforpierce,"If you're cheering government picking winners and losers in the economy, you are not a capitalist"
10224,patriotblake,Christians are being burned alive and crucified in the  We cannot be silent FOLLOW as we fight to protect the persec…
10225,prettylaraplace,Fraternal Order of Police Endorses Donald Trump: ‘He Will Make America Safe Again’ - Breitbart News
10226,datwisenigga,"Trump  Governs by his Emotions ""I swear this Man has PMS""!"
10227,mil0blake,MT  Therefore my brothers
10228,kateritterrrr,"   Things news  , just don't report?!"
10229,patriotblake,🚨As Twitter Tends Our Dishonest President
10230,ten_gop,"VICTORY! I am BACK!
Twitter unlocked my account! Thank you for your support!"
10231,judelambertusa,Wikileaks E-Mails:  Hillary Clinton Blackmailed Bernie Sanders
10232,ten_gop,"Look at the happy faces of these men! Are they refugees? 
NO they are cowards who ran away and left their families!"
10233,michellearry,
10234,cassishere,Blocked  Trump basher PAID HRC TROLL
10235,kateritterrrr,MT  The NEW Way For  To Confiscate   Is NOW Part Of Homeland Security
10236,rh0lbr00k,Just a American   You’re American      America First
10237,cookncooks, 
10238,dailysanfran,AP FACT CHECK: Trump says Clinton lacks policies Seriously?
10239,michellearry,Pro NWO    V  2nd Amendment        
10240,datwisenigga,   Just sitting here waiting for the  trailer
10241,paulinett,Live in Oakland
10242,kathiemrr,to talk in any situation involving law enforcement unless you feel like going to jail or bailing…
10243,mrclydepratt,
10244,melanymelanin,One of the privileges of Whiteness is not having to think abt all the benefits of waking up White
10245,hyddrox, more Dem Get Out The    ballots in mentally impaired names ►https:/…
10246,cookncooks,"Changing from talented  would be huge mistake, setback for   Don't do it…"
10247,brianthelifter,Obama's Words on the Economy
10248,traceyhappymom,Here's an idea: maybe the assholes 'guarding' washrooms from the TG community could go to RSA &amp; escort kids to the faciliti…
10249,patriotraphael,"Kakav glup naslov, za medalju Devojka mu plaća stan, hrani se kod roditelja i radi dodatno"
10250,paulinett,"""Take a look at it"""
10251,datwisenigga,Get your record broke on 90 The Underground! Get played by     
10252,_nickluna_,I suspect middle America is more than a little amused that  played MSM like a fiddle this AM  Even if they…
10253,mr_clampin,the internet
10254,washingtonline,Anti-Trump Demonstrators Take to DC's Streets
10255,dorothiebell,
10256,imissobama,"Are we seriously having a debate in St Louis without a SINGLE QUESTION about racial bias, policing and"
10257,ameliebaldwin,   was   &amp;   🇺🇸🇺🇸🇺🇸
10258,ameliebaldwin,"Wikileaks drops more damning Clinton emails  still no trending, oh bias twitter?"
10259,hyddrox,Building the
10260,ameliebaldwin,Trump Kingmaker-Billionaires Robert and Rebekah Mercer Have Poured Millions Into Climate Science Denial
10261,jeffreykahunas,Clarion Project: Virginia HS Teaches Allegiance to Allah - Through Calligraphy
10262,danageezus,
10263,paulinett,Trump WH has asked DoJ to go all-out to track down who leaked the president's tax return Lead suspects are John Barron an…
10264,ameliebaldwin, You are  because Americans want an Honest Candidate fighting
10265,ameliebaldwin,  
10266,ameliebaldwin,"Ppl R getting heads chopped off,our streets R Ablaze, our infrastructure is falling down &amp; the  parks here…"
10267,donnabrivera,They are both right They're both unfit
10268,jeannemccarthy0,See Jeb Bush’s tax returns for 1981-2013
10269,jery_robertsyo,"Clinton to predominantly Hispanic crowd in North Las Vegas, Bill by her side: ""our family will support your family"""
10270,garrettsimpson_,Targeted  accounts
10271,jasper_fly,The heat lamp Shining
10272,traceyhappymom,"that DESCRIBE My EXes   “Liar, Liar”  “Psycho”  “One Flew Over the Cuckoo’s Nest”"
10273,hollandpatrickk,President Donald Trump and First Lady Melania Trump depart motorcade to walk parade route
10274,_nickluna_,The FORGOTTEN Man (Person's) Election
10275,paulinett,Truth
10276,traceyhappymom,I do my best work ask Any musician whose famous or dead
10277,dorothiebell,"Nah, don't wanna catch whatever skank virus you have, sweetie"
10278,heyits_toby,If they knew how misery loved me
10279,jasper_fly,People die Everything sucks
10280,stlouisonline,Race in GOP-friendly Missouri could determine Senate control
10281,camosaseko,Protests erupt at UCLA after Donald Trump elected president
10282,ameliebaldwin,
10283,melanymelanin,"▶ Young Sam - Sorry For The Drought - Los Angeles rapper Young Sam makes his return with the ""Sor"
10284,paulinett,Good Night Warriors! Remember White Supremacy Must B Destroyed Globally in order 4 True Peace &amp; Real Justice 2 Reign…
10285,micparrish,"'Lapdogs' v 'wacko birds': In 2016, for the first time in decades, a serious divide in the GOP on national security"
10286,kathiemrr,Make it stop!
10287,ryanmaxwell_1,
10288,queenofthewo,Take my bra off immediately upon entering the house
10289,lazykstafford,"News post: ""So, who’s going to replace Megyn Kelly at 9 pm on Fox News?"""
10290,hyddrox,"WIFE OF PRYAN ADVISOR Accused Of Dumping Trump Tape Is Former CNN Host, Asked Media To BLACKOUT TRUMP 1 Week"
10291,_billy_moyer_,She has robes and she has monkeys
10292,cassishere,Her polls a dropping faster than Bill's trousers at intern orientation
10293,pamela_moore13,Hillary Clinton Is Sliding In The Polls
10294,jacquelinisbest,Weird how the media knew the 2 Iraqis' life stories within an hour of them being detained at JFK
10295,garrettsimpson_,Certainly sounds like a financial plan to us Get the hard hats on Enlist in the  at  Patr…
10296,neworleanson,Judge blocks LGBT rules; Trump shifts immigration tone (10 Things to Know for Tuesday
10297,garrettsimpson_,"Force, violence, pressure or compulsion with a view to conformity, are both uncivilized and undemocratic - Mohandas Ka…"
10298,malloryjared,VERY excited to see the striking Florence Kasumba in
10299,heyits_toby,"Lets be honest  is the one, who we need"
10300,datwisenigga,Appreciate the support in listeners ♨️💯
10301,ameliebaldwin,DanScavino: Great Colorado Springs rally last night realDonaldTrump &amp; team- wheels down at LaGuardia now   https…
10302,thefoundingson,"  No he couldn't, LOL!"
10303,baobaeham,4eva!! follow GangStarrForeva n check out
10304,micparrish,Poland's voting rights in the EU could be suspended over a controversial media law
10305,daileyjadon,"The difference between there, their, and they're, apparently"
10306,dorothiebell,      
10307,jasper_fly,Most Likely to Eat Something if it ON TOP of the Trash Can
10308,cassieweltch,How taxes work
10309,kateritterrrr,WATCH: Tapper won't let Kaine dodge Blumenthal birther charges -
10310,michellearry,Georgia is in my heart
10311,emileewaren,Ha Ha! :) The best way to handle  be the Adult!
10312,dorothiebell,"Trump not only doesn't give much if anything to charity, he CHARGES charities"
10313,jacquelinisbest,Public Safety Daily is out!  Stories via   
10314,micparrish,"Good things come to those who believe, better things come to those who work hard, and the best things come to those who never give up"
10315,ten_gop, 'Everything Hillary Clinton says about her emails is factually untrue A LIE!'
10316,baobaeham,Next 24 hours crucial Call (202)224-3121 and urge your senators to oppose any health bill that's not bipartisan
