Unnamed: 0,user_key,tweet_text_only
62556,jasper_fly,knowing one man has so much power 
62557,paolakinck,Obama Nomics  Seen By The Five Epic Failure Hillary Rotten Clinton  Is A 3rd Term Vote 4 Real Change
62558,datwisenigga,Christians for You!
62559,daileyjadon,fan fiction 😂😂😂
62560,watchmewalkin,"The US government, under Obama, is currently waging a war on indigenous people who are fighting to protect their land"
62561,giselleevns,How to be a productive member of society
62562,drmichaelgarcia,Images from Standing Rock
62563,_nickluna_,       I'm an anonymous citizen th…
62564,melvinsroberts,Calls me bae
62565,judelambertusa,FCC votes to move ahead on proposed rule change to untie set-top box ownership from cable service - The Verge
62566,willisbonnerr,Shop Now&gt;&gt; Freaky Feet Boutique TEXTCALL 1-818-746-3713 freakyfeetboutique   Follow 
62567,ponomarevslav,Syria no-fly zone would mean ‘killing a lot of Syrians’ – leaked Clinton speech
62568,jasper_fly,Seriously
62569,washingtonline,"Republicans latch onto audio of Clinton critiquing Sanders’s ‘revolution,’ but senator’s team pushes back"
62570,jacquelinisbest,"“Women’s March” Chair Admits Event is Really About Defending Planned Parenthood, Promoting Abortion"
62571,kathiemrr,is Twitter
62572,todaycincinnati,Rob Portman won't play Hillary Clinton in mock debates with  |
62573,hiimkhloe,Why Lupe Fiasco is pumping funds into neighborhoods with fresh startup ideas
62574,puredavie,This place has the healthiest food selection Every person I know who shops here has the physique of an ADONIS
62575,siccerthanyou,Trump VS Clinton 😂
62576,regieblackmon,"Watching Obama talk at this  Town Hall and just feeling so grateful to have experienced his thoughtful, measu…"
62577,_billy_moyer_,Its almost time 7 days until the show is live
62578,judelambertusa,"I am not afraid of storms, for I am learning how to sail my ship -Louisa May Alcott"
62579,jacquelinisbest,BREAKING FLORIDA: FORMER HAITIAN Senate President Drops CLINTON BOMBSHELL Exposing Unbelievable Corruption At https:…
62580,lazykstafford,Marines Army Navy Air Force God Bless You All 
62581,malloryjared,"RT Stueyrock: Stop putting limits on your life, you are worth everything"
62582,notritahart,Bring a fully charged phone with you and just lay low for as long as possible
62583,cookncooks,🚂😎🇺🇸
62584,hiimkhloe,Read  on Rudy Giuliani's flailing effort to gain relevance in this Trump moment
62585,queenofthewo,"racism, sexism &amp; homophobia wasn't such a big epidemic issue going into war right now"
62586,westernwindwes,
62587,baobaeham,"""It’s alarmingly easy to think of the first people you would take out if you had to"" - 🤔☠️"
62588,laurabaeley,"""Just yesterday she contacted the family and told us about the trip and the fun she was having"""
62589,finley1589,"The simple choice facing voters Sovereignty, a nation-state, with"
62590,notritahart,  Lick It
62591,mrclydepratt,When the biggest decision of your life is what new rib rub to try
62592,melvinsroberts,my xanax will kick in before a take another mg
62593,ameliebaldwin,Remember the intense uproar over Trump's questioning of election legitimacy? Seems some Dems are now flirting with…
62594,ameliebaldwin,Dear Bernie-if third parties are sidelined those who hate Hillary for stealing the primary will vote Trump to keep her out…
62595,leroylovesusa,BREAKING!!! 5 MORE Bombs found in ELIZABETH NJ 1Detonated via Police Robot !! Must Vote Donald Trump for Safety!!! ht…
62596,klara_sauber,Unser schwacher Staat -  über seine Erfahrungen als Schöffe in  Lesen! Aus  |  https:…
62597,anthonywoodboy,The new Hunger Games: Mockingjay - Part 2 Official Teaser Trailer  is out
62598,mil0blake, is on fire!
62599,alecmooooody,the 'hurricane' is a trick to get you to evacuate so Obama can go to your house and take your guns
62600,micparrish,"7 players from Royals, White Sox punished by MLB for brawl (KLTV"
62601,onlinecleveland,Trump's debate spin doubles down on stupidity: Darcy cartoon
62602,brianaregland,"Fine, you voted your conscience But you knew that either Trump or Clinton would be president You, and non-voters, saw…"
62603,michellearry,"US &amp; Cuba will announce the opening of their embassies on Wednesday, a source tells the "
62604,ameliebaldwin,Obama Makes Quite Possibly the Most Tone-Deaf Remark of His Entire Administration
62605,heyits_toby,FBI warned one week before Garland shooting but did nothing  |
62606,anthonywoodboy,Do I have to?
62607,dorothiebell,We are so proud for those who are not afraid to protect us
62608,laurabaeley,"News For  “Grounds For Impeachment, Bigger Than Watergate,” Says House Intel Committee Member"
62609,giselleevns,to stop wasting hours searching for an absolutely perfect emoji
62610,laurabaeley,"Man sells cancer-fighting herb, US govt jails him, lists him on Interpol"
62611,ramonasnails,Is Donald Trump preparing to lose?  
62612,dailylosangeles,LAPD searches for Trump supporter harassed after allegedly making racial slurs in Hollywood
62613,notritahart,Where's the beef?
62614,mrclydepratt,"We've promoted music/events w/ Nicki Minaj, JuicyJ &amp; more! Let us tweet for u! Signup@"
62615,puredavie,
62616,michellearry,The  pollsters who predicted Hilly would win are the same idiots who have been saying Obama' s approval rating is high &amp; he b…
62617,tpartynews,That's what I'm talking about! Common sense!
62618,puredavie,Be the last to arrive and the first to leave
62619,mrclydepratt,"""Nod Ya Head (feat Prodigy) [Explicit]"" IZM White ft Prodigy -"
62620,paulinett,I should be asleep
62621,garrettsimpson_,Miracles do happen I  always thought True the Vote was one of them
62622,cookncooks,"Hillary's track record shows she doesn't actually care about the interests of Americans, only money and power for herself…"
62623,melanymelanin,"I mean, is it a Super Bowl baby or a Valentine's baby?"
62624,onlinecleveland,"Ted Cruz says he's not voting for Hillary Clinton, still weighing options: Ted Cruz says he won't vote for Hilla"
62625,hyddrox,👏🏻👏🏻👏🏻👏🏻👏🏻👏🏻
62626,hollydler,Scarborough ‘outs’ Mika’s secret feelings on Mike Pence and it’s driving Liberals crazy   vi…
62627,cassieweltch,WAAWOLO!!!!! Check it out Thanks 🙏🏾
62628,dorothiebell,Milo's case proves 2 things
62629,todaycincinnati,Clinton Campaign Plays Down Appearance at Rally by Orlando   |
62630,mil0blake,"she is the only candidate that unified 98% of the people, in agreeing on one topic"
62631,jasper_fly,I get peer pressure from millennials
62632,datwisenigga,There are 21 banks owned by African-Americans in USA
62633,evagreen69,I hope Trump is very likely to win
62634,notritahart,
62635,thefoundingson,"Black Olives Matter is trending
Normal people reaction: LOL
Liberals reaction: HOW DARE YOU!"
62636,jeffreykahunas,"MT  Dear LORD, please bless"
62637,kateritterrrr,97% of the TV &amp; radio spending reserved for presidential candidates is to benefit Clinton campaign
62638,giselleevns,I realize trump and clinton are our options
62639,patriotblake,gov't is coming for your beef steak Trudeau's  to reduce production of meat   carniv…
62640,hiimkhloe,RT  Been glued to  Time line Big hommie be whooping ass all day
62641,notritahart,cashing in on those bets I placed Pay up people
62642,puredavie,All the Shugs gone
62643,_nickluna_,"Global Stocks Dip; Bond Yields, Dollar Rise After Yellen's Rate Guidance; All Eyes On Draghi"
62644,daileyjadon,The protests have gotten out of control! It's time to build a wall around the White House &amp; make Hillary pay for it!
62645,jeffreykahunas,A good reason to vote for Trump but we think Al is bluffing Enlist in the  at  Join!
62646,hiimkhloe,Why  must NOW happen as  failed
62647,mrclydepratt,Experta en el amor  ya mismo en vivo! Sintonízate en Facebook:
62648,emileewaren,If our justice system is going to regain any credibility she must be stopped     https:…
62649,anthonywoodboy,🇺🇸
62650,anthonywoodboy,🇺🇸
62651,melvinsroberts,my mouth after two bottles of wine 😈
62652,pamela_moore13,"Podesta on Bernie Sanders: ""I agree Where should we stick the knife in?"
62653,baobaeham,"Just keep this image in your mind, The First Lady of Japan was meandering around DC today No one even had tea with her A G20…"
62654,thefoundingson,"You can say whatever you want, but the result ill still be the same"
62655,garrettsimpson_,‘Hormone-Disrupting Chemicals’ Are Not A Global Health Scourge  via 
62656,mr_clampin,You can't sit with us because we don't like your face
62657,christinapool61,"Ein Riese, der ein Waisenmädchen entführt – klingt nach einem Kinderfilm:"
62658,dorothiebell,"My polling place's about 1 mile from my house Scott Foval's (WI) talking about busing people ""out to Iowa!"""
62659,jasper_fly,
62660,brianaregland,  but that's how  has affected my community Even in the days of excellent treatment there is fear…
62661,jacquelinisbest,"WATCH: After Chelsea Explosion,  Promises To ""Get Very Tough"" Dithers"
62662,hyddrox,"Hear that,  "
62663,ameliebaldwin,Photo of the
62664,laurabaeley,This is what happens when you pour Coke into molten lead
62665,datwisenigga,"Garth Brooks, Kenny Rogers and Alabama led an all-star tribute to Randy Travis"
62666,dominicvalent,"vote this November rather than stay home The less voters, the greater chance Trump has of winning (YIKES…"
62667,willisbonnerr, - Switches  -
62668,datwisenigga,"F For Feminism, F For The F-Rating | Film News:   Remember back before Blockbuster went, well, bust, one…"
62669,patriotblake,The hottest places in hell are reserved for those who in times of great moral crises maintain their neutrality’
62670,imissobama,The only reason this argument holds any water is because so much of the conversation about Trump has been unmoored from consequ…
62671,emileewaren,"She was like an octopus, with its hands all over the victim"
62672,ten_gop,Seems like a bad day for Dems:
62673,tpartynews,Trump: ‘We Already Have A Trade War And We Are Losing Badly’
62674,ravenicholson,BANISHED - Bill Clinton's 'Son' Speaks Out  via 
62675,daileyjadon,
62676,traceyhappymom,Putin admits: 'Trump is my hero'
62677,wokefromday1,Well all righty then
62678,traceyhappymom,Suck her clit not her happiness
62679,patriotblake,New World order
62680,interfischer,Another one bites the dust
62681,hyddrox,Leaked Audio Proves GOP Sabotaged Donald Trump To Help Hillary Clinton
62682,traceyhappymom,Letting  victims water board him in front of his enabler 
62683,tpartynews,"This man has no feeling, just his own interests!"
62684,nataturn,3 firefighters killed after Washington hellstorm overtook vehicle
62685,bigboyjasiah,Trump don't know shit abt Islam he scared of brown middle easterners No what threat u referring to? 
62686,jasper_fly,I still haven't flounder what I'm looking for
62687,hollandpatrickk,Really    Beautiful winter came:-
62688,johnbranchh,A former Google employee has an ambitious plan to upend our education system:
62689,gab1aldana,"This election I will be voting for a Native American, let's make America not America again"
62690,hiimkhloe,RIP  and    ❤️❤️❤️❤️
62691,giselleevns,He nailed it
62692,todayinsyria,beheaded 2 'spies' in front of children in  and promises more terror in France
62693,jeffreykahunas,"There are the most strict  in California If party visitors have had guns, the end would have been different"
62694,mrclydepratt,why can't carefree blackness look like neon khankelon and 3-in nails? on both women AND men?
62695,heyits_toby,Rick Perry defends Colorado’s ‘right to be wrong’ on  - via 
62696,logan_whatsup,My heart aches
62697,hyddrox,This President warned us of Hillary Clinton she is what he fought so hard for she is whats wrong with America
62698,bruciedublin,not having Clinton there
62699,todaycleveland,Gas station causing controversy with latest mural
62700,jeffreykahunas,Megyn Kelly Allegedly Thought Donald Trump Paid Someone to Poison Her  via 
62701,puredavie,"If God isn't in it, I DON'T need it"
62702,_nickluna_,
62703,carriethornthon,"""I will not rest until children of every color in this country are fully included in the American Dream"""
62704,daileyjadon,IT WAS ME!!!!
62705,mr_clampin,"Now that Peyton Manning has won the Super Bowl, he should retire so he can finish on top  "
62706,melvinsroberts,
62707,hollydler,Hillary Clinton’s Name For Black Servants Revealed: Calls Them “N*ggers”
62708,rogovilia,‘Only partially true’: AP claims Trump is wrong about Assad fighting ISIS; retracts hours later
62709,hyddrox,"After US Refused to Charge Them for Laundering Terrorist Money, Megabanks Busted AGAIN"
62710,_nickluna_,
62711,hollandpatrickk,"Priebus mirrors Spicer’s resolve: ‘We’re gonna fight back tooth and nail every day, and twice on Sunday’"
62712,patriotblake,Death By Design - Check out what my friend  has to say about it
62713,screamymonkey,Top CIA analyst sees likely Putin re-election bid
62714,brianaregland,"Anyhoo, time to get it in gear and head out Have a happy New Year, tweeps, however you choose to celebrate! 🎉🎉🎉"
62715,garrettsimpson_,is a  eating away at the Labour Party Same as  did in the 80s They must be cut out or
62716,cookncooks,"Third in my   series: Unlike Their Parents, Black Millennials Aren’t A Lock For Clinton"
62717,ten_gop,"WATCH: POWERFUL speech from Sheriff David Clarke: ""Blue lives matter in America""👍"
62718,anthonywoodboy,It would be awesome if Tweetdeck could get its crap together
62719,jacquelinisbest,I already promised check to Trump not the govt cause I trust Trump but not the Professional Politicans in r govt either…
62720,jacquelinisbest,"Mother-in-law's coming? Quick,  Get out the Windex bottles and start pouring!"
62721,jeffreykahunas,Well said
62722,giselleevns,
62723,ameliebaldwin,Did  die bc Nevada primary was rigged by his DNC data dept &amp; he was planning to go public?
62724,mil0blake,Keep up the fight we are with you The are going us all the way
62725,tpartynews,Hillary supports Islamization of America! The tragedy is a result of the stupid policy!
62726,cookncooks,Let's make  trending
62727,tpartynews,was historic &amp; shows leadership!
62728,pati_cooper,Obama will make first visit of his presidency to a US mosque
62729,mr_clampin,How loud silence is
62730,hyddrox,"  In reply, calling a child a brat is from British military acronym: ""British Regiment Att…"
62731,ameliebaldwin,Here are a few reasons why Trump should move the US Embassy to
62732,realrobert1987,"IOWA is meaningless, just ask President Sartorum and President Huckabee  "
62733,hyddrox,"If this is the future, we are screwed I need a safe room after watching the stupidity"
62734,paolakinck,Good job Obama! We act like weak losers when dealing with the insecure morons in Iran
62735,cookncooks,Sup girl? You wanna get drunk and get some egg mcmuffins from McDonald's?
62736,patriototus,School said that displaying flags could “potentially compromise the safety of all in attendance at a school event”
62737,thefoundingson,"Trump’s first economic report card: a strong 235,000 jobs added in February"
62738,cassieweltch,"I was going to call in sick tomorrow, but someone already has the day off Will that stop me?"
62739,patriotblake,Hmm
62740,liljordamn,Trump's choice for Attorney General was once considered by legislators to be too racist to be a federal judge:…
62741,lazykstafford,California Democrats Decriminalize Child Prostitution
62742,cookncooks,We just dropped velvet shoes at Vans my heart
62743,traceyhappymom,Me: your so hot
62744,j0hnlarsen,"Thrilled to share the first edition of Border Lands, my new biweekly column on Europe's burning peripheries"
62745,pamela_moore13,"MSNBC reporter: ""I'm sorry, Hillary's events this week in swing states do not feel like a winning campaign""…"
62746,laurabaeley,DNC speakers:
62747,specialaffair,Voters weigh in on Clinton email controversy
62748,thefoundingson, I can still see nothing but your empty words
62749,chesplayschess,"The media is STILL saying  questions are ""debunked"" because of a FAKE document that we never cited! https:/…"
62750,ravenicholson,trump staffer 1: how are we gonna win over women?
62751,evewebster373,Brian Williams to remain on NBC after suspension
62752,priceforpierce, 
62753,paulinett,Idiom of the Day: cloud of suspicion
62754,daileyjadon,
62755,giselleevns,my grumpy uncle discussing politics during a family dinner
62756,heyits_toby,‘Spectacularly ill-informed and nearly hysterical’: Brit Hume on Meryl Streep’s new ‘brownshirts’ drivel
62757,jeffreykahunas,Targeted  accounts
62758,hyddrox, I posted to DJT's personal account and you can't even see it You can only see the people piling up on him a…
62759,traceyhappymom,I DM'd my Christmas ornament
62760,heyits_toby,Why The Melted Fuel Under Fukushima Could Poison Our Planet With Nuclear Radiation For
62761,chicagodailynew,Melania Trump's Website Taken Down
62762,giselleevns,"After the embalmed dead tree was decorated &amp; lit up for a day, it's time to bury it in my backyard"
62763,queenofthewo,tears and nuttela make an easy salty/sweet  midnight snack
62764,_billy_moyer_,"Residents Unhappy With Removal Of 'God Bless America' Banner Commemorating Sept 11, 2001  via "
62765,malloryjared,😭😭😭😭😭
62766,jacquelinisbest,Only dangerous conspiracy theorists talk about elections being stolen
62767,kateritterrrr,Kaine doesn't side with Clinton in ruling out Iraq ground troops -
62768,ameliebaldwin,Seth Meyers mocks Trump’s Miss Universe obsession: ‘Nothing creepier than hanging around beauty pageants’
62769,baobaeham,Man 😂😂😂😂😂 (Sidenote spider man IS from NY
62770,lazykstafford,"New post: ""Humanitarian support 'Band-Aid' for unresolved Afghanistan conflict, officials say"""
62771,jeffreykahunas,   I know! Our government's been hijacked  - but Mr Trump will rectify once he'…
62772,judelambertusa,It is a thousand times better to have common sense without education than to have education without common sense
62773,gloed_up,This is soooooo on point
62774,cassieweltch,"Do not fear to be eccentric in opinion, for every opinion now accepted was once eccentric -Bertrand Russell"
62775,cassishere,Reince Priebus Touts Donald Trump's Momentum: 'It's a Change Electorate' - Breitbart
62776,cookncooks,5 things to know about the new California Marijuana Regulations   via 
62777,garrettsimpson_,Former GOP Lawmakers: 'Manifestly Unqualified' Trump Represents an 'Unacceptable Danger'  via 
62778,mrclydepratt,Now Playing: Devinci - Know About Me ( -&gt;
62779,tpartynews,Explain your children the meaning of term Islamization before it's too late!
62780,priceforpierce, Maybe Kroft will shame President Obama into bombing with Putin  I doubt his efforts will work though
62781,ryanmaxwell_1, why are you keeping silence about water contamination in the American falls?!
62782,heyits_toby,Did California Democrats Legalize Child Prostitution?
62783,puredavie,Jurassic Trailer Park  
62784,laurabaeley,
62785,puredavie,"You are the weakest link, but it's 3am and I'm desperate"
62786,logan_whatsup,House plans vote on 2-month short term extension of highway bill
62787,blmsoldier,This Data Download on  segment is key Voters are basically as concerned about Clinton's emails as Trump's fight…
62788,patriotblake,Antarctic ice crack could cause big rise in sea level via 
62789,j0hnlarsen," So agents are ""furious,"" are they? 😐But still willing 2tolerate the corruption, so not that furious after all ht…"
62790,daileyjadon,when somehow you're living outside of life because life is unfair 
62791,angelabach991,"Nach der Abwahl von SPD und Grüne: Wie NRW jetzt ""weltbeste Bildung"" bekommen soll"
62792,baobaeham,Join us as we present the documentary short   6/8 with  
62793,specialaffair,"Trump: 70 percent of federal regulations ""can go"""
62794,melvinsroberts,Mixed Martial Farts  
62795,melvinsroberts,when Hillary lost her virginity
62796,notritahart,The Edmonton Soilers  
62797,hyddrox,Nort since she came out of birth canal spouting why her other named her Hillary 6 yrs before he did what he was fam…
62798,cassieweltch,"""These Sales Associates are always asking if I need something They must work on commission"""
62799,brianaregland,because he was a manipulative POS and was more interested in his acting career than anyone else
62800,margarethkurz,"Guten Morgen! Ich brauche dringend noch eine Tasse Kaffee, um noch zu begreifen, was unter  passiert😀"
62801,_nickluna_,OH  THEY HAVE THEIR OWN HOPES &amp; DREAMS &amp; NOT ONE OF THOSE IS PROTECTING SOMEONES LEGACY THAT NEVER CARED
62802,willisbonnerr,Happy birthday 
62803,_billy_moyer_,NORAD Cmdr Sr Gen Staff involved in Cover-up   
62804,hyddrox,History Will Remember This As A Time When Globalist Politicians and Their Media Were Defeated By The American Peopl…
62805,rh0lbr00k,Why should the US weaken its own authority while strengthening Russia/China/Iran? Stop   Giveaway
62806,baobaeham,Coming May 25th RightOnTV LiVe Trivia4PRIZES   or  …
62807,mr_clampin,Archer-y
62808,ameliebaldwin,Protester Interrupts Cubs Post-Game Shouting “Bill Clinton Is a Rapist!” (VIDEO)  via 
62809,margarethkurz,Deutsche Sicherheitsbehörden rechnen beim  in  mit mehr als 10000 gewaltbereiten Linksradikalen
62810,screamymonkey,Trump tells Netanyahu he would recognize Jerusalem as Israel's capital
62811,patriotblake,"Trump is an inspiration to woman I don't care what everyone says! He inspires me to go out, work hard, &amp; achieve my drea…"
62812,leroylovesusa," the Neo-Nazis have fully exposed him -- it half of it is true, he's really a world-class scammer &amp; sleazeball"
62813,onlinecleveland,"Donald Trump to discuss immigration, national security at Youngstown State University (live coverage"
62814,_nickluna_,Court rules Wyoming wolves should be stripped of federal protections
62815,johnbranchh,At the edge of the world is a swing:
62816,daileyjadon,
62817,ameliebaldwin,"YES! Jets owner, Hollywood producer, Wall Street titans helped drive  $18M day"
62818,garrettsimpson_,"Wow, Reince Priebus selected as Trump's Chief of staff! Where will  go?"
62819,ameliebaldwin,"ThankYouBernie: But the Dem hero, Bernie Sanders, would rather we have Hillary in office poking Putin &amp; calling fo…"
62820,jenn_abrams, Clinton Foundation was created as a small buisness one day
62821,mil0blake,‘Economic growth is the engine of the escape from poverty and material deprivation’ – Nobel laureate Angus Deaton http:…
62822,jani_s_jac,is this poorly translated from Russian or is this just the ramblings of an old fool?
62823,cookncooks," If they feel uneasy by a British flag in Britain, then they should leave Britain! So should the linden councillor"
62824,melanymelanin,Travis Rudolph has 9 catches for 202 yards
62825,cynthiamhunter, Stop Trump?
62826,_nickluna_," JOY VILLA Gives SPEECH @  Rally ""We are not gonna be bullied, We are not gonna be spit on"" http…"
62827,margarethkurz,Guten Sonntagabend! Das Wochenende geht zum Ende und ich wünsche euch eine schöne und ruhige Nacht 😘
62828,chrixmorgan,getting driver's license I can do without it great for the couple of years
62829,_billy_moyer_,  wish he would worry more about IS crucifying Christians
62830,brianaregland,"Of course they do And under Trump, further deregulation will allow for even more shenanigans"
62831,pamela_moore13,"We fight for our flag, our freedom &amp; our heroes who protect it!"
62832,thefoundingson,Veterans need you! 
62833,queenofthewo,When your boss asks you if you have a Twitter account
62834,patriotblake,Why did Hillary lose No 48:
62835,jenn_abrams,How to start a riot (via 
62836,hyddrox,We need to love &amp; live free through our own endeavors God wants His people to live an abundant free life &amp; that starts a…
62837,jeffreykahunas,Praise You Father for all You have planned for each one of us in2017
62838,brianaregland,"My dream set is $2,200 RT  Kitchen knives are expensive as shit Even at Target a set is like $139"
62839,hunteroddddom,"Is this the wave that sinks Trump's ship, ladies?"
62840,curtisbigman,"Trump calls John Kerry a disaster, too He really supports our"
62841,jacquelinisbest,Student Driven Out Of School For Backing Trump  via 
62842,hyddrox,A bomb DID go off in New York  Leftists are such asses
62843,puredavie,Marvel at the fact that Baby Jesus delivers presents on Christmas Eve in the Czech Republic
62844,brentmcclure275, A feminist in dad jeans! Kaine is exactly my demographic
62845,judelambertusa,MT  The Only Tried True and Tested Candidate is
62846,_nickluna_,"Roger Stone: Jeb! takes a break from snorting coke and banging his mistress to bash Trump on ""values"""
62847,mrclydepratt, - Young Zel - New Bae  -
62848,_nickluna_,Één van Rutte's afspraken
62849,laurabaeley, And that's the TRUTH
62850,puredavie,
62851,newspeakdaily,Obama signs opioid addiction bill into law -White House
62852,_billy_moyer_,The most beautiful experience we can have is the mysterious It's the source of all true art and science
62853,mr_clampin,why my sisters exist?
62854,cookncooks,
62855,thefoundingson, So what's your point?
62856,hollandpatrickk,Nearly $20 Million in Cash Tucked Away in Box Spring
62857,melvinsroberts,"The 4,876 things that start running through your brain as soon as your head hits the pillow  😫"
62858,kathiemrr,
62859,jacquelinisbest,Retired Admiral: Adversaries will step up harassment of US military  via 
62860,evagreen69,"Of course,  Dems want to provide terrorists with our jobs and tax money"
