Unnamed: 0,user_key,tweet_text_only
25044,rightnpr, always claims she supports women rights and yet she takes money from countries that torture women!👇
25045,ameliebaldwin,"Trafalgar Square, London, circa 1917"
25046,lazykstafford, he's bitch
25047,jeblary2016,Obama said we must help othersHow about stop killing others?
25048,garrettsimpson_,And Oscar goes to…
25049,kathiemrr,Fifty shades of terrible
25050,hollydler,"When Michelle Obama stumps for Hillary after calling her ""unfit for the presidency"" in 2008"
25051,mr_clampin,"It seems our PEOTUS is more concerned with SNL, than say, intel-briefings? Or the protest @ Standing Rock in N Dakota?…"
25052,melvinsroberts,Can we fast forward
25053,notritahart,1) Collect Underpants
25054,giselleevns,news about Kardashians
25055,brianaregland,On this Installment of  Country Star Glen Campbell Meet Reggae Legend Dennis Brown
25056,marissaimstrong,Carter chooses Trump I choose  –   …
25057,jeffreykahunas,Female circumcision is part of     
25058,kathiemrr,
25059,usa_gunslinger, 
25060,paolakinck,Actor Andrew McCarthy’s ‘support’ for Hillary might NOT leave the Clinton campaign laughing
25061,hyddrox,Pope Again Forgets About Vatican’s GIANT Wall In Attack On Trump [VIDEO]
25062,whitehousecards,"Бывшая Мисс Вселенная, активно поддерживающая Хиллари Клинтон, была замечена в порнографических видеороликах…"
25063,evagreen69,is my confidence in the future Unfortunately some bigots use it against citizens with ulterior motive
25064,kathiemrr,Darth Vader wins again!
25065,leroylovesusa,weird how  that town hall is so hostile to trump (kidding
25066,priceforpierce,"News post: ""Graphic: Two Cartel Gunmen Killed in Battle near Texas Border"""
25067,sergeev_tolik,"This election is being rigged by the media pushing false and unsubstantiated charges, and outright lies, in order to e…"
25068,pamela_moore13,"DEMOCRATS COMPLETELY CORRUPT
 New FBI documents show a ""bribe"" was offered to agents in the…"
25069,dorothiebell,She is beyond immoral  
25070,emileewaren,MT  To all my followers and friends who walk the
25071,cookncooks,Remember 6 corporations own 90% of media
25072,mrclydepratt, 
25073,ameliebaldwin,Intel document says Russia has video of Donald Trump doing perverted things with prostitutes
25074,tpartynews,Dishonest Media can't stop common sense! More life long Dems refuse to support Hillary Clinton!
25075,thefoundingson,"Russian ambassador was shot in Turkey day before meeting between Foreign ministers of Russia,Iran,Syria &amp; Turkey on Syr…"
25076,ameliebaldwin,Who is  asking??  The  editorial board???  Please tell me how 55% of America loves what Obama is doing…
25077,pigeontoday,Happy  Nice fact: from 1922-1971 you could not listen to the radio in the UK without a licence
25078,paulinett,"Democrats, YOU BETTER STOP ALL REACHING ACROSS THE AISLES BULLSHIT Stop Be obstructive Learn that from the asshole GOP"
25079,prettylaraplace, I am Bachelor's in criminal justice w minor in public admin &amp; a certificate in national security 🇺🇸 Tru…
25080,hiimkhloe,"Nonetheless, an American is 45 times more likely to get shot dead by another American than killed by a terrorist https…"
25081,lazykstafford,Hmmmmasleep by 12? Maybe? Ya?
25082,_nickluna_,"""jusqu'à ce que la religion soit entièrement à Allah, nous continuerons à vous haïr"""
25083,judelambertusa,vs
25084,puredavie,Masturbatingeither way you're f*cking yourself
25085,jasper_fly,Guns N' Cirrhosis  
25086,onlinecleveland,Donald Trump's dangerous vote-rigging claims a last-ditch grasp at the presidency: editorial
25087,tpartynews,This man deserves more respect than our current President who is ready to protect all Jihadis
25088,evagreen69,Brutality of Russians losing empire remembered as they try
25089,paolakinck,"During Times of Crisis, President Obama Goes Golfing, Fundraising -"
25090,brianaregland,VIDEO: Anti-Trump protestor tackled while delivering speech in the Union
25091,ten_gop,Please RT If You Think A Photo ID Should Be Required To Vote!
25092,thefoundingson,"  I don't know what's your problem with the Bible is but I'm not your psychologist, OK?"
25093,lazykstafford,"Remember when I told you the ""FBI flipped Flynn"" story was bullshit?"
25094,jeffreykahunas,Memetics is real Memes drive perception which drives actions which drives reality Meme wars are here to stay
25095,thefoundingson,Liberals are criticizing Trump supporters for  The same liberals who shat enough bricks to built the godd…
25096,malloryjared,"""From Nothing (Prod By Davo)"" RJ (OMMIO"
25097,emileewaren,OMG-GROSS!  
25098,traceyhappymom,Interrupt a nun's masturbation
25099,cassieweltch,Exactly
25100,emileewaren,Last chance to ask  to pardon Edward Snowden before we deliver your signatures tomorrow Add your name today! http…
25101,_billy_moyer_,City shows dangers of giving kids soda with new gross ads
25102,michellearry, take this guy with you back to mecca
25103,brianaregland,Gotta Have Invisible Empathy Nowadays! God forbid someone be offended in life  goes in
25104,giselleevns,to ride my convertible whenever the fuck I want
25105,dorothiebell,DISGUSTING! NOT ONE WORD From  About CRIMINAL DEMOCRATS Sending in Goons to BEAT TRUMP SUPPORTERS
25106,patriotblake,Why is the Obama team waging war against Israel?why are they taking steps to isolate and then kill a democracy and an all…
25107,pamela_moore13,"Burgess Owens: ""If we're Christians, let's stop voting for Democratic atheists""
""Hillary Clinton for President"""
25108,angelabach991,Dänische Polizei lässt Fähren nach Drohung wieder fahren
25109,todayinsyria,President Obama ordered to send 3000 SOF for an operation at the Syrian city of
25110,mrclydepratt,Best soundcloud promotion deal on the net for $2200 click here for details
25111,thefoundingson,She's awesome!
25112,danageezus,one day this dog will finally stop being lazy
25113,hollandpatrickk,Check out PINK STORM TROOPER: TRUMP SUCKS! Available for the next 1 day via 
25114,johnbranchh,Iran navy fires shots at tanker as tensions rise in Gulf
25115,ryanmaxwell_1,"       Igual para ti, Omar, feliz domingo 😊"
25116,laurabaeley,News: Obama Just Revealed a Painful Truth About White America
25117,traceyhappymom,"Laugh and Laugh, then laugh some more"
25118,kathiemrr,Set your scale back ten pounds 15 for porkies
25119,thefoundingson,There are educated idiots and there are educated smart people
25120,jasper_fly,Babies banned from all public arenas
25121,patriotblake,  Good Lord WTF is wrong with
25122,dorothiebell,      
25123,todaybostonma,Michael Bloomberg to endorse Hillary Clinton   |
25124,garrettsimpson_,FBI Director James Comey Rejects Demands to Reopen the Clinton Email Investigation
25125,garrettsimpson_,A VOTE FOR CLINTON IS A VOTE FOR LYNCHING
25126,laurabaeley,"For the First Time Ever, a Prosecutor Will Go to Jail for Wrongfully Convicting an Innocent Man"
25127,daileyjadon,What of the growing homeless problem in America? There's an AWFUL LOT OF PROPERTY AROUND THE WHITEHOUSE JUST SAYIN'
25128,onlinecleveland,"Vice Presidential nominee Mike Pence takes center stage at RNC: CLEVELAND - Sporting a deep blue tie, and standi"
25129,priceforpierce,Please sign and share my petition
25130,kenzdonovan,We are not the terrorist! The people are not the terrorist! You are the terrorist   Trump is not!!
25131,garrettsimpson_,Dried fish pools near the Ein Herod Valley in  makes a perfect  scene!
25132,malloryjared,Larry Nance Jr picks up six steals and joins four other Lakers in double-digit scoring
25133,daileyjadon,what is it ?
25134,ryanmaxwell_1,GRATITUDE
25135,puredavie,"Wear a ""Make America Great Again"" hat with your suit They will make you 'Lord of Turkeys'…"
25136,westernwindwes,"Here's what Spicer said, per the pool report This is basically the border adjustment tax congressional Rs want"
25137,willisbonnerr,to be clear - these progressives are more offended by a WM being punched on camera than an unarmed Black child gunned down o…
25138,garrettsimpson_,Baruch Dayan HaEmet Our thoughts and prayers are with Dalia's family and all  victims everywhere
25139,giselleevns,"if I point this 🔫 at you, you'll give me what I want"
25140,peterkistner,Jetzt sehe ich keine Alternative für sie
25141,evagreen69,I nearly attended a  rally just to beat the heat and be near something shady!
25142,tpartynews,signs spotted near  hospital in Los Angeles
25143,cookncooks,Rumors are getting HOT about Hillary Clinton being arrested in the next 72 hours  up to something?
25144,kateritterrrr,Lib Media and HRC angry that  called it right Unlike HRC/BHO with Benghazi It's Terrorism!
25145,ameliebaldwin,"Hillary Wants To IGNORE RADICAL ISLAM &amp; Promote PROGRESSIVE ISLAM Hey Hill, They All Read The Same Quran…"
25146,newspeakdaily,Donald Trump Says He Disagrees With Mike Pence Over Syria
25147,patriotblake,"News post: ""´It´s organized chaos!´: White House staff reveal preparations for inauguration moving day' when they´… htt…"
25148,mil0blake,"So Charles Koch, the Billionaire King of Special Self Interests, is fighting special interests, such as 98% of the cou…"
25149,paulinett,"It's not about what happens, it's what you do about it"
25150,hollandpatrickk,the CIA protesting a right wing president being installed by a foreign power might be the funniest thing that has ever hap…
25151,leroylovesusa,"american people are sick and tired of talking about your damn emails  , hell yeah"
25152,melvinsroberts,The Trial of Homer Simpson  
25153,cookncooks,"""This is where anybody who call themselves a freedom fighter should be — in   in solidarity https…"
25154,ameliebaldwin,More: JS pressed  AGAIN on need for independence from WH! Also talks OLC  
25155,brentmcclure275,Def ready to check it out
25156,willisbonnerr," “""Beginnings/Endings”"
25157,dominicvalent,I think I need a second job
25158,leroylovesusa, You can count on it count on me voting for Trump 
25159,danageezus,Now you can insult your president without being called racist
25160,ten_gop,'These cheating Dems will do anything to win an election' ~ Sheriff David Clarke
25161,michellearry,Question of the Day: Who do you believe? Julian Assange or President Obama and Hillary Clinton
25162,hyddrox,Harry Reid Unable to Cope with Idea of GOP Winning His Senate Seat
25163,hyddrox,Donald Trump Plays The Mainstream Media Like Charlie Daniels' Fiddle |
25164,ameliebaldwin,Hillary’s resistance only aggravates the situation
25165,mr_clampin,text me cuz I won't answer if you call
25166,laurabaeley,I guess I'll just never understand people who think this whiney crap from Trump is presidential
25167,jenn_abrams,Your voice is important for us (no
25168,newspeakdaily,Altman: Don’t See Clinton's Health as Serious Problem
25169,dorothiebell,OBAMA'S A MUSLIMHIS HARVARD EDUCATION &amp; POLITICAL CAMPAIGN WAS FUNDED BY SAUDI ROYAL FAMILYHE'S NOT 4 CHRIST!!
25170,jacquelinisbest, are you dense?  is  not  the
25171,margarethkurz,"Es ist Frau  nicht egal,wie es so viele glauben! ""Merkel spricht Opfern der Messerattacke Mitgefühl aus"""
25172,thefoundingson,Illegal immigrants were paid $93 million in Benefits This is where your taxes go
25173,daileyjadon,i have free food
25174,jasper_fly,"Surprise, motherfucker!"
25175,puredavie,Wal-Mart people
25176,hyddrox,"Not one Democrat called for an investigation over  &amp;   meeting,  deal or donor"
25177,lazykstafford,You live longer once you realize that any time spent being unhappy is wasted  – Ruth E Renkl
25178,cookncooks,Match made in HELL: Baby butchering PP
25179,ryanmaxwell_1,
25180,anthonywoodboy,EXTREME TB Strain Brought Into USA – BB4SP
25181,mrclydepratt,😭😭😭 RT    You better leave us alone Mr Grant unless you want a lawsuit on your hands bu…
25182,evagreen69,"Police Make Arrests, Officers Hurt In Clash With Rioters In Baltimore"
25183,_billy_moyer_,"No matter what a woman looks like, if she's confident, she's sexy"
25184,rh0lbr00k, + 
25185,johnbranchh,A mistake is simply another way of doing things
25186,ameliebaldwin,Hearing President Trump read the families' names who have been impacted by illegal alien murderers is emotional
25187,heyits_toby,Former Newspaper Editor Who Exposed CIA Found Dead | World
25188,judelambertusa,Everyday i wake up is a new opportunity Forget what happened yesterday
25189,mr_clampin,
25190,jeffreykahunas,Tis the Season to be Jolly and Sir Winston is out whipping Nazi butts Join him in high adventure in Jack's London!
25191,lazykstafford,A sign America will be great again? Dollar climbs to strongest standing since 2003
25192,mrclydepratt,""" This ain't an Amélie Larrieux song baby"""
25193,melvinsroberts,HDDVD Player it is the future
25194,hyddrox,AMEN! Donald Trump has pledged 2 get rid of Islam-financed Common Core
25195,garrettsimpson_,Lindsey Graham drops out of White House race with special video message; WATCH:
25196,hyddrox,Obamacare was supposed to take care of the womens health issue
25197,notritahart,Charlie Sheen's dick
25198,mrclydepratt,"Assuming bigotry must be intentionally in mind when it happens, ignores the real power of it - it's an automatic reflex"
25199,garrettsimpson_,Shooting in San Bernardino Kills at Least 14
25200,willisbonnerr,I feel like Black women &amp; men can be TOO critical of eachother due to preconceived notions
25201,oaklandonline,Republicans Line Up Against Trump
25202,giselleevns,new words
25203,nataturn,You’ll never guess who tweeted something false that he saw on TV - The Washington Post
25204,lazykstafford,"New post: ""AP-Scorecard"""
25205,cassieweltch,I'm Stuck somewhere between try harder and why bother
25206,malloryjared,Always and never are two words you should always remember never to use
25207,jasper_fly,my Samsung didn't want to sext with her iPhone
25208,anthonywoodboy,Forrest Dump
25209,c__wells,His brother killed thousands of our soldiers in Iraq and do we need to repeat that?
25210,baobaeham,Congrats to OHIO native  on the  👏🏽
25211,traceyhappymom,"There Will Never Be a Conscious Robot, Part 2 | Saved By Gödel"
25212,tpartynews,"Dana Perino: ""Donald Trump has done a very good job since the convention of consolidating the Republican vote""

""T…"
25213,hyddrox,Wonder how different this story would be if  or  were  or     https…
25214,judelambertusa,"‘Petrified”Martian Soldier’ Found In NASA Mars Photo, Claim Alien Hunters"
25215,emileewaren,poracci
25216,usa_gunslinger,They are losing control and they are terrified there will be no 'puppet-in-chief'
25217,kateritterrrr,ADMITS HE'S FROM  -- NOT FROM  OR  - BUT  SHAMEFUL     h…
25218,evagreen69," been bullseye accurate about Black Lives Matter, a ""movement"" built on a LIE!"
25219,hyddrox,Ask yourself: What product did the Clintons sell to make their $150M? America &amp; Haiti Imagine what she'd do as POTUS!
25220,giselleevns,a street fight!
25221,anthonywoodboy,WTG LESTER!!!! Lester Holt wants Brian Williams’ $10M salary
25222,chicagodailynew,Clinton: Half of Trump's supporters fit in 'basket of deplorables'
25223,hyddrox,"Obama &amp; Globalists are giving away our freedom of speech,UN to take over the Internet 10/1"
25224,_nickluna_,Security of  at risk! 'Right' Must Unite to Secure  Nothing else will matter!
25225,laurabaeley,MaddowBlog: Trump sparks new controversy with US Attorney dismissals
25226,mr_clampin,contrary to widespread belief if jules kroll's checks weren't being cashed nick kroll would never book anything but extra wor…
25227,logan_whatsup,Crazy man!
25228,jeannemccarthy0,Never attribute to malice that which can be explained by stupidity - Robert J Hanlon
25229,mr_clampin,The flyest man in and out of show business
25230,nojonathonno,Pundits Credited Trump With Not Creating His Own Controversy This Weekend Here's What They Ig…
25231,leroylovesusa,Soon your roll of toilet paper will have 6 sheets
25232,ameliebaldwin,"KABOOM!!! A real Poll!! CBS/YouGov Poll,"
25233,paulinett,"A 12-year-old Jersey City, NJ, Black boy crochets every day and donates his works to Homeless Shelters"
25234,judelambertusa,California Bill of Rights for Children Would Give The State New Powers Over Your Kids
25235,heyits_toby," Every Hillary voter I know of is woefully ignorant on basic, easily provable facts So fucking stupid"
25236,willisbonnerr,"I never claim to have wings on, I get my by any means on Whenever there's a drought, get your umbrellas out cause that's…"
25237,judelambertusa,It’s proved that serious  side effects are extremely rare
25238,brianaregland,Black List 2016 is coming
25239,pamela_moore13,There r more FBI agents investigating Hillary than there r people at her rallies That says a lot
25240,johnbranchh,Breathing New 'Lyfe' Into Existing Space
25241,puredavie,my mother-in-law got naked
25242,puredavie,the black guy in the porno
25243,patriotraphael,"Fave if I should buy this towel, RT if I should fuck it"
25244,lazykstafford,Student loan payment overdue notices
25245,traceyhappymom,to start  Act II without me tomorrow!
25246,peytoncashout,"All of this was apparently just fine, and forgive me if I never let you forget it"
25247,hyddrox,
25248,garrettsimpson_,WE SUPPORT  ✔️VOTE
25249,judelambertusa,"Gun control means being able to hit your targetIf I have a 'hot button' issue, this is definitely it"
25250,giselleevns,How to break into potential bae's locker
25251,mr_clampin,The King's Paid Speech
25252,thefoundingson,"""Although I disagree with you but it's your First Amendment right to express your opinion and I respect it,"" - said…"
25253,ameliebaldwin,NY Post editorial: Bill Clinton’s birthday bash proves the Clintons just can’t stop influence-peddling
25254,ryanmaxwell_1,My sister made some hard ass shoes for tomorrow
25255,heyits_toby,"JPM: ""Political Expectations Are The Single Biggest Risk Facing The Tape"""
25256,queenofthewo,
25257,ryanmaxwell_1,CIA expert agrees with me on   Cruz lying about
25258,heyits_toby,Terror and  from  will end fast if world works to bring  to ISIS free Syria ASAP
25259,thefoundingson," So, you prefer to let someone else steal it from us just not to feel so guilty?"
25260,traceyhappymom,This year: no resolutions
25261,evagreen69,"Democrats, you think you are popular and the election was stolen?  You have been thrown from power EVERYWHERE You control…"
25262,johnbranchh,▶Mother of US Muslim soldier hits back at Trump over speech silence  
25263,ryanmaxwell_1,Forget about waiting in line to get your baby kissed This is the Selfie Election
25264,judelambertusa,surrealistic but fun!
25265,patriotblake,"Ford to cancel $16B plant in Mexico, adding 700 jobs in Michigan  via "
25266,melanymelanin,Cam Newton's new gold-plated car is just as stylish as his outfits
25267,evagreen69,Arlington woman who boxed off 200 pounds ‘is definitely an inspiration’
25268,giselleevns,"""I'm gluten free"" - die alone"
25269,jenn_abrams,"Sign in a Student Center
How the hell are they going to survive after graduation?"
25270,prettylaraplace,🚨 🚨 🚨 HUGE!! FBI finds emails related to Hillary Clinton's State Department tenure
25271,finley1589,       So that excludes u ya lyi…
25272,traceyhappymom,Queue for half an hour in local supermarket
25273,thefoundingson,How banking elites are NOT involved in
25274,atlanta_online,Ted Cruz’s RNC snub adds spice to tomorrow’s Georgia visit  |
25275,leroylovesusa,Jesus desire for you? An abundant life!
25276,_nickluna_,Thank you to teachers across America! When I become POTUS we will make education a far more important component of our…
25277,rh0lbr00k,I'm astonished media attacking Trump for calling a bomb a bomb Liberals lost all common sense
25278,johnbranchh,"Donald Trump doesn't care about black or brown people, let alone earning our votes"
25279,ameliebaldwin,WTF?!
25280,hiimkhloe,Wait my TL was off by 4 days lmaooo
25281,jeffreykahunas,Targeted  accounts
25282,tpartynews, always has time to meet with the police!
25283,devinedevinbr,Obama to visit US mosque for first time: President Barack Obama is due to visit a mosque in th
25284,puredavie,Separate beds or separate bedrooms?
25285,anthonywoodboy,🇺🇸
25286,traceyhappymom,my wife would think she had 6x kids (own 2 kids plus myself and Mr Double My wife counts me as 2x kids-…
25287,giselleevns,To find a book that can teach me street-smartness
25288,ten_gop,RT &amp; LIKE if you think the same!
25289,brianaregland,UPDATE: Baby Bash Addresses Paul Wall Drug Arrest: “Don’t Believe All The Hype”
25290,giselleevns,"Beer, Wine and Tequila: Potions that make everything pretty much okay"
25291,priceforpierce,
25292,emileewaren,LIVE on  Come and take the red pill on Saudi Arabian infiltration of the White House
25293,paolakinck,FOURTEEN MEDAL OF HONOR RECIPIENTS ENDORSE DONALD J TRUMP FOR PRESIDENT
25294,ameliebaldwin,"California Govt: Once we secede, then we will also ask the UN to exit NYC and relocate in Hollywood or San Francisco's…"
25295,c__wells,Perfection of means and confusion of goals seem  – in my opinion  – to characterize our age
25296,tpartynews,Like if you think we should protect our 2nd amendment!
25297,ameliebaldwin,We are sick and tired of the elitist white media pushing the ridiculous idea that Trump is a racist   h…
25298,malloryjared,Crying
25299,notritahart,"Happy Thanksgiving to all of my non American friends Especially the best human I've ever met,  who keeps me mo…"
25300,cookncooks,A special prosecutor must be appointed now This is the latest bombshell
25301,brianaregland,"This Trump tweet just sent $LMT's market value down approximately $1,200,000,000"
25302,notritahart,
25303,paulinett,"China Now The World’s Largest Economy, America Falls To Second Place  "
25304,hyddrox,I say this with Regret Trump has allowed the Democrats to bully him into multiple recusals from Sessions and the firing…
25305,willisbonnerr,"Regardless of my ups &amp; downs,  is always around"
25306,pamela_moore13,"When Everyone In Our Government Is 100% Corrupt, Including Our President It's Time For  To Clean House!…"
25307,pamela_moore13,"""Voting Hillary because she's a woman is like drinking antifreeze because it looks like Gatorade"""
25308,redlanews,  that's a valid criticism for a POTUS candidate ffs!
25309,jeannemccarthy0,Why is there no national outrage on this ghastly incident in Lucknow? Because there is a possibility of a communal angle?
25310,ameliebaldwin,READ THE SIGN: Don't believe the media 
25311,malloryjared,NOW! AT Grand Central
25312,hyddrox,Just say NO
25313,heyits_toby,"McConnell wants 6-7 nominees confirmed by day one, prioritizing nat sec picks"
25314,willisbonnerr,👉🎥Watch‼ : Bounty Killer- Shows His Support For Busy Signal - Fresh From Yard Ep
25315,traceyhappymom,
25316,paulinett,Blacklivesmatter leaders have a new report analyzing relationship between use of force policies and police violence https:…
25317,garrettsimpson_,MT  Democrat operative says Hillary would support total gun ban
25318,jeannemccarthy0,Why didn't  invite Gold Star Mother Pat Smith to the
25319,kateritterrrr,"  Love the right boards watch you anytime you are on TV, make sense also scotus voter &amp; Trump su…"
25320,cassieweltch,lol
25321,tpartynews,'Stop trying to fix the police Fix the ghetto' ~ Sheriff David Clarke
25322,c__wells,President Obama cancelled White House tours
25323,hyddrox,"""On my first day in office I'm going to ask Congress to send me a bill to repeal disastrous  - "
25324,ameliebaldwin,"""It takes a woman to know trump isn't a woman"" what?"
25325,specialaffair,Trump warns wavering Republicans on Supreme Court
25326,dorothiebell,
25327,hyddrox,ChristiChat: ➡️This is the 12 y/o rape victim today She won't forgive HillaryClinton nor should we
25328,usa_gunslinger,"Julian Assange on TPP — ""fascist organization"""
25329,jeffreykahunas,Polls are the tools of media shepherds to reign in their wayward flocks of sheeple
25330,notritahart,If I were Michaels I would NOT ask him back to host again
25331,rh0lbr00k,"IBD) Hillary once called Qadaffy dangerous but  Bashar Assad a ""reformer""?"
25332,queenofthewo,Queens of the Stone Age of Empires
25333,malloryjared, The poorest most uneducated white person will tell you how dumb Obama is
25334,gab1aldana,
25335,kateritterrrr,House approves bill to ban Gitmo transfers for remainder of President Obama's term
25336,hollandpatrickk,"Boost Your T-Levels, Men"
25337,hyddrox,BREAKING OVERNIGHT: BIRTHER THEORY REBORN: BARACK OBAMA’S HALF BROTHER TWEETS OUT WHAT HE…  http…
25338,carriethornthon,"What's trending today What Trump said in 2006 about Condi Rice, what's not  tape where Dems admit they are riggin…"
25339,brianaregland,Had to switch trains because the Savannah-bound one lost power They let us connect on the train across the platform go…
25340,notritahart,Sausage Get-Together  
25341,queenofthewo,
25342,melvinsroberts,when you just feel like smashing some glass doors
25343,traceyhappymom,"""Jesus Christ, were you born in a barn? Close the door!"""
25344,paulinett,Olbermann slams Trump’s Muslim ban: A 10-year-old knows this is the ‘greatest possible gift to ISIS’
25345,lazykstafford,El 30% de los madrileños no puede irse una semana de vacaciones
25346,brianaregland,Smfh
25347,evewebster373,Queensryche - I Don't Believe In Love
25348,giselleevns,
25349,willisbonnerr,
25350,garrettsimpson_,The latest The Blue Chip Biz Daily!  Thanks to   
25351,melanymelanin,  
