Unnamed: 0,user_key,tweet_text_only
22515,emileewaren,The failed Obama presidency is what fuels Trump and sinks Clinton   by 
22516,lazykstafford,Good discussion with President  and automotive leaders about creating new auto jobs in the US 🇺🇸
22517,leroylovesusa,Obama SICKENING Plan4California Shooter’s Neighborhood… Muslims Shout For Joy -  via 
22518,laurabaeley,Paleontologists Determine Dinosaurs Were Killed By Someone They Trusted
22519,hiimkhloe,It's best to go through Hell now with  Then to be sent to Hell without Him
22520,kathiemrr,The magic mushroom school bus
22521,melanymelanin,Wake-up call for ODPM  
22522,_nickluna_,
22523,evewebster373,"Behind her smile, is a story you would never understand"
22524,patriotblake,"My cousin served on the front line in VietNam, I've met many VietNam Vets they are the salt of the earth"
22525,screamymonkey,"Challenging pillar of US democracy, Trump says he may not accept election result"
22526,heyits_toby,O'Reilly vs Trump BIll Presses Donald On Skipping GOP Debate (Full Interview)  via 
22527,notritahart,Spider Vein Man  
22528,laurabaeley,Teen arrested for planning alleged ISIS-inspired attack on pope
22529,leroylovesusa,Ha! If this is true I love it
22530,melvinsroberts,don’t leave me alone together with pies
22531,michellearry,should wise up and understand  is not their enemy but Key  partner; the enemy is Obama
22532,traceyhappymom,to borrow my stuff Ever! 🐤🐔🍕🗽🐒🎸👏💁
22533,margarethkurz,würdigte  Horthy
22534,mr_clampin,Eating pizza with a knife and fork
22535,traceyhappymom,I like big halibuts I cannot lie
22536,evagreen69,Trump 2k16
22537,giselleevns,I had the money Cabinet full of Moms &amp; we'd keep this Country clean! 🇺🇸❤️🎉
22538,ameliebaldwin,"Amen With God we have a path to success Joshua 1:8,9"
22539,puredavie,Please Don't Trust Me
22540,paulinett,"▶  Trump in high spirits, touts stock market high and job increase"
22541,westernwindwes,
22542,ameliebaldwin,BRING BACK THE PATRIARCHY?
22543,hyddrox,"84 Lumber Super Bowl ad jumps into immigration debate, showing border wall with a big door  via "
22544,evewebster373,Was pretty sad honestlydid you see the 30 for 30?
22545,_billy_moyer_,Jeb Bush releases 33 years of tax returns; most recent income was $74 million:
22546,ameliebaldwin,       Kkkkk pô só ele que en…
22547,patriotblake,The same FDA which allows public/private collaboration on meds like Lariam which was tested on  prisoners? 
22548,notritahart,"Despite its history helping Nazis computerize the Holocaust, IBM did not say whether it would help register Muslims http…"
22549,leroylovesusa,Russian diplomat 'found dead from gunshot wounds hours after ambassador's death'
22550,mrclydepratt,Missouri Police Charge Four Strippers With Murder
22551,j0hnlarsen,WATCH: Moore Loves Trump Because It Takes a Liberal to Know One [NSFW]  via 
22552,thefoundingson,How Islam contributes to European civilization
22553,ogdeandre,"Amazing indeed Trump ""jokes with media in private that he knows how the pool camera works"" but still whips up his…"
22554,cynthiamhunter,"Colin Powell Blasted Trump’s Chief Military Adviser As “Right-Wing Nutty” And “A Jerk""  via "
22555,malloryjared,Celebrations! 🎂 (W/ LEO THE GIANT
22556,melanymelanin,We must stop  let’s repeat   and
22557,dickyirwin,It took her 33 minutes to turn him into a frothing street corner lunatic Imagine what Putin will do to him
22558,bgarner2107,best procrastinator
22559,patriotblake,"Join Us On Jan 5th, As We Encircle The Whole Wells Fargo Center &amp; Get The  Message Across Loud &amp; Clear!!!"
22560,prettylaraplace,WOW!!
22561,ameliebaldwin,BREAKING: GOP Lawmaker ROCKS Washington With Bombshell Plan to Ditch United Nations
22562,_nickluna_,already exists it's called the BET Awards
22563,ten_gop,Giuliani: 'Hillary Clinton owes the American people an apology'
22564,maksblaginin,‘I never said I was perfect’: Trump after backlash over groping &amp; married sex comments (VIDEO)…
22565,traceyhappymom,"Just spoke to Putin Fantastic, great guy Knows a great deal when he sees it Sold him the White House!"
22566,ameliebaldwin,And The South
22567,micparrish,Tina Fey and  made out for feminism:
22568,usa_gunslinger,These are not isolated cases We've been seeing her condition worsening since the very beginning
22569,laurabaeley,LIVE: Do you think that  is winning the  tonight? Answer here!
22570,paulinett,People Are Asking Google Why Nothing Gets Done About     http…
22571,michellearry, Soros BrownShirts?        
22572,ameliebaldwin,"Hey  when Jay Z is performing for you, ask him if he really thinks women are ""bitches"" &amp; Cops are ""mother…"
22573,hollandpatrickk,Today our 33rd president was born
22574,leroylovesusa,Man Who Lived With Trump 50 Years Ago Drops Bombshell TRUTH
22575,thefoundingson,2017 in one picture
22576,ameliebaldwin,🙂✝️♥️
22577,_nickluna_,Don't know what to expect
22578,leroylovesusa,Time to play Patriots vs Blue Helmets? UN Troops not welcome RETWEET      of Republic B…
22579,nojonathonno,Official: Mayor of W Va town resigns in fallout from racist Facebook post about first lady Michelle Obama
22580,jeffreykahunas,We have some disappointed ladies this year 🔥
22581,newarkvoice,"Obama praises Clinton, blasts Trump: 'The choice isn't even close'"
22582,johnbranchh,Defends Rapper  — and Slams
22583,dorothiebell,"Propagandist Rachel  lied that ""George HW Bush signed NAFTA"""
22584,pamela_moore13,"Watch: Detroit residents speak out against the failed policies of Obama, Hillary &amp; democrats…"
22585,giselleevns,"Hey guys,  read the instructions"
22586,evagreen69,RETWEET
22587,garrettsimpson_,Get Smarter in 2017 Here are 5 Places to Educate Yourself Online (for Free)  //
22588,datwisenigga,Have You Checked Out This Website?  Your  Online Fast!
22589,queenofthewo,"Lost Bowie, kept Kardashians 😡"
22590,ten_gop,"Bill Clinton is a is a serial rapist 
He belongs to prison!"
22591,melvinsroberts,Progressive Pantsuit Parade     
22592,jasper_fly, Who's the lucky lady? ;
22593,watchmewalkin,  The normal human instinct is to adapt to reality It will take constant vigilance to avo…
22594,hollandpatrickk,Fukushima Five Years Later: VICE News Tonight on HBO (Full Segment
22595,michellearry,"As of today, Beijing – a city with 42 million smokers – bans smoking in public:"
22596,datwisenigga,So pretty much this segment about celebs suckin Tom Brady dick
22597,_billy_moyer_, Good news!
22598,_nickluna_,"Judge Napolitano is floored by Trump’s executive order: It’s a first-ever, ‘TRULY revolutionary’"
22599,ameliebaldwin,💤  💤
22600,hyddrox,Is Obama’s  giveaway a criminal conspiracy?
22601,thefoundingson,Refugees Welcome vol2:
22602,tpartynews,
22603,ten_gop,Crooked Media can't stop common sense! More life long Dems refuse to support Hillary Clinton!
22604,carriethornthon,Cuban dissidents celebrate election of 
22605,evagreen69, 🇺🇸🇺🇸🇺🇸
22606,paolakinck,I HAVE IT ALL PHOTO AFTER PHOTO
22607,mr_clampin,Stay on top of your game
22608,giselleevns,I still have 2 months left to find that unicorn I want for Christmas
22609,melvinsroberts,All that shit you do for attention is the reason you don't have mine
22610,lazykstafford,Watch This Marco Rubio Speech
22611,_nickluna_,  The Soros voting machines need to be banned
22612,onlinecleveland,Health care: Where do Donald Trump and Hillary Clinton stand?
22613,jasper_fly,fucking 
22614,tpartynews, finally admits that Trump could win: he has never been closer to the presidency than he is now…
22615,dorothiebell,True too
22616,jeffreykahunas,Hopefully the containment occurs Jan 2017 Enlist in our patriot army at  Stand for America https:/…
22617,deusxyx,DNC Speech: Hillary Clinton Deletes Foreign Policy Disasters as Secretary of State
22618,queenofthewo,please help me get more retweets
22619,ameliebaldwin,"At least you’re now adjusting your goddamned lie and admitting she grabbed that ball In fact, she invented it"
22620,giselleevns,act like a grotesque glutton around food
22621,anthonywoodboy,Sharia Law:  Belongs NO WHERE on Earth! Sharia Violates The Basic Human Right of Free Choice Just Another Form of Tot…
22622,hiimkhloe,Just put up my Christmas nativity set
22623,jeffreykahunas,people are very scared
22624,dickyirwin,why   deleted those emails
22625,ryanmaxwell_1,Note to self
22626,jeannemccarthy0,
22627,_billy_moyer_,On  why  isn't inevitable Then poll shows  gaining on her in NH
22628,emileewaren,Will  fire  for participating in illegal campaign coordination?  
22629,willisbonnerr,Listen to your favorite music on your own Population9 profile page Sign up and upload for free at
22630,jacquelinisbest,At Least 1 of the Terrorists that attacked France was SYRIAN Refugee
22631,_nickluna_,"Only 2 percent of ESPN’s ""SportsCenter"" was spent on women's sports in 2014:"
22632,leroylovesusa,LIVE on  Hillary Workers Intimidate Voters in Philly
22633,willisbonnerr,There's nothing that makes Kanye look more like a regular person than his dealings with his in-laws
22634,_billy_moyer_,I added a video to a  playlist  New video --Another swimming pool beat down!
22635,rh0lbr00k,      
22636,melanymelanin,Nice to know that if I’m walking around with a hoodie on at night minding my own business
22637,loragreeen,"""Trump: I've Seen Women Orgasm When They Look at Me"""
22638,patriotblake,"If Islam is a ""religion of peace"" why do significant numbers of Muslims living in the west support suicide bombings? http…"
22639,cookncooks,These refugees are a Trojan horse
22640,tpartynews,"Here is Mexican who supports  
He came legally and he believes American dream!"
22641,hyddrox,"Damn right about that Wassup there, Paul Ryan? The American people not good enough for you?"
22642,kathiemrr,I don't like getting my time waisted
22643,jeannemccarthy0, No  for  areas!
22644,jacquelinisbest,"Come, let us bow down in worship, let us kneel before the Lord our Maker; for he is our God and we are the flock under h…"
22645,emileewaren,Melania and Barron Trump It's great! Barron to finish his school year w/friends It's great! Obamas stay in DC 4 daught…
22646,patriotblake,A Drexel University professor tweeted that he wants a “White Genocide”
22647,phoenixdailynew,"Trump urges Russia to hack Clinton's email: The GOP nominee's comments faced bipartisan disagreement, with Pa"
22648,mil0blake,"No matter how far apart we are, you will always be in my heart"
22649,jacquelinisbest,One of my favorites ❣️👍
22650,sternandreas404,Russisches Parlament hat einen Dachschaden: Beim Unwetter eben in Moskau hat’s einigen Abgeordneten auf den Kopf geregnet h…
22651,willisbonnerr,Now Playing: Edai - King Of DRILL (Chicken Head) -&gt;
22652,priceforpierce,🏃 you're never late to a party if you're in a party mood 💃
22653,leroylovesusa,"Overnight, 2 US soldiers gave their lives for freedom in Afghanistan We pray for them and their families Rest, warri…"
22654,garrettsimpson_,Ron Paul: Trump Needs To Resist Neocons And Shadow Government Elites
22655,patriotraphael,There will be a special area (safe place) at the inauguration to shield the intolerant babies from the peaceful transfer o…
22656,rh0lbr00k,LAME like
22657,patriotraphael,She's terrified people want to end Islamic terrorism
22658,ameliebaldwin,"Donald Trump preaches angry nationalism, while practicing Goldman Sachs capitalism  by yours truly"
22659,patriototus,"What is worse, leaving four citizens to die or lying to the whole nation about it? Guess both are unforgivable"
22660,cassieweltch,"  Monty Python, Kids in the Hall, Madtv, In Living Color, &amp; so forth&amp; many stand-up com…"
22661,hyddrox, &lt;YRGOING2JAIL!         https…
22662,queenofthewo,Foot (Fetish) Ball (Sack)  
22663,giselleevns,
22664,johnbranchh, Did Dat Ft  on
22665,ameliebaldwin,WikiLeaks: Do Emails Show Hillary Clinton Killed Vince Foster? -
22666,jacquelinisbest,Liberal MSM has a fit over  insistence on a clean election Al Gore refused to concede 2000 for weeks
22667,patriotraphael,"Police officers are humans, they sacrifice their lives for us"
22668,dailysandiego,Bill Clinton and Tim Kaine: Trump lacks empathy for Khans
22669,politweecs,"'We should just cancel the election', and just give him the nomination"
22670,hyddrox,Officials: electronics ban on flights not prompted by new threat  via 
22671,giselleevns,"if another girl is prettier than you, you make their life a living hell"
22672,hyddrox,"This  is FORMER PRESIDENT Bill Clinton's audience for his ""Rally"" today What  the hell did they book, a hallway in…"
22673,paulinett,Does anyone have the schedule of all the hearings today/tomorrow and where they can be watched/heard? Trying to fight…
22674,ten_gop,"I guess it was ' folks who did this to a church!
 is hate group! Must be banned!"
22675,judelambertusa,Trump is in this race as a plant to get Hillary elected    
22676,ten_gop,"Hillary on  'It’s pretty clear that it's time to move on'
Me: 'It's pretty clear that it's time to pay'"
22677,ameliebaldwin,Who was Obama's mentor that influenced his view of RACIST AMERICA?  Radio Show
22678,traceyhappymom,I have to go to work at the can crushing factory  It's soda pressing
22679,newspeakdaily,"Wary of Election Hacks, US Urges States to Get Security Help"
22680,willisbonnerr,   for the recent follow :) Have a Great Weekend! 🔸Want this🆓?
22681,paolakinck,When are patriots going to dispose of shit like killer c? After election Coup against Trump?
22682,westernwindwes,God on global warming
22683,lazykstafford,"Winner, winner Chicken Dinner !!!"
22684,jeannemccarthy0,"To all the Police officers, fire fighters, EMT'S, Soldiers, and service members out there! Thank you for your sacrifice"
22685,notritahart, tango
22686,_nickluna_,NewsOne Now Audio Podcast: Bishop EW Jackson Calls  Is Movement “Disgraceful”
22687,jeffreykahunas,How to Improve Your Facebook  Using Controlled Experiments
22688,specialaffair,"Obama, in China for G20 summit, expects 'candid' talks with Xi"
22689,brianaregland,If you don't follow me I can't control what tweets of mine you see Whatever gets RTd the most is what you'll see
22690,patriotraphael,"Buehrle, Encarnacion lead Blue Jays to 6-2 win over Royals"
22691,baobaeham,Beware that the detours in your life don't turn into destinations - Tim Fargo
22692,datwisenigga, I am so engaged in  news I am missing the local context
22693,laurabaeley,"Homicides Rise in Chicago, Baltimore, New York"
22694,puredavie,"They love me they really really love me!  No, Sally Field did not say that first Ps- approval ratings are liars!"
22695,baobaeham,NOT A HOBBY  FT RICE GOT RACK 
22696,baobaeham,Happy
22697,ameliebaldwin,THE WORLD IS BEING RUN BY LIARS!!
22698,blacktolive,They're wearing the same outfit: Rih is 'basically naked' while Hadid is 'next-level edgy'  https:/…
22699,melvinsroberts,"you'd know that when I say you don't look your age, I was thinking,did she just say she's 50? I was thinking…"
22700,ameliebaldwin,----&gt; Hey all you 😭butt hurt celebrities😭 you got one last chance---&gt;  👋Buh bye👋
22701,anthonywoodboy,A lack of proper toiletry begat a foul smell amongst the majority of the populace - as well as terrible dis…
22702,paulinett,Me Against the World
22703,_nickluna_,   he is brain dead a tomato has more brains!
22704,evagreen69,"I'm open, but naw, I don't lose focus"
22705,laurabaeley,MSM Fake News Claims Civilians Committing Mass Suicide In East Aleppo After Syrian Army Victory
22706,tpartynews, “The feminists are now working against the women of SwedenFeminists are the new extremists in Swede…
22707,traceyhappymom,well it ain't gonna suck itself
22708,anthonywoodboy," ehmm, wat?"
22709,cassieweltch,"Flawed, yet amazing!"
22710,_nickluna_,Trumpus-vanisho!
22711,kathiemrr,Man Utd Deplorable's
22712,puredavie,where thefack arewe
22713,emileewaren,Embarrassing for Hillary Clinton that the number of illegals voting exceeds her popular vote lead W/O illegals Trump wins…
22714,melvinsroberts,take  off every year!
22715,thefoundingson, for sure!
22716,pamela_moore13,"Jan Brewer on democrats: Every time you disagree with democrats, no matter which subject it is, YOU'RE A BIGOT OR R…"
22717,michellearry,Thank to all those officers who died protecting us from criminals
22718,kathiemrr,best female woman
22719,melanymelanin,Malawi: South Africa to Deport 30 Trafficked Children  
22720,hyddrox,EGO-MANIAC! Watch Obama Say It’s A ‘Personal Insult’ To His ‘Legacy’ If You Vote For Trump…
22721,datwisenigga,Thanks for coming on! RT    Crying laughing SO hard! They held it together way b…
22722,ten_gop,Hillary did very poor &amp; low energy The only thing she did right was not cough!
22723,puredavie,Those annoying-ass Sonic Guys
22724,hyddrox,The Feminist
22725,sanantotopnews,Dallas County election judge fired over racist Facebook post
22726,puredavie,and connect to nature
22727,missourinewsus,Where to buy jackets with large pockets to hide illegal donations from foreign dictators
22728,brianaregland,with 
22729,melvinsroberts,"- The Damned celebrates its 40th anniversary with a new album, tour"
22730,worldofhashtags,Which Eastern European country will Trump's next wife come from?
22731,gallowayeliana,LOL  found some1 on Trump's Hispanic Counciland it got awkward:  cc: 
22732,evewebster373,DrOctopussy
22733,garrettsimpson_,General James 'Mad Dog' Mattis Email About Being 'Too Busy To Read' Is A Must-Read  via 
22734,ameliebaldwin, 
22735,hiimkhloe,I've only been in love with a beer bottle and a mirror
22736,daileyjadon,did something hilarious but it's not what you think
22737,melvinsroberts,"You know that New York business buffoon with the massive ego who no one likes? Yeah, he's going to be president"
22738,lazykstafford,Do you think  is winning tonight's  Answer now!
22739,michellearry,Don't miss  op-ed in the  on making sure workers are paid fairly:
22740,specialaffair,Austria's interior minister says presidential election re-run postponed
22741,notritahart,Stockings All Over The World
22742,jeffreykahunas,"The greatest gift of life is friendship, and I have received it"
22743,hiimkhloe,The screenshot or the ok?
22744,emileewaren,newspaper apologizes for anti-Donald Trump bias
22745,hiimkhloe,Buggies
22746,willisbonnerr,Now Playing: Alski ( - I Go Hard -&gt;
22747,chrixmorgan,flat looks like after a hurricane
22748,ryanmaxwell_1, they have their noses out of joint
22749,willisbonnerr,Pay attention to how this gets discussed (and not discussed) It'll be instructive Take care Twitter
22750,lazykstafford,Changing the world starts with changing how you see the world
22751,ameliebaldwin,  Heeeeey   does mean everything for this election
22752,judelambertusa,"Obama Admin: We are shocked- shocked! to find that ""refugees"" are terrorists!"
22753,jeffreykahunas,MAD guy!!!
22754,ameliebaldwin,Retired Generals In Revolt: ‘Feckless’ Obama Handcuffs US Airpower In War Against ISIS -
22755,paulinett,"▶  ""No one is born hating another person because of the color of his skin"" Wise words from a "
22756,ameliebaldwin,"If you need a coat, take one If you want to help, leave one💜"
22757,ameliebaldwin, may end up being the most effective anti-Left president in modern US history
22758,emileewaren,There is insidious danger in the attitude that liberals must be allowed to voice their opinions while conservatism is o…
22759,emileewaren, Did  Have A Brain Aneurysm?
22760,politweecs,"DNC files scathing rebuttal, wants fraud lawsuit filed by Bernie backers thrown out"
22761,ryanmaxwell_1,what is wrong with me? Why do I always get in trouble??? 😣
22762,dorothiebell,"News post: ""Trump Slams “Illegal Leaks” In Wake Of Michael Flynn Resigning As National Security Adviser…"""
22763,errivvvvers,"""In my mind,  Trump is a mess"" There, I fixed it for you!"
22764,giselleevns,US Population Indifferent to Any and All National Issues Apart from All-Consuming Hatred of Hillary Clinton
22765,notritahart,Return to Spender
22766,jasper_fly,Kids are old enough to not need child support
22767,hyddrox,Hendry County Sheriff's Deputy was shot in an ambush attack!
22768,jeannemccarthy0,If what the police report says is true fuck prince shembo that's so fucked up
22769,cookncooks,Trump said yesterday no one cares about his tax returns  &amp; I have a bill requiring their release Retweet this…
22770,hollandpatrickk,Untrained Muslim Refugees Employed as Security Guards during Cologne New Year’s Eve…
22771,wadeharriot,⭐️🇺🇸⭐️✨⭐️ WE BELIEVE THERE IS A LANDSLIDE COMING!! ⭐️✨🇺🇸✨⭐️
22772,giselleevns,"Playing  hashtag games, obviously!"
22773,judelambertusa,Wisconsin recount ends with more embarrassment for Hillary
22774,mil0blake,"MT  Dear LORD, please bless"
22775,patriototus,Hillary confirmed her plans to shut down all US coal mines saying “Coal miners will have to find other work”
22776,jacquelinisbest,
22777,datwisenigga,"One song? Racists are dumb But even if I made a million songs, that don't make me an activist My work does"
22778,dorothiebell,À écouter attentivement
22779,chrixmorgan,what that thing is on top of Donald Trump's head
22780,datwisenigga,2007) OJ Mayo throws himself an alley off the backboard from behind the 3-point line &amp; then launches the ball into th…
22781,hyddrox,Yes! Hillary will never be president!
22782,jasper_fly,Dem coalition man  
22783,queenofthewo,Continued belief in our political system
22784,javonhidp,"Wa Po editorial: ""A President Trump could destroy the world economy"""
22785,evagreen69,"No one claims use of IDs suppresses lawful writing of a check, collecting welfare or boarding a plane"
22786,danageezus,All-female cast remakes
22787,samirgooden,"After failing to seduce Nancy O’Dell, Trump reportedly tried to have her fired"
22788,anthonywoodboy,The Children's Bookshelf by age from Amazon  
22789,garrettsimpson_,We must! Keep up the good fight Marie!
22790,jamie_mccarthy_,Work for American greatness! RETWEET Follow 
22791,kathiemrr,Bruce Jenner must love livin' with all those Kardashians
22792,mr_clampin,No more feminists
22793,judelambertusa,The deep state institutions that couldn’t care less who you vote for  via 
22794,patriotblake,"Hey,  blowing up buildings is a threat to peace, not building them You deserve your face"
22795,ryanmaxwell_1,"RT : MT : Thank you Congressman, , God Bless You  MezCPA: MT PrdBlckRpblican: Thank you Congress…"
22796,newspeakdaily,Trump ‘Cheering On’ Hacks as He Plays Into Putin’s Hands: Morell
22797,hiimkhloe, fuck!
22798,mil0blake,Giuliani pulls name from contention for Sec of State
22799,tpartynews,Buy a gun and protect the
22800,richmondvoice,Obama vows to work to tighten sanctions on North Korea
22801,paulinett,Since 1968 we've had 28 years of GOP Presidents &amp; 20 years of Dem Presidents
22802,brianaregland,When you're a cook who's becoming a sensation on social media and they record you seasoning a steak you just cooked ht…
22803,willisbonnerr,Top 5  Nightclubs in  - Buy your tickets here:
22804,hyddrox,"""Trump to Hitler""  this is all they haveit's getting old"
22805,giselleevns,"And then I realize, that I'm the only one of us who is not alone, while we're alone together"
22806,baobaeham,🌊🌺🌴
22807,jihadist2ndwife,"Ha ha! The prank of the year! Liberals always fall for ""I'm a peaceful Muslim"" act!"
22808,c__wells,None of this happens to me when I use axe 😭😭
22809,mrclydepratt,RT  TY!         
22810,willisbonnerr,Ebola: Using Infection as a Weapon of White Supremacy
22811,staywoke88,"100 Former DOJ Officials, Including Eric Holder, Blast Comey for Breach of Protocol"
22812,jasper_fly,
22813,patriotraphael,😂😂😂😂
22814,sternandreas404,"Die starke EU, die  starken Nachbarn garantieren uns reche Zukunft!"
22815,giselleevns,"- disable the internet for a day POOF people talk to each other face to face again ""Oh I didn't see…"
22816,malloryjared,I b in my own zone blunt in my mouth pistol tucked
22817,karenparker93,"As you watch GOPers sell their souls cheap, what evidence do you have that anyone will stand up to Trump's abuses? https:…"
22818,prettylaraplace,"That's because  has lied, cheated, scammed  &amp; stole her way 2 the top Sadly 4 her,  will knock her…"
22819,oaklandonline,"Clinton, Trump Report Largest Fundraising Month Yet"
22820,c__wells,Stop rascism against white people! I wouldn't cry if  so deal with it !
22821,queenofthewo,tell your infants and toddlers that plastic grocery bags are in fact really fun toys
22822,datwisenigga,The Ultimate List of Recommended Tools and Services
22823,daileyjadon,The Crying Game of Thrones
22824,c__wells,A sane person to an insane society must appear insane
22825,michellearry,
22826,heyits_toby,About time German Gangs Are Beating Up Immigrants  # via indiatimes
22827,willisbonnerr,"- Google 2011 article: Chrysler $17 BILLION Ohio investment Thanks, Obama, Kasich! https…"
22828,jeffreykahunas,being lonely sucks! 👎  👎  👎
22829,ten_gop,This man was standing in front of Trump Tower today
22830,phoenixdailynew,Pence: 'Captain Humayun Khan is an American hero': GOP vice presidential nominee Mike Pence tried Sunday to p
22831,datwisenigga,United Songhai Imperium Application Form
22832,patriotblake,     Yes he has! He's my President
22833,baobaeham,I guess this thread happened just so I could say I wish the media was a pole
22834,patriotblake,"Clinton Message: Be vigilant, not afraid"
