Unnamed: 0,user_key,tweet_text_only
27204,pamela_moore13,"Clint Eastwood: Trump is ""what Americans are looking for""🇺🇸🇺🇸🇺🇸"
27205,leroylovesusa,Brain Flushings: Trump tells terminally ill to hang in there and vote for him  via 
27206,hiimkhloe,"The more we are concerned for the well-being of others, the closer we will feel to each other"
27207,emileewaren,Remember when the mainstream media (fake news) claimed Trump was lying for saying Muslims in New Jersey celebrated 9/11?…
27208,jacquelinisbest,BOOOM!!! WIKILEAKS Just LEAKED 2008 OBAMA MEMO – PROVES TRUMP WAS RIGHT ALL ALONG! -
27209,leroylovesusa,Penalty!  cartoon
27210,michellearry,  Contact: Web► Donate►
27211,patriotblake,The Sergeant is the Army - Dwight Eisenhower
27212,datwisenigga,I PUT DOPE IN THESE HOOKS
27213,watchmewalkin,"I love these lectures that women molested by Trump should have spoken up earlier, from Republicans who lack the guts to stand…"
27214,westernwindwes,How tall are you? How long have you been on the gang unit?
27215,notritahart,might as well tag this  am I doing it right
27216,patriotblake,Melissa McCarthy Plays Sean Spicer Going Nuts on the Press in Hilarious  Sketch: 'APOLOGIZE TO ME!'
27217,jeanuttella,The 'Central Park Five' ad told us who Donald Trump really is:
27218,paulinett,"Asian man judge told me in court I ""obviously had too much time on my hands because I have time to keep…"
27219,alecmooooody,Old man shaking fist at cloud
27220,ryanmaxwell_1,"Kerry in Russia to Explore Putin's Flexibility on Ukraine, Syria"
27221,traceyhappymom,Beg for RT's
27222,thefoundingson,Since black racists kidnap and torture white people it's about time  we discuss black supremacists problem in the U…
27223,_nickluna_,Bombshell Atlantis Egypt Discovery! New Explosive Evidence! Dark Journalist and Dr Carmen Boulter (Video
27224,malloryjared,it`s better in USA!
27225,stanleyparris,This is not sending dick pics This is not the husband of an aide or of the candidate This is the guy on the ballo…
27226,mrclydepratt,PHOTO: Orange Leaves
27227,ryanmaxwell_1,"A Happy Meal for Joe, and a pretentious burger for Barry"
27228,brianaregland,"Surely, Trump presumes he can simply wait this out, refusing to show his tax returns and counting on Republicans for cover…"
27229,melanymelanin,"There appears to be a widespread effort to discredit the veracity of wikileaks content but pointing this out is, im sur…"
27230,ten_gop,"Trump: ""We reject the bigotry of Hillary Clinton who talks down to African Americans and sees them only as votes"""
27231,mrclydepratt,"Podcast: Senate Showdown Over Gorsuch SCOTUS Nomination, MLK's  Speech 50 Years Later"
27232,michellearry,Obama belives that talking is enough to solve any problem
27233,judelambertusa,Our economy is downhill and the only thing they can discuss during  is themselves
27234,datwisenigga,the sky is my favorite form of art
27235,kathiemrr,you must be there
27236,jeffreykahunas,Love is the only force capable of transforming an enemy into a friend  – Martin Luther King
27237,anthonywoodboy,"2016 GOP Power Index: Fiorina still rising, Paul survives |"
27238,jenn_abrams,Obama failed to mention the $400 mln payoff sent to  as 4 Americans detained in Tehran were releasedDemocrats're taking care of the US
27239,kansasdailynews,Khizr Khan: Trump has a 'black soul'
27240,_nickluna_,WHAT HILLARY’S BIGGEST WALL ST DONOR IS PLOTTING WILL DESTROY EVERY FAMILY IN AMERICA
27241,emileewaren,MT  Call to Me
27242,emileewaren, on China provocations: “They haven’t grasped this president is different than Obama… They will learn”
27243,hiimkhloe,I added a video to a  playlist  Arrested Development – People Everyday Live - Unplugged
27244,jeffreykahunas,Ex-DNC chair wants backup candidate in case Clinton's health forces her to drop out
27245,queenofthewo,lies
27246,evewebster373,Harvey man found mentally competent for trial in manslaughter case
27247,paulinett, super easy way to add all your reps contact numbers to your contacts instantly
27248,jeannemccarthy0,He gets that a lot RT   idk this kinda looks like the actor from The Good Guys but without th…
27249,judelambertusa,December unemployment rates:
27250,mil0blake,There's more to life than dating the boy on the football team  – Taylor Swift
27251,logan_whatsup,T-Mobile CEO John  relentlessly promotes his brand and answers our questions
27252,jery_robertsyo,Black Lives Matter Activist Brittany Packnett on Why She's Finally   via 
27253,malloryjared,Had 2 Sprinkle my Bro  wit some Sauce! I told my Girl I'm  
27254,evewebster373,true love lol
27255,daileyjadon,Breaking Bass  
27256,todaycincinnati,Debbie Wasserman Schultz Is Met With Jeers at Pre-Conventio  |
27257,hyddrox,THANK YOU 
27258,chadsloyer,"A Trump Cabinet might include like-minded CEOs, many of whom he's known for years  | AP"
27259,baobaeham,Yep This article pretty much sums it up right nice like
27260,lazykstafford,Now faith is being sure we will get what we hope for It is being sure of what we cannot see Hebrews 11:1
27261,hiimkhloe,"✨ Everything that we observe through eyes of love, is beautiful ✨"
27262,thefoundingson,Clinton aides who got immunity can also represent her in the very same case!
27263,mr_clampin,Remember: mashed potatoes are just filler Use what room you have for the important things
27264,dorothiebell,The Hate Group That Tracks Down 'Hate Groups'
27265,ryanmaxwell_1,English Teacher:  Literature must not be a 'safe space'
27266,javonhidp,"""I apologize if anyone was offended,"" says  who called the conversation ""locker room banter"""
27267,peterkistner,ist noch ganz junges Wesen und Merkel sieht viel mehr als wir
27268,giselleevns," No, we don't want people to know how to do that!"
27269,queenofthewo,
27270,patriotblake, 
27271,baobaeham,Still crying 😂😂😂😂
27272,heyits_toby,Those who don't know how to weep with their whole heart don't know how to laugh either – Golda Meir
27273,kathiemrr,cuddles for all
27274,ten_gop,"For all those who blame police for one cop's mistake! Become cops and TRY to do better, OK?!"
27275,tpartynews,Sister of Man Killed by Illegal Immigrant: 'Illegal is Illegal They Shouldn't Be Here in the First Place'
27276,judelambertusa,EURUSD &lt; 104
27277,mrclydepratt,"""With every ugly and violent insult that comes out of his mouth, Trump loses a vote, and our country gains a feminist” — "
27278,paulinett,This picture can not get more republican 😂😂😂😂👌🏽
27279,leroylovesusa,ACLU TO LOSE TAX EXMPT STATUS
27280,hyddrox,RT  @ waynezurl ’s From New York to the Smokies
27281,ameliebaldwin,"  Laura, I'm a life-long Republican &amp; very conservative voterDon't let these types get 2 UI'm…"
27282,ameliebaldwin,"Trump: Does Clinton find radical Muslims ""deplorable,"" or is that ""reserved only for hard-working Americans?"""
27283,garrettsimpson_,Hollywood hates you Get your entertainment from someone who doesn't
27284,paulinett,▶  Migration journeys of Caribbean elders showcased by Memories
27285,melanymelanin,FL: 30% of the disenfranchised are black! (15% of voting-age population is black
27286,kathiemrr,"- Not helping when you KNOW someone is in need and you have the time, energy and resources to…"
27287,ameliebaldwin,MT  President Obama attempt to stack  must be stopped!
27288,muslims_in_usa,MR  SORRY YOU CANNOT BAN
27289,kathiemrr,Big Truck in Little China  
27290,michellearry,"New post: ""Yelp To Out Businesses With No Gender-Neutral Bathrooms"""
27291,brianaregland,Happy Birthday  Here's a dope article on how she became a Hip Hop legend through radio!
27292,chrixmorgan,INVESTIGATION INTO OBAMA'S BIRTH CERTIFICATE REVEALS HE'S AN ANCIENT ALIEN
27293,notritahart,More money than 2016
27294,robbydelaware,"Not exactly ""bombing the shit outta em"" - Trump's main Russia advisor calls ISIS ""perceived threat"""
27295,ameliebaldwin,Don't miss the audio and transcript of my interview with  about  and   http…
27296,willisbonnerr,"that two people can disagree, not have the same thought process but still love eachother and still work as a unit http…"
27297,kateritterrrr," says ""bomb"" went off in  before NYC officials determined cause of explosion:"
27298,melanymelanin,Wiggers set the law of the jungle
27299,paolakinck,"""The Real Trump"" Trump About You"" Watch Make"
27300,brianaregland,742 times
27301,malloryjared,I told her Keep going on the gas
27302,jacquelinisbest,No they and other so called Reps have been bought and paid for by DemORATS just as Killery has by the Mussies who murde…
27303,kathiemrr,"Janet Reno, US attorney general under President Bill Clinton, died after battle with Parkinson's, her sister says"
27304,dorothiebell,   FREE INTERACTIVE TUTORIALS 4 JOURNALISTS ACTIVISTS RESEARCHERS 2 UNLOCK GOV DATA
27305,daileyjadon,Inglorious Baaaaaa-stards
27306,mr_clampin,go drop a massive deuce
27307,patriotraphael, 
27308,jasper_fly,Dharma
27309,mrclydepratt,Press ya luck  Brooklyn on you
27310,ten_gop,'Some guy hiding in the Ecuadorian embassy is doing more for the truth in election than all of the American press'…
27311,_nickluna_,is putting Americans to work More than we can say for the current President  🐧🐧
27312,evewebster373,You know you're in  when you can't fall asleep because  is finally better than your dreams― Dr Seuss
27313,michellearry,"New post: ""Ask Tillerson about ExxonMobil's Africa deals, watchdog says"""
27314,brianaregland,"Wait, now you're against leaks?"
27315,ramonasnails,5 Obama Successes Republicans Have To Pretend Never Happened:
27316,logan_whatsup,The roadsigns lead you to a right way
27317,patriotraphael,Kamal Azmy   The Islamic Dilemma   08   The Dilemma of Sharia Law   Ep1
27318,patriotblake,Analysis: McCain tries to blame the media for Trump’s PTSD mistake
27319,phoenixdailynew,Hillary Clinton to campaign in Arizona next week
27320,j0hnlarsen,"These are not protests, they are riots Why are Mayors and Police Chiefs allowing this crap?     http…"
27321,puredavie,Don't wait until you're on your deathbed to tell people how you really feel because you could be too weak to raise your mid…
27322,kansasdailynews,Meet “Baby Trump”!
27323,angelabach991,Brötchen zeigen in der Öffentlichkeit?  &amp;  machen das sogar LIVE im Fernsehen 😜
27324,chicagodailynew,"Pentagon, intelligence chiefs urge Obama to remove NSA director"
27325,michellearry,    Caucuses ARE CORRUPT! Should be outlawed in ALL states!
27326,c__wells,New: How SOUTH PARK showed it takes an outrageous satire to capture an era of outrage
27327,mil0blake,Redistribution of the coin toss
27328,willisbonnerr,Thank You God for Blessing Me with Another Day of Life!!!!!
27329,cookncooks,Well it's good to see the Canberra Times is catching up &amp; is only 2 years behind what we already knew
27330,hyddrox,Tim Kaine Had Nothing Good To Say About Hillary In 2005 Debate
27331,c__wells,   between 5th and 6th stops?
27332,pamela_moore13,Bill Clinton defines a blow job as not having sexual relations Can't find a single women that would agree
27333,kenzdonovan,Trump kicks ass
27334,oaklandonline,"Golden State Warriors coach, a Hillary Clinton supporter, addresses Democratic convention"
27335,brianaregland,Exactly
27336,washingtonline,WikiLeaks Offers Reward in Murder of DNC Staffer
27337,mrclydepratt,"Drake &amp; his dad play off ""Most Interesting Man in the World"" for new whiskey ad"
27338,leroylovesusa,EVERY single MSM outlet described Kalamazoo shooter as white in headlines/tweets Not ONE describe Kansas shooter as b…
27339,paulinett,"I'm not a Democrat, but I know these two statements are entirely compatible, for reasons that shouldn't be too hard to comp…"
27340,notritahart, thanks for the recent follow Much appreciated :) (Want this 🆓? &gt;&gt;
27341,patriotraphael,"Trump criticizes China, Russia policies - immigration, too"
27342,ten_gop,"""We should be very grateful that the Age of Obama is finally over"" - "
27343,willisbonnerr,How to use data to get your marketing on the path to success
27344,mrclydepratt,U NEED A HIT ?? GET ONE NOW
27345,johnbranchh,Cowboys’ Greg Hardy Suspended for 10 Games
27346,_nickluna_," you have probably lost your election, one day smart two days stupid, not smart😳"
27347,jenn_abrams,Donald Trump's web-site now looks like that
27348,newspeakdaily,"Trump Says He’s Not a Perfect Person, Regrets Words in Video"
27349,trayneshacole,A grandmother in Detroit replaces traditional Halloween decorations with real-life horrors to decry US violence…
27350,mr_clampin,karaoke
27351,thefoundingson,"Jeff Sessions: ""Start packing your bags, illegals!"""
27352,ten_gop,"WATCH: chaos on the streets of London, Muslims rioting against the police!
We will have the same under Hillary!"
27353,johnbranchh,"KKK Grand Dragon Endorses Hillary Clinton, Says She Has “Hidden Agenda”"
27354,johnbranchh,"See Amy Poehler,  and more in these backstage  polaroids:"
27355,melanymelanin,
27356,priceforpierce,Echoes of NAZI Germany
27357,patriotraphael,"News post: ""WHEN REASON DISAPPEARS, ALL THAT’S LEFT IS: Witchcraft …"""
27358,hyddrox,"Hah-Hah! HARRY REID Loses It After Trump Presser: He’s a Liar, Phony, Unbelievably Immoral"
27359,gloed_up,Donald Trump is the embodiment of every racist in this country That's why he gets so much support This country is neck deep…
27360,danageezus,"Marry Donald Trump and become the First Lady, Barack Obama Trump"
27361,hollandpatrickk,A pretty face has no value if there's no goodness in the heart
27362,hyddrox,as a GAY MALE I have watched the silence from OBAMA and HILLARY as GAY MALES are thrown off a roof or ignited on fire  I AM…
27363,melanymelanin,"Big thank you to amazing writer, and creative,  for backing  You're dope!"
27364,puredavie,
27365,paulinett,▶ South Africa Retain Sevens World Series Lead Despite Hong Kong Final Loss
27366,kansasdailynews,Trump's lawyer asks 'says who' when told Trump is losing
27367,thefoundingson,//tco/nwguMPYdLk
27368,randolphburrr,"Donald Trump is wrong on crime and immigration, President Obama says in rebuttal"
27369,laurabaeley,"HILARIOUS: YUGE ratings for Rachel Maddow’s Trump tax flop, millions saw her step in it"
27370,hiimkhloe,Maracaná se postra ante Ronaldinho
27371,puredavie,Ten things I hate about jews
27372,mrclydepratt,Landlord said we can get pets 😍 finna get me a cane Corso 💪🏾🐶
27373,notritahart,i could make Fridays part of the weekend but everyone still gets paid for it! 4 day work week ever…
27374,mrclydepratt,v cool
27375,wadeharriot,Hillary Clinton Campaign Manager Admits 2008 Birther Link
27376,notritahart,avoid whiners
27377,garrettsimpson_,She knows us all towell it seems
27378,giselleevns,"Because if I ""Con""test, it's a whole different issue"
27379,paulinett,"▶ Iamsu! ""Shang Hai"" Video - Check out Iamsu!'s new video for ""Shang Hai"""
27380,lazykstafford,"A militia, when properly formed, are in fact the people themselves"
27381,rightnpr,Trump supporters risk their life climbing Trump Tower to see him
27382,ameliebaldwin,What You Need to Know If It's Your First Time Protesting  via 
27383,cookncooks,Hillary: You Need A ‘Public’ And ‘Private’ Position On Every Issue
27384,lazykstafford, What a sad little attempt to troll me You'll  have to better than that  Not off 2 a stellar start  
27385,ameliebaldwin,Freacking Communist   ‼️‼️DISGRACE
27386,_nickluna_,Guess who just voted bitches!!!
27387,ten_gop,'With the world on fire I'll vote for Trump to save the country over playing gender politics'~ Sheriff David Clarke
27388,hollandpatrickk,Trump terminates Obama’s global warming website seconds after taking office
27389,johnbranchh,Ches Crosbie among many would-be candidates with controversial nomination bids
27390,emileewaren,Gift of LOVE: defending one's children
27391,alecmooooody,"Thanks, "
27392,michellearry,Pls Retweet if   needs  as new face of American children's TV
27393,cassieweltch,PikaChumbawamba
27394,margarethkurz,legt im Internet neue Reality-Show auf
27395,c__wells,Dole VA medical center wants partners to help house homeless vets
27396,patriotraphael," it's war, people die at war 😔"
27397,johnbranchh,Love is the why as   demonstrates with his actions &amp; his call to fight for the people We will Win But it will…
27398,thefoundingson,So glad Obama is gone
27399,johnbranchh,"I'm like, ""Billy what you bout to-"""
27400,jeffreykahunas,"Must read from  :  on energy policy, Charlotte's riots, and reaching out to black voters: https:…"
27401,happkendrahappy, Former   Defends  From Media 'Smear Campaign'
27402,willisbonnerr,Speaking Engagement - First Unitarian Church
27403,carriethornthon,Only a ding-dong globalist opposes 
27404,patriotblake,"Politico founder: Reporters ‘so biased, so partisan’ against Trump"
27405,jasper_fly,Hashtag Roundup-Saturday
27406,lazykstafford, I feel even older cause I remember seeing this pic like 3 years ago sheeeed
27407,kathiemrr,moral compass
27408,kathiemrr,with Death? Chess
27409,cookncooks,Right!😉
27410,daileyjadon,✌🏽️🍭
27411,leroylovesusa,My mistake Clips from 2009  He's still a POS no matter when it was
27412,marianeuberg1,"Merkel ist es gelungen, eine stabile Regierung zu schaffen!"
27413,hiimkhloe,
27414,wadeharriot,Wouldn't it be great if Trump were held to the same standard as Barack Obama
27415,jacquelinisbest,Help Expose the Enemies in Your Congress!
27416,kansasdailynews,DNC Day 2: Bill Clinton hopes to shift convention’s tone
27417,malloryjared,"""I done what I could, to come up wit' this paper / 'til this day still  run wit' the hood/ I guess it's part of my…"
27418,thefoundingson,But when it's about Clintons it is
27419,ogdeandre,"If you care about women, children, equality, tolerance, basic decency, American values and/or the planet, please vo…"
27420,garrettsimpson_,  Thank you for telling my story!  at one of her High School GatheringsI will never be the sam…
27421,_billy_moyer_,"I'm not afraid to try again, I'm just afraid of getting hurt for the same reason"
27422,detroitdailynew,Trump cites own sacrifices to Muslim war hero dad
27423,ameliebaldwin,DC police being forced to turn off body cams for  so protesters can act like savages
27424,ten_gop,"Update🚨
-4 killed in shooting at Cascade Mall in 
-Location of shooter unknown
-Shooter description: His…"
27425,hyddrox,You are seriously lame He was asking how safe she would feel without armed security It was NOT a threat
27426,westernwindwes,Why is  manufacturing another crisis? Perhaps  declined coz of proximity to elections?
27427,traceyhappymom,        
27428,jeannemccarthy0,Fate of ObamaCare co-ops uncertain after half collapse via the  App‼️
27429,thefoundingson,Mocking is the best way to fight stupidity This Michigan student changed his preferred pronoun to 'His Majesty' 😂…
27430,brianaregland,"BREAKING: Car of missing Greek ambassador found underneath overpass in Rio de Janeiro, charred body found inside"
27431,melvinsroberts,
27432,giselleevns,Get enough alcohol in me to face the family I drunkenly insulted at dinner last night
27433,malloryjared,"Most popular story this week: WikiLeaks' Julian Assange: Attacks Against Jill Stein Will Go ""Through the Roof"""
27434,manuelkrosss,Die Helden von Barmbek: Er stellte sich Killer Ahmad A in den Weg
27435,jasper_fly,Ally McEel  
27436,patriotblake,Woman fighting for her life after being set on FIRE by an African on the street in Germany
27437,heyits_toby,"World Naked Bike Ride Day pics: Butts, butts and more butts"
27438,judelambertusa,Hey  Where are you getting the  for SNAP fraud? Not from the USDA!
27439,melanymelanin,▶ ObamaCare architect Jonathan Gruber sounds off on CEO job loss claims  
27440,cookncooks,I see now on Twitter they tweet  for they are the childish ones that will allow Socialism in America for their spo…
27441,traceyhappymom,Humour failure alert
27442,heyits_toby,Study as if you were going to live forever
27443,crystal1johnson,"Sickening
Police in Greensboro, NC brutalized black guy who was simply waiting for his mom on her porch"
27444,c__wells,Clearing Out GITMO! RT
27445,priceforpierce,Small faith limits God’s activity in a believer’s life He uses us only to the degree that we trust Him
27446,evagreen69,NO!!!
27447,paulinett,I need a primer on the Donald Trump Jr email situation I feel like I missed all the news about this presidency this week
27448,emileewaren,Want to know how European Union refugee policies and the visa waiver program endanger the United States? Read this: ht…
27449,evagreen69,"""Anything goes"" when you don't have, or have given up, moral principles"
27450,daileyjadon,📡
27451,jenn_abrams,  Is this your fight song?
27452,specialaffair,"Rocky politics, slow growth loom as Obama, Italy's Renzi meet"
27453,dorothiebell,'bans the burka over fears it's used to help carry out crimes'
27454,mr_clampin,the pharmaceutical companies are getting rich
27455,jeannemccarthy0,  sweet honey bear
27456,jeannemccarthy0,YOU FOOLS!! 🙄
27457,donnabrivera,We must ensure that Hillary is not elected
27458,marianeuberg1,sieht viele interessante und außergewöhnliche Orte
27459,heyits_toby,"Amidst Massive Protests, Army Corps Blocks Dakota Pipeline"
27460,newarkvoice,How could the NJ GOP allow a troll to run for office? | Editorial
27461,jeffreykahunas,"The same media that gave Hillary 98% chance of winning &amp; hoax rape stories is lecturing us about ""fake news"""
27462,hyddrox,"Don't you worry, if Hillary Clinton is elected there will be many more attacks to come Scary"
27463,melvinsroberts, You're still good news!
27464,chrixmorgan,"For people not to call it the Obama ""Liberry"""
27465,iiddaamarks,"Trump back on stage: ""no one ever said it would be easy for us"""
27466,giselleevns,Facebook
27467,verrellportier,
27468,daileyjadon,"For each candidate, do you prefer to wear front or back clasping bras?"
27469,stlouisonline,"Clinton accepts nomination with 'humility, determination and boundless confidence in America'"
27470,cassieweltch,Don't wait until you're on your deathbed to tell people how you really feel because you could be too weak to raise your mid…
27471,jasper_fly,Buy Hard: With a Visa  
27472,thefoundingson,"I've seen it, it's about this big
Anthony Weiner send me a pic"
27473,c__wells,"Truth, Liberty &amp; Free Market we pull off rare ""Conservative Trifecta""  1130aE "
27474,lavrovmuesli,"Доктор, удалявший тромб Хиллари Клинтон и, очевидно, знавший всё о её здоровье, найден мёртвым
Ну наверное простое…"
27475,giselleevns,
27476,thefoundingson,It's time! Stop Soros!
27477,onlinecleveland,"Federal judge orders Ohio Republicans, Trump's campaign to respond to voter-intimidation lawsuit"
27478,puredavie,I got you Under my skin
27479,patriotblake,"Blocked me when I sed hes whiter than me, which heretofore thot 2b inpossible!   "
27480,daileyjadon,
27481,mrclydepratt,Going straight in track 1 by Finese 2Tymes on
27482,leroylovesusa,Keith Ellison took 50k in donations from Radical Islam Big supporter of Hamas  | 
27483,hyddrox,"BILL CLINTON'S repeal of Glass-Steagall was the catalyst that cause Housing Crisis of 2008  BLAME THE RECKLESS, FE…"
27484,laurabaeley,"""Westworld, Memory &amp; the Simulation Hypothesis"
27485,johnbranchh,They do it over and over again 😤
27486,notritahart,"What's next for  yelling at some SF ""Hippies"" to ""Get a haircut!"" BTW Aubrey is a girls name"
27487,onemightyfish,Wow  there's not a single wealthy family it seems that did not profit from the Slavery of our ances…
27488,giselleevns, I can't believe people can actually wear this!
27489,batonrougevoice,"Trump would turn away Syrian refugees in US, Pence says"
27490,thefoundingson,"Instead of fighting imaginary racism and oppression can you unite and ""Resist"" Islamic radicalism which is a real threa…"
27491,laurabaeley,Sanctuary City Mayors Condemning Trump Should be Arrested American Thinker
27492,patriotblake,Michelle Obama Very Upset With Trump’s Words But OK With Obama Flashing a Boner to Reporters?  v…
27493,puredavie,irritating people around me
27494,patriotblake,"Journalist  on GOP healthcare bill: ""One of the biggest winners of this plan is the health insurance industry"""
27495,_nickluna_,"""Tell [the press] a big, elaborate lie"""
27496,dailysanfran,The Latest: Kaine says Trump can't change immigration stance
27497,tpartynews,Amazing to see true patriots who haven't fallen for toxic rhetoric of  (Via 
27498,missourinewsus,"whose campaign is Built on a lie
Funded by the oligarchy and
Dependent on media manipulation"
27499,giselleevns,cry over tv shows
27500,brianaregland,😭😂😭😂
27501,leroylovesusa,The reason why Barack Obama turned his back to America is because he is more comfortable when facing Mecca
27502,nataturn,Why men should support International Women’s Day in 2017 (by men in 2017
27503,emileewaren,I am calling for all Trump supporters to express their outrage and anger against DeNiro and all of the Republican turncoats…
27504,ameliebaldwin,BOMBSHELL: Secret Service Endorses Donald Trump!
27505,kathiemrr,"A set of Bernie Sanders branded ""Fair Share""® measuring cups"
27506,ameliebaldwin,Didn't John McCain tell a joke about a girl being RAPED by a gorilla?
27507,hyddrox,"Propagandist Rachel  lied that ""George HW Bush signed NAFTA"""
27508,giselleevns,I don’t want to be “slutty Trump”
27509,mr_clampin,anything from your secret Santa at work
