Unnamed: 0,user_key,tweet_text_only
12516,paolakinck,It's amazing how   can lie with a straight face on everything time and time again! https…
12517,michellearry,All 4 of my Grandparents born USA All 4 rolling over in their graves w/ potential of
12518,heyits_toby,"Allen West Just Wiped the Floor With Race Pimp, Rep John Lewis… This Is Brutal!"
12519,datwisenigga,Nah bro Everybody gotta do what the can to get in the game G It's only fair It's all good One day somebody will be leading…
12520,samirgooden,The Kids Are Alright: A Legendary Feminist on  Future via 
12521,rh0lbr00k,PANIC in Hillaryville: Offers Cash for Trash on Trump
12522,daileyjadon,Wiz khalFIFA
12523,daileyjadon,I love Twitter but hate the trolls
12524,giselleevns,give your toddler whiskey
12525,baobaeham, - Heaven Hell ft YungMurda :: Tune In:
12526,_nickluna_,How To Stave Off The Winter Blues
12527,jeannemccarthy0,"MT  To save America, we must turn to God through His Son, Jesus Christ"
12528,hiimkhloe,Yes Women of all races w curly hair often straighten it to achieve a white westernized standard of beauty
12529,tpartynews, Christians Are Being 'Marginalized &amp; Attacked' in the US &amp; Around the World
12530,lazykstafford, I was once ignorant bc I listened to you
12531,mrclydepratt,Vox: House GOP appears to include a provision exempting Members of Congress from their own health care plan
12532,tpartynews,Donald Trump on Hillary: “The job of an elected official is to serve the citizens of the US”
12533,ryanmaxwell_1,"I might be okay, but I'm not fine at all"
12534,leroylovesusa,Rigging the Election - Video I: Clinton Campaign and DNC Incite Violence at Trump Rallies I am not for either https:…
12535,fishalexanderr," Sehr geehrter Herr Tauber, würden Sie  noch ein Mal wählen?"
12536,ameliebaldwin,Hey   Did YOU Know Hillary's Campaign Paid People To Incite Violence Against Trump Supporters❓…
12537,brianaregland,Huh
12538,laurabaeley,AN INTERNATIONAL SIEGE ON VENEZUELA COULD BE THE BEGINNING OF THE END FOR MADURO’S REGIME
12539,melvinsroberts,Remember you love your family and remember you love your family
12540,queennarielle,Rejection of Trump has made Republican gov of Md even more popular New with  and…
12541,patriotblake,
12542,_billy_moyer_,"Vamos pôr em prática a Desobediência Civil, pessoal"
12543,daileyjadon,50 shades broker
12544,errivvvvers, Not a Hill-Bot but I be damn if I believe some BS from Assange's Trump loving ass accusing PBO of treason Not…
12545,staywoke88,But economic anxiety tho
12546,thefoundingson, They should be grounded to In a custody
12547,judelambertusa,"Full conversation with South Bend, IN  mayor and DNC chair candidate "
12548,ten_gop,//tco/Hb4scg1JzQ
12549,onlinecleveland,The curious case of Gov John Kasich's RNC nonrole - and vp offer? Editorial Board Roundtable: With Donald Trump
12550,hyddrox,
12551,hyddrox,Haitian Exposes Clinton Foundation As A Criminal Enterprise That Exploits Haiti
12552,laurabaeley,"FAKE NEWS: CNN Reports Tom Price Bought Health Care Stock, Then Enriched Himself Nope"
12553,paulinett,"JOIN HIM: Cavaliers Point Guard “I Am With You All,” In Support Of Standing Rock Sioux Protesters  "
12554,puredavie,just found the video
12555,mrclydepratt,"Islamophobia is private bigotry, but also state-sponsored strategy &amp; policy"
12556,mrclydepratt,God bless
12557,cookncooks,The Associated Press announces its war on its competition
12558,mr_clampin,Next up at 5A PST | 8A EST | 1P GMT  hosted by  
12559,valeyina_dm,says Ecuador cut off  internet after new  emails published
12560,ten_gop, We can't wait to see you in the WH
12561,patriotblake,IMPORTANT Register to vote at  to
12562,missourinewsus,"The Faces of Arrogance Come on America, is This What You Really Want?"
12563,westernwindwes,You know that  Thanks God we still have real men in politics We really need them right now
12564,anthonywoodboy,"Why does  allow Porn Mags/Movies 2 Be Shown 2 Violent Sex Offenders &amp; Killers in Max Security Prisons? Is This ""Cor…"
12565,ameliebaldwin,Minnesota: Muslim tells judge “I am a terrorist” as 3 more Muslims sentenced  via 
12566,johnbranchh,"Computers can't truly think or feel yet, but mine Stops out of Grief 💔 I believe"
12567,giselleevns,take the last piece of cake
12568,laurabaeley,Today he announced the end of the WWII
12569,kenzdonovan,Ha! Ha!  reaction to throwing gays off buildings!
12570,lapinolegg,"Madeleine Albright, latest pro-Clinton Neocon hawking anti-Russia conspiracy theories (Op-Edge"
12571,hyddrox,WHINER-in-CHIEF OBAMA!
12572,hiimkhloe,"This is all too much: these poor babies, these devastated families"
12573,leroylovesusa,I request all Indians to go out and vote tomorrow
12574,klara_sauber,kann sich immer für Deutschland opfern
12575,priceforpierce,Top 10 Sacha Baron Cohen Moments
12576,hyddrox,
12577,jacquelinisbest,What if Clinton supporters are so desperate they create a false flag bombing of  to blame on Trump
12578,ameliebaldwin,Hey  and  Still rooting for  Because these 'people' do
12579,jeffreykahunas,Had entire  planned Sat that didn't happen due to Iran news Planned show for today Let's see what happens at 10…
12580,dailysanfran,Clinton: Trump health allegations a 'wacky strategy'
12581,judelambertusa,OMG  there’s no info about this in  WTF?!
12582,notritahart,new beer flavors in your favorite shop 🍻
12583,jeffreykahunas,"Bill Clinton says ""on more than one occasion"" over the years ""the same sort of thing’s happened to her when she got severely de…"
12584,lazykstafford,Exactly Where Subversive Dems Want USA to be - Charging Down The Road to Islamization + Incremental National Suicide h…
12585,kansasdailynews,Kaine describes 'emotional moment' of Clinton's speech
12586,patriotblake,Wow! Birth control made easy Enlist in the US FREEDOM ARMY View:  Patriot central
12587,ameliebaldwin,Congressman Barletta Statement On   Victory!
12588,hollandpatrickk,"Refugee Admissions Surge 86% Year on Year: Ahead of Trump Inauguration, Obama Rushes Muslim…  htt…"
12589,ameliebaldwin,Muslims Demand Texas Mayor Surrender To Islam After She Attacked Shariah Court… Here’s Her Response
12590,hyddrox,Show Him you mean it!
12591,leroylovesusa,You never really stop missing someone  – you just learn to live around the huge gaping hole of their absence
12592,hollandpatrickk,"When two people are meant for each other, nothing can keep them apart"
12593,willisbonnerr,The truth about Trump's electoral college win? It was a DISASTER! RETWEET to make a Trumper mad
12594,mrclydepratt, lawyer has asked a judge to dismiss a Baton Rouge police officer’s lawsuit due to speculative allegations
12595,jery_robertsyo,"""Our officers take care of business"" Chief of  assures there are no ""real threats"" to police or"
12596,jeffreykahunas,Targeted  accounts
12597,hyddrox,Desperate Hillary Makes Porn Star the Centerpiece of Her Campaign
12598,med_harley,
12599,ameliebaldwin," more info at  Spread the word  We can  Nov 8,"
12600,michellearry,This bullsh*t is the problem &amp; reason why LEGITIMATE conversation is difficult    https:/…
12601,_billy_moyer_,It breaks my heart to see you crying
12602,ten_gop,"Arabs have enough money to build this👇, but they don't have enough money to take any refugees!🤔"
12603,patriototus,"Our Saturday rally Florida Goes Trump was great! Thank you for your support, patriots!🇺🇸"
12604,jacquelinisbest,Have the Russians been supplying Politico with hacked information recently stolen from the Clinton campaign?
12605,mil0blake,USA president must be strong and powerful! 😖😹
12606,cookncooks,"The ""bucket of losers"" quote appears to be the early draft of ""basket of deplorables"""
12607,emileewaren,"💥 “What Trumpism is, is the cutting through the baloney, eliminating the red tape, being frugal and practical”"
12608,baltimore0nline,Movie About President Obama’s College Years Heading to Netflix  |
12609,giselleevns,don't let other chicks to ruin your pics
12610,brianaregland,"If your ""wokeness"" is rooted in Black heteropatriarchy, you still sleep homie"
12611,giselleevns,Monday is the best day of the week
12612,mil0blake,"Of course,  Obama needs to be kicked out of the WH"
12613,wadeharriot,THE WHOLE WORLD IS WATCHING WE CAN DO THIS! The Populists WILL LANDSLIDE Nov 8=&gt; I'm ready to take down Corrupt Cl…
12614,chrixmorgan,Vote trump
12615,giselleevns,"'So, what are you going to do with your future?' - instant conversation-stopper"
12616,willisbonnerr,This Church is telling the truth!
12617,melanymelanin,▶ Subway service resumes with delays after truck hits Brooklyn overpass  
12618,klara_sauber,Exklusive Vernehmungs-Protokolle - Radmann war 76-mal ahnungslos
12619,heyits_toby,Of course Metal!!
12620,queenofthewo,"Jan 20, 2017"
12621,jeffreykahunas,1ST TOP BRASS IN FBI HAS TO BE PROSECUTED FOR WORKING FOR HILLARY-THEN FIRE EVERYONE IN DOJ &amp; STATE DEPT-
12622,patriotblake," I watched the whole interview on  last night, and Assange never once said such a thing"
12623,kateritterrrr,EXACTLY Sheriff! Likewise Hillary calling black kids 'super predators' are her voters also! Wake up People!
12624,cassieweltch,Whirled Peas
12625,giselleevns,I hope you'll get well soon!
12626,kenzdonovan,"The Reno Trump assassin, Austyn Crites, was found in  email dump"
12627,ameliebaldwin,"You can tell a great deal about a petson, by whom they idolize  idolized Margaret Sanger &amp; Sen Byrd https…"
12628,mr_clampin,"Still thinks it's hilarious to pronounce spaghetti as ""pis-ghetti"""
12629,mrclydepratt,21 Savage “Issa” With Drake &amp; Young Thug Will Never Be Officially Released
12630,paulinett,"Fam, Mackenzie already sounds like she snorts pumpkin spice latte but that little,extra disclosure at the end made me dislike the…"
12631,newspeakdaily,Trump Surrogates Say He Was Defending Himself vs Khan
12632,antonhayhay,"     BTW, I'll bet both sets of my Ancestors (Native and African) would vehemently…"
12633,jasper_fly,Obama's presidency!
12634,c__wells," crashes all over the world, anough"
12635,mrclydepratt,Put your faith in the One who created this place
12636,mr_clampin,the sky clouds up
12637,notritahart,"The man in the high sand castle"""
12638,trayneshacole,The fact that Donald Trump is selling ethnic division as opportunity for blacks is disgusting The fact that some people buy…
12639,cookncooks,"      ah chinga, yo pensé que por dinero Muchos aún pueden ju…"
12640,ameliebaldwin,"NEW:  statement on Hurricane Matthew: ""We encourage everyone to listen to their Governorsplease…"
12641,ameliebaldwin,*California considers becoming the first excommunicated state
12642,melanymelanin,▶ Friday is the Deadline to Register to Vote in the 2016 General Election  
12643,jasper_fly,Rose 
12644,lazykstafford,India auto parts supplier to invest $319M in Detroit
12645,evewebster373,With fmr TSA Chief Pistole  in DC today  comments tonight on 
12646,daileyjadon,beauties
12647,jeblary2016,playing women card in the most disgusting ways
12648,brianthelifter,I too am delighted that  did not let Pence get away with EVERY lie tho he lied so much it was impossible t…
12649,puredavie,"don't drive anywhere because then, I'd actually need more money"
12650,rosieonfleek,"As Syrian fighting intensifies, growing signs of military escalation under Trump"
12651,paulinett," OH MY GOD, is that a *young* Charles Rangel!?!"
12652,mr_clampin,Used Condoms
12653,jamie_mccarthy_,Fantasy is hardly an escape from reality It's a way of understanding it
12654,jerstoner,This same poll had Clinton up by like 20 points over Sanders several times in the weeks leading up to the primary…
12655,lazykstafford,Gitmo transfers move ahead -- meanwhile US offering $5M bounty to find two prior transfers who returned to terror https:/…
12656,cookncooks,"Funny story;  ""elected""  unanimously Post her appointment by "
12657,ten_gop,"""I have no doubt the national media is trying to rig this election with their biased coverage"" ~ "
12658,queenofthewo,that you are still talking to me
12659,emileewaren,
12660,hiimkhloe,The MSM outright refuses to investigate readily apparent links between the Republican Party and White supremacist groups
12661,puredavie,"Pain is joy when it cries, it’s my smile in disguise  – Pusha T"
12662,melanymelanin,"If you live in Bed-Stuy near Fulton and Brooklyn Ave, come get this "
12663,lazykstafford,"London is an open and tolerant city, so long as you agree with the SJWs"
12664,evewebster373,"Atlanta Plane Crash Victims Were Headed To Oxford, Miss"
12665,leroylovesusa,Musicals in Real Life: West Side Story 💪 (Probably not so tough XD
12666,ameliebaldwin,Clinton Responds to “Hillary For Prison!” Shout: “Let’s Make it Happen!” -
12667,happkendrahappy,"The witch  says Trump Foundation a fraud? Woman,  house FIRST before you criticize https:…"
12668,hiimkhloe, good news
12669,johnbranchh,Fuzzy Lumpkins
12670,heyits_toby,Croatia: Asylum Seekers Forced Back to Serbia
12671,queenofthewo,Come over  my beard fort
12672,anthonywoodboy,This is a DEAL BUSTER and why Iran cannot be trusted!  via 
12673,notritahart,Stupid people talking
12674,johnbranchh,"""Muhammad Ali transcended race—"""
12675,evagreen69,Jared from subways at a children's playground
12676,cassieweltch,Poetry Slam
12677,giselleevns,"Take a deep breath, relax and enjoy the Trump Train ride!"
12678,michellearry,"MT  Dear LORD, please bless"
12679,ten_gop,"Sheriff Clarke on  ""This is a hateful ideology, a dangerous ideology – it needs to be opposed"""
12680,malloryjared,"Actually, the new season of 'Black Mirror' is about gaming"
12681,patriotblake,NEW FACE/! why is the old one still in exile in the woods? NOPE sighted at a big $ fundraiser
12682,brianthelifter,In the middle of downtown
12683,emileewaren," As November comes to a close, let's thank those who completely demolished the  and exposed the  &amp; lies…"
12684,giselleevns,that I should stop drinking
12685,priceforpierce,"For the third time in 40 years, no Social Security increase coming"
12686,garrettsimpson_,JUST IN: Reports on climate change have disappeared from the State Department website
12687,brianaregland,"If you bring by coats and jackets to MMM Chinatown for the homeless, we will trade you tacos or beers"
12688,traceyhappymom,you're a hoe
12689,giselleevns,
12690,hyddrox,Video 2 Milo defending priest with whom he had a 'sexual relationship' at 14
12691,jeannemccarthy0,Josh Hazlewood given Player of the Match award in Australia vs New Zealand cricket test - WWOS9
12692,russilanrogov,More fake news from the Clinton News Network
12693,evagreen69,There's this store where the creatures meet
12694,leroylovesusa,Third person tweets should be illegal in addressing  -
12695,willisbonnerr,Business owners 90 Magazine offers free ad space Send 2-3 full page jpeg (300 dpi) to subs Peace
12696,ameliebaldwin,"BOMBSHELL from  ""Media orgs have actually put out, if you support Trump, your career is done here"""
12697,leroylovesusa,Blame Racism ~Fail
12698,mrclydepratt,   Voter suppression is definitely what MLK did NOT want for all of us
12699,staywoke88,"Like Brother Cornel, he's eat up with jealousy that  had the success he thought belonged to him"
12700,klara_sauber,"Watergate prosecutor on Trump-Russia links: We've ""gone beyond the smoking gun"""
12701,cookncooks," Actually, I never lock my doors But the question is still: Why?"
12702,puredavie,I wonder if Donald Trump's cell phone has comb-over minutes
12703,hiimkhloe,Beyonce dancers dressed like black panthers
12704,oaklandonline,Fact Check: Trump Immigration Speech
12705,traceyhappymom,These great awesome tweeps!
12706,kathiemrr,
12707,patriotblake,"And guess what, it's another Obama retrospective (actually an OK one) without one mention of housing or foreclosures"
12708,jassscott,Wanda Sykes ( flips off crowd for booing her anti-Trump material  # via 
12709,c__wells,"Look at all the trouble it's causing him in Iowa, and yet he doesn't yield That's what distinguishes him (and Paul btw)…"
12710,laurabaeley,By The Rundown Live Alex Jones talks with Milo Yiannopoulos about his plans to return to UC Berkeley and confront https:/…
12711,jamie_mccarthy_,
12712,emileewaren,"KEEP REPORTING TRUMP THREATS, ITS WORKING"
12713,_nickluna_,"Dios puede convertirlo en posible, ¿qué es lo único que Él te pide?, simplemente Creer!!!"
12714,kathiemrr,I'd have him move to Australia
12715,cassieweltch,Don't worry I'm working on an album! Here's something meanwhile
12716,ameliebaldwin,Travel upgrade - Trump press corps gets a larger jet in the final weeks of the 2016 campaign season
12717,mrclydepratt,Red or blue? VOTE NOW!
12718,paulinett,"The Pulse of Entertainment: ‘The Bible Experience,’ Celebrating 10 Years of Making the Bible Exciting"
12719,patriotraphael,
12720,trayneshacole,Aziz gets hilariously real about those trite celebrity voting PSAs
12721,blacknewsoutlet,"1st black model Donyale LunaDied of heroine OD, in the 70'sso beautiful"
12722,jasper_fly,Them : Bitch    Me:  Yesssss!
12723,giselleevns,"We like to call it  haha,"
12724,ameliebaldwin,"Enjoying a slice of pie and some laughs with the folks at Path Valley Family Restaurant in Spring Run, PA"
12725,patriotblake,ایسا کوئی انسان نہیں جس پر رحمت کے دروازے بند ھوں
12726,jasper_fly,Burry Hillary and Trump 100 feet under ground who ever resurfaces wins
12727,johnbranchh,protest world’s airlines exec's gathered  shareholder meeting
12728,todaybostonma,"County GOP apologizes for ""Ready for Hillary"" executioner tweet  |"
12729,ten_gop,BREAKING!!! Peña Nieto says he has had a very constructive meeting with Donald Trump!!
12730,queenofthewo,I feel safe
12731,leroylovesusa,"LOL When I was doing outside sales I was about ready to punch anyone who asked what the ""process"" was"
12732,dorothiebell,RT   : You won’t believe this man’s excuse for voting multiple times in 5 elections
12733,ameliebaldwin,Wishing ALL of  &amp;  a Glorious &amp; Victorious
12734,bleepthepolice,"is the literal, walking, breathing, definition of"
12735,ameliebaldwin,"Barry hadn't run a lemonade stand, but he's still not sure if Trump will know what to do Drain the Swamp"
12736,mr_clampin,The curious case of Benjamin snooze button
12737,klara_sauber,"Heya, ""Bonzenkarre"" abgefackelt! Der Pflegedienst-Wagen ist halt Kollateralschaden Ihr seid so Scheisse"
12738,melanymelanin,The First Massive African American Protest in US History Was Led By Children Marching Against…  
12739,paulinett,"Diego Costa will leave Chelsea this summer: been saying it since January But with both parties desperate to end it, his val…"
12740,traceyhappymom,when there is hashtag game on So why didn't you tell me
12741,mr_clampin,
12742,garrettsimpson_,Oh he's just exploiting a tragedy and irrevocably damaging conservatism insincerely? Well that makes it all better! http…
12743,judelambertusa,Fox's own poll says Trump won big
12744,giselleevns,"Both candidates have to play a ""game"" with Jigsaw"
12745,heyits_toby,Chuck Schumer wants to know more about Trump targeting ‘law-abiding innocent’ illegals Hmmm   
12746,antonhayhay,"According to an NBC News/Wall Street Journal poll released on Monday,  has opened up a double digit lead "
12747,evewebster373,Police worry woman suspected in murder-abduction may flee
12748,baobaeham,"A good life is when you assume nothing, do more, need less, dream big, smile often, laugh a lot , and realize how blesse…"
12749,melvinsroberts,"mention my one armed sister arrives at the airport with two suitcases, must go"
12750,mil0blake,Sometimes the best part of my job is that my chair swivels
12751,willisbonnerr,
12752,_nickluna_,Shocking: US Government Assassination Plots Since End of World War II
12753,ryanmaxwell_1,"I'll give you valid reasons why Syrian refugees are not welcome look up sharia law look up ""no go zones"" in Europe"
12754,thefoundingson,"Trump's message: Make America Great Again

Hillary's message: Stronger Together

One says everything, the other sai…"
12755,hyddrox,FBI Director Comey is a board member of Clinton Foundation connected bank HSBC
12756,notritahart,
12757,dorothiebell,12 Gb RAM i izlete mi ova poruka :
12758,hyddrox,America why do you continue to endorse a party that refuses to do anything for you?
12759,malloryjared,Get paid for your pictures and much more  &lt;&lt;==  visit this site
12760,kenzdonovan," When u wake, Tell us why  accepted 100k from Interface When their business is s…"
12761,ameliebaldwin,Pretty much
12762,melanymelanin, November 2016
12763,jeffreykahunas,Report: Perry Picked for Energy Dept
12764,traceyhappymom,Joel or Mike?
12765,willisbonnerr,Dunlop Tyres
12766,jasper_fly,The Dude who Really Kinda Digs That Girl With The Dragon Tattoo
12767,baobaeham,We SIMULATED how Raila will INCITE the country in this week's Edition of the 5th Estate entitled: Tyranny of LIES https:…
12768,jani_s_jac,"Trump claims gobal conspiracy, that means the whole entire world is against him, he seems really paranoid his behavior is tr…"
12769,jeannemccarthy0,"I only wish Do not let HRC be the 3rd term for Obama He will be gone in 11 months, focus on HRC"
12770,logan_whatsup, is on fire!
12771,mrclydepratt,Gadgets: Ford built a baby bed that feels like it’s driving around the neighborhood
12772,washingtonline,Clinton sending Michelle Obama to Arizona as the campaign looks at new opportunities
12773,ameliebaldwin,
12774,peterkistner,Die  tritt für eine lebenswerte Heimat überall in Deutschland ein
12775,daileyjadon,OMG = Obama Mounts Goats
12776,garrettsimpson_,Thank you! Blessing to you as well!!
12777,datwisenigga,Jordan Peele have y'all niggas scared of white women 😂😂 but he's happily marriedgenius shit
12778,ameliebaldwin,"don't stay in DC too late, you need to get home and feed your 23 cats"
12779,leroylovesusa,Ya but  PROMISED them she would NEVER go out for a steak dinner
12780,mrclydepratt,So much 🔥
12781,tpartynews,TRUMP CAMPAIGN STATEMENT ON TRUMP’S VISIT TO MEXICO
12782,malloryjared,"Playing now on  - ""Get Down (Dirty) by Torae "
12783,evagreen69,  
12784,brianaregland,"My 18 year-old brother texts me, ""Hey"" I text back, ""Yes?"" He texts back, ""Just making sure you didn't die on some train…"
12785,notritahart,I Wont Miss You
12786,leroylovesusa,LMAO Special snowflakes
12787,melanymelanin,"Sleep well, y'all Remember to dream"
12788,ten_gop,"Listen to that cheer! The People are 💯 behind Trump!

But Media propaganda doesn't want you to see this! 

Please,…"
12789,dorothiebell,The Insanity is over WE will now have a President with both feet firmly planted on the ground and not in ObazarroWorld
12790,willisbonnerr,Cardi B really did it Live from the Boogie Down 🙌🏿
12791,cassishere,FBI Corruption? GOP Lawmakers Blast DOJ For Deal On Laptops -
12792,vasilichvasili,ally funded campaign of wife of deputy FBI director who oversaw email investigation  https:…
12793,kathiemrr,Look forward to buying  creme eggs on Christmas eve
12794,giselleevns,That linguini reminds me of my pet tapeworm
12795,patriotblake,The Freedom Caucus: America’s last line of defense against government-run health care
12796,jeannemccarthy0,Amy Winehouse's father Mitch is full of shit
12797,c__wells,"RT If you don't care enough to fight for your own country,how are you going to treat mine?"
12798,aantiracist,Media Need 12-Step Program for Donald Trump Addiction  via 
12799,errivvvvers,Breaking up the election tweets with a thirst trap
12800,hyddrox,THE HARDER THE LEFTISTS in  PUSH US THE HARDER THEY WILL GET PUSHED BACK
12801,_nickluna_,did you always call your mommy when someone slapped you around or did you try
12802,priceforpierce,Stunning Survey Reveals Our Mesmerizing Milky Way - It is the first galactic survey in sub-millimeter wavelengths
12803,laurabaeley,"LEGO and Chevrolet Engineers Build Full-Scale LEGO Batmobile with 350,000 Toy Bricks"
12804,cookncooks,Now we're cooking  we still got some jewels to sift through before the trial
12805,rh0lbr00k,Wow - talk about jumping the shark!  must be worse than reported      https…
12806,giselleevns,
12807,mil0blake,Master Of Puppets
12808,leroylovesusa,dreamers tv
12809,paulinett,"Any Christian who isn't immediately outraged by the idea of a ""Muslim registry"" never gets to utter the words ""religiou…"
12810,melvinsroberts,I hear people think Trump cutting social security and not raising minimum wage will somehow help this cou…
12811,queenofthewo,Buy enough batteries for all the kiddies' toys
12812,jacquelinisbest,Help Wanted!  via 
12813,giselleevns,Hillary for prison
12814,hyddrox,Twitter is suppressing Free Speech and Supporters of 
12815,michellearry,"LSU visit coming up for nation's top prospect Rashan Gary, report says"
12816,thefoundingson," You realize you can't just show up and tell people they are wrong Do you have any facts? I still don't get you Be specific, OK?"
12817,emileewaren, Zidar Klemenčičeva rada kupuje žrebce :
12818,hyddrox,Campaign poster
12819,_nickluna_,"  Yes, the Marxist have the brainwashing down to a science Most students submit"
12820,traceyhappymom,I can't reach the remote
12821,_nickluna_,The ‘Permanent State’ has a Press Office
12822,malloryjared,ماذا جرى الى أين أنتم سائرون؟؟
12823,chicagodailynew,"PHOTO GALLERY: Protesters Gather Outside Trump Tower In Chicago, March Down State Stre"
12824,usa_gunslinger,"British Muslim: ""I Want To See Every Single Woman In This Country Covered From Head To Toe"""
